id,sentence1,sentence2,label,deepl_translated
17535,"Later in life , Toth became one of Procopio 's close friends .",Later in life Toth became one of close friends of Procopio .,1,"Sa paglipas ng panahon, naging isa si Toth sa mga matalik na kaibigan ni Procopio."
33988,"However , Grossman was later injured in the season , and temporarily relieved by Griese .","Grossman was injured later in the season , however , and temporarily relieved of Griese .",1,"Gayunpaman, nasugatan si Grossman kalaunan sa season, at pansamantalang pinalitan ni Griese."
353,No long or necessary apprenticeship is necessary to learn the demanding techniques .,No long or necessary training is necessary to learn the demanding techniques .,1,Hindi kailangan ang mahabang o kinakailangang pagsasanay upang matutunan ang mga mahihirap na teknik.
26267,"His nephews include actors Nikhil Nanda and Armaan Jain , and businessman Ranbir Kapoor .",His nephews include the actors Nikhil Nanda and Armaan Jain and businessman Ranbir Kapoor .,1,"Kabilang sa kanyang mga pamangkin sina Nikhil Nanda at Armaan Jain na mga aktor, at si Ranbir Kapoor na negosyante."
1548,The film was photographed by Rajiv Menon and edited by A. Sreekar Prasad .,The film was photographed by Rajiv Menon and processed by A. Sreekar Prasad .,1,Ang pelikula ay kinunan ni Rajiv Menon at inedit ni A. Sreekar Prasad.
43149,The 2015 -- 16 Rain or Shine Elasto Painters season is the tenth season of the franchise in the Philippine Basketball Association ( PBA ) .,The season 2015 -- 16 rain or gloss Elasto painter is the tenth season of the franchise in the Philippine Basketball Association ( PBA ) .,1,Ang 2015–16 na season ng Rain or Shine Elasto Painters ay ang ika-sampung season ng prangkisa sa Philippine Basketball Association (PBA).
23757,"The Taverniers are visited by Gidea Thompson ( Sian Martin ) , a friend of Jules ' family in Trinidad .","The Taverniers are visited by Sian Martin ( Gidea Thompson ) , a friend of Jules ' and the family in Trinidad .",1,"Binibisita ng Gidea Thompson (Sian Martin), isang kaibigan ng pamilya ni Jules sa Trinidad, ang mga Tavernier."
481,"The completed fence is located mainly in Texas , with the construction in New Mexico , Arizona and California .","The completed fence is mainly in Texas , with construction underway in New Mexico , Arizona , and California .",1,"Ang natapos na bakod ay matatagpuan pangunahin sa Texas, kasama ang konstruksyon sa New Mexico, Arizona, at California."
39525,"The zone serves eastern and central Madhya Pradesh , the southern Uttar Pradesh and northeastern Rajasthan State .","The zone serves eastern & central Madhya Pradesh , southern Uttar Pradesh , and northeastern Rajasthan state .",1,"Pinaglilingkuran ng sona ang silangang at gitnang Madhya Pradesh, ang katimugang Uttar Pradesh, at ang hilagang-silangang Rajasthan."
17760,This is the Zomi traditional dresses . The male dress are `` Puan Laisan '' and the female dress are `` Puandum '',"This is the traditional dress of Zomi , the male dresses are `` Puan Laisan '' and the female clothes are `` Puandum '' .",1,"Ito ang tradisyonal na kasuotan ng Zomi. Ang kasuotan ng lalaki ay ""Puan Laisan"" at ang kasuotan ng babae ay ""Puandum."""
2005,His some Marathi songs from other Films are :,His marathi songs are from other films :,1,Ang ilan sa mga kantang Marathi mula sa iba pang mga pelikula ay:
23666,"With the weakening of the Canadian dollar , manufacturing sales and exports rose in November and December 2015 , and employment increased .","In November and December 2015 , with the weakening in the Canadian dollar , manufacturing sales and exports increased and employment rose .",1,"Dahil sa paghina ng dolyar ng Canada, tumaas ang benta at pag-export sa pagmamanupaktura noong Nobyembre at Disyembre 2015, at lumago ang empleyo."
37857,"Burki started his career in Switzerland for a year , until he returned to Paris to work in rotogravure from 1971 to 1979 .",He started his career in Switzerland for a year until he returned to Paris from 1971 to 1979 to work in gravure .,1,"Sinimulan ni Burki ang kanyang karera sa Switzerland nang isang taon, hanggang sa bumalik siya sa Paris upang magtrabaho sa rotogravure mula 1971 hanggang 1979."
2031,Since 1984 Patricia Dale is married to Patricia Meyer and together they have two sons : Ryan ( born 1988 ) and Blake ( born 1992 ) .,Dale has been married to Patricia Meyer since 1984 and together they have two sons : Ryan ( born 1988 ) and Blake ( born 1992 ) .,1,"Mula pa noong 1984, kasal na si Patricia Dale kay Patricia Meyer at magkasama silang may dalawang anak na lalaki: sina Ryan (ipinanganak noong 1988) at Blake (ipinanganak noong 1992)."
24552,CTVglobemedia acquired the CFXJ-FM station in Toronto in 2010 from Milestone Radio .,CTVglobemedia acquired Toronto station CFXJ-FM from Milestone Radio in 2010 .,1,Nakamit ng CTVglobemedia ang istasyong CFXJ-FM sa Toronto noong 2010 mula sa Milestone Radio.
42574,"It can be found throughout the central palaearctic region , from Turkey , Cyprus and Lebanon , through Pakistan , Iran , Afghanistan and northern Iraq to Kashmir .","It is found throughout the central Palaearctic Region , from Turkey , Cyprus and Lebanon , east through Pakistan , Iran , Afghanistan and northern Iraq to Kashmir .",1,"Matatagpuan ito sa buong sentral na rehiyon ng Palaearctic, mula sa Turkey, Cyprus, at Lebanon, dumadaan sa Pakistan, Iran, Afghanistan, at hilagang Iraq hanggang sa Kashmir."
31097,"She took refuge in London with her family in 1938 , and the family settled in East Finchley in the north of England , where she attended the Tollington Hill School .","With her family she took refuge in London in 1938 , and the family settled in East Finchley , in northern England where she attended Tollington Hill School .",1,"Naghanap siya ng kanlungan sa London kasama ang kanyang pamilya noong 1938, at nanirahan ang pamilya sa East Finchley sa hilaga ng Inglatera, kung saan siya nag-aral sa Tollington Hill School."
29598,"Kirk Deighton is served over the Route 780 , Harrogate to Wetherby , and Route X70 , Kirk Deighton to Knaresborough via Wetherby and Spofforth .","Kirk Deighton is served by route 780 , Harrogate to Wetherby , and route X70 , Kirk Deighton to Knaresborough via Wetherby and Spofforth .",1,"Pinaglilingkuran si Kirk Deighton ng Ruta 780 mula Harrogate hanggang Wetherby, at ng Ruta X70 mula Kirk Deighton hanggang Knaresborough na dumadaan sa Wetherby at Spofforth."
27829,Somaiya Vidyavihar is an educational campus in the suburb of Vidyavihar in Mumbai .,Somaiya Vidyavihar is an educational campus located in the Mumbai suburb of Vidyavihar .,1,Ang Somaiya Vidyavihar ay isang kampus pang-edukasyon sa suburb ng Vidyavihar sa Mumbai.
36848,"Two new , large sports venues opened in 2001 : the Ralph Engelstad Arena and the Alerus Center .","In 2001 , two new large sports facilities were opened : the Ralph Engelstad Arena and the Alerus Center .",1,Dalawang bagong malalaking pasilidad pang-isport ang binuksan noong 2001: ang Ralph Engelstad Arena at ang Alerus Center.
32824,It was written by Jeff Melman and was directed by Tom Spezialy and Marc Cherry .,It was written by Jeff Melman and was run by Tom Spezialy and Marc Cherry .,1,Isinulat ito ni Jeff Melman at idinirek nina Tom Spezialy at Marc Cherry.
37801,"An additional study found that the direct promoter is one of many thousand proximal targets of transcription factor , Myc , in vivo .",An additional study found that the direct promoter is one of many thousands of proximal targets of the transcription factor Myc in vivo .,1,Natuklasan ng karagdagang pag-aaral na ang direktang promoter ay isa sa libu-libong malapit na target ng transcription factor na Myc in vivo.
4003,"There are numerous student organizations on the campus , including religious groups , academic groups , and student activity groups .","There are numerous student organizations available on campus , including religious groups , academic groups , and student activity groups .",1,"Maraming mga organisasyon ng mga estudyante sa kampus, kabilang ang mga relihiyosong grupo, mga akademikong grupo, at mga grupong pang-aktibidad ng mga estudyante."
31299,"Six hours later , Corey returns but Pierson does not , and Corey claims not to know where Pierson is .","Six hours later , Corey returns , but Pierson does not , and Corey claims not to know where is Pierson .",1,"Anim na oras ang lumipas, bumalik si Corey ngunit hindi si Pierson, at iginiit ni Corey na hindi niya alam kung nasaan si Pierson."
22046,The Late neolithic cultures have affinities with the spread of the Mon Khmer speaking people from Malaysia and the Ayeyarwady valley and late neolithic developments in South China .,Late Neolithic cultures have a relationship with the spread of the Mon Khmer speaking people from Malaysia and the Ayeyarwady Valley and the late Neolithic developments in southern China .,1,Ang mga kulturang huling Neolitiko ay may kaugnayan sa paglaganap ng mga taong nagsasalita ng Mon-Khmer mula sa Malaysia at lambak ng Ayeyarwady at sa mga pag-unlad ng huling Neolitiko sa Timog Tsina.
25750,"Bonchurch is situated on the southern coast of the Isle of Wight , England just to the east of the village of Monks Bay .","is located on the southern coast of the Isle of Wight , England , to the east of the village of Monks Bay .",1,"Ang Bonchurch ay matatagpuan sa katimugang baybayin ng Isle of Wight, Inglatera, sa silangan lamang ng nayon ng Monks Bay."
5124,It stars James Craig and was written by Devon and Richard Devon .,It is playing James Craig stars and was written by Devon and Richard Devon .,1,Bida rito si James Craig at isinulat ito nina Devon at Richard Devon.
6883,"Starring Holly Hunter and Tim Robbins , the series focuses on a contemporary multi-racial family in the Portland area .","The series , occupied with Holly Hunter and Tim Robbins , focuses on a contemporary multi-racial family in the Portland area .",1,"Tampok sina Holly Hunter at Tim Robbins, ang serye ay nakatuon sa isang makabagong multirasyal na pamilya sa lugar ng Portland."
9122,The teams had to use from a distance a traditional tribal club to beat the pots .,Teams had to use a traditional tribal club from a distance to hit the pots .,1,Kinailangan ng mga koponan na gumamit mula sa malayo ng isang tradisyonal na tribong baston upang paluin ang mga palayok.
4313,"Buses run from the bus stop to Baildon , Bradford , Cleckheaton , Dewsbury , Elland , Halifax , Huddersfield , Leeds , Shipley and Wakefield .","Buses run from the bus station to Baildon , Bradford , Cleckheaton , Dewsbury , Leeds , Huddersfield , Elland , Halifax , Shipley and Wakefield .",1,"Ang mga bus ay bumibiyahe mula sa hintuan ng bus papuntang Baildon, Bradford, Cleckheaton, Dewsbury, Elland, Halifax, Huddersfield, Leeds, Shipley, at Wakefield."
6517,"Soto was born in Fort Worth , but at the age of one year moved to Monterrey in Mexico .","Soto was born in Fort Worth , but moved to Monterrey , Mexico , at the age of one .",1,"Ipinanganak si Soto sa Fort Worth, ngunit nang siya ay isang taong gulang ay lumipat siya sa Monterrey sa Mexico."
24694,The River Frasin is a tributary of the River Straja in Romania .,The Frasin River is a tributary of the Straja River in Romania .,1,Ang Ilog Frasin ay isang sanga ng Ilog Straja sa Romania.
23126,In Portage township there are two villages : part of Jerry City to the south and part of Portage in the northwest .,"Two villages are located in Portage Township : part of Jerry City in the south , and part of Portage in the northwest .",1,Sa bayan ng Portage ay may dalawang nayon: ang bahagi ng Jerry City sa timog at ang bahagi ng Portage sa hilagang-kanluran.
35463,"Another kuji formula is found in the writings of Jodo Shinshu , founded by Shinran , and is yet another mantra to Amida Nyorai which reads","Another Kuji formula can be found in the writings of Jodo Shinshu , founded by Shinran , and is another mantra to Amida Nyorai , which is :",1,"Isang karagdagang kuji formula ay matatagpuan sa mga sinulat ng Jodo Shinshu, na itinatag ni Shinran, at isa na namang mantra kay Amida Nyorai na nagbabasa"
43744,"Trained by César Cielo , coach of the American swimmer Bob Bowman , at the University of Michigan , he is a childhood friend of Michael Phelps .","Trained with César Cielo , coach of American swimmer Bob Bowman , at the University of Michigan . He is a childhood friend of Michael Phelps .",1,"Sinanay ni César Cielo, coach ng Amerikanong manlalangoy na si Bob Bowman, sa Unibersidad ng Michigan, siya ay kaibigan ni Michael Phelps mula pagkabata."
39326,It was accepted that the aborigine - name of the zone simply `` Güímar '' as was the whole Menceyato .,It was accepted that the aboriginal name of the zone was simply `` Güímar '' as the whole menceyato .,1,"Tinanggap na ang pangalan ng mga katutubo – ang pangalan ng sona ay simpleng ""Güímar"", gaya ng buong Menceyato."
47626,"The others were Donald Carr from Repton School and the Etonian , Luke White .",The others were Donald Carr of the Repton School and Etonian Luke White .,1,Ang iba pa ay sina Donald Carr mula sa Repton School at ang Etonian na si Luke White.
33732,"Red Sulphur Sky is a solo album by American jazz trumpeter Wadada Leo Smith , which was released in 2001 and recorded at Tzadik Records .",Red Sulphur Sky is a solo album by American jazz trumpeter Wadada Leo Smith which was released in 2001 and recorded on Tzadik Records .,1,"Ang Red Sulphur Sky ay isang solo album ng Amerikanong jazz trumpeter na si Wadada Leo Smith, na inilabas noong 2001 at narekord sa Tzadik Records."
15198,"Vaman Malhar Joshi was not to be confused with the writer Waman Gopal Joshi , they were contemporaries .",Vaman Malhar Joshi should not be confused with the writer Waman Gopal Joshi . They were contemporaries .,1,Huwag pagkamaling i-isip si Vaman Malhar Joshi bilang manunulat na si Waman Gopal Joshi; magkasabayan sila.
24124,"Olivella kifos is a species of dwarf - sea snail , small gastropod mollusk in the Olivellidae family , the navy olives .","Olivella kifos is a species of dwarf sea snail , small gastropod mollusk in the family Olivellidae , the marine olives .",1,"Ang Olivella kifos ay isang uri ng duwende-dagat na kuhol, isang maliliit na gastropod na molusk sa pamilyang Olivellidae, na tinatawag na navy olives."
3684,The second fortress was built in stone by Alexander 's son Dmitry Alexandrovich in 1280 .,The second fortification was built in stone in 1280 by Alexander 's son Dmitry Alexandrovich .,1,"Ang ikalawang kuta ay itinayo sa bato ni Dmitry Alexandrovich, anak ni Alexander, noong 1280."
20254,"After four years it moved to Jacopo Sandri 's house , which had more space , and in 1705 moved again to the palazzo of Conte Luigi Ferdinando Marsigli .","After four years , it moved to Jacopo Sandris House , which had more space , and moved back to the Palazzo of Conte Luigi Ferdinando Marsigli in 1705 .",1,"Pagkalipas ng apat na taon, lumipat ito sa bahay ni Jacopo Sandri, na mas maluwang, at noong 1705 ay muling lumipat sa palasyo ni Conte Luigi Ferdinando Marsigli."
6307,"Of these 18 states , four of them have listed IN , PA , OH and MD `` G. villosa '' as endangered species .","Of these 18 states , four of them have listed IN , MD , OH and PA `` G. villosa '' as endangered species .",1,"Sa 18 na estado na ito, apat sa kanila ang naglista sa IN, PA, OH, at MD ng ""G. villosa"" bilang isang nanganganib na species."
17259,"Pohl-Stroher was born on 18 January 1919 in Wurzen in Saxony , Vogtland and grew up in Rothenkirchen in East Germany .","Pohl-Stroher was born on 18 January 1919 in Wurzen in Saxony , Vogtland and grew up in Rothenkirchen , East Germany .",1,"Si Pohl-Stroher ay ipinanganak noong 18 Enero 1919 sa Wurzen sa Saxony, Vogtland at lumaki sa Rothenkirchen sa Silangang Alemanya."
9906,Clara Louise Bell ( 1886 -- 1978 ) ( known as Clara Louise Janowsky ) was an American miniature painter .,Clara Louise Bell ( 1886 -- 1978 ) ( also known as Clara Louise Janowsky ) was an American miniature painter .,1,Si Clara Louise Bell (1886–1978) (kilala bilang Clara Louise Janowsky) ay isang Amerikanang pintor ng mga miniatyur.
4789,It is located in Guntur Mandal of the Mangalagiri Revenue Division .,It is located in Guntur mandal of Mangalagiri revenue division .,1,Matatagpuan ito sa Guntur Mandal ng Dibisyon ng Kita ng Mangalagiri.
4501,Navarro is a partido in the northeast of the province of Buenos Aires in Argentina .,Navarro is a partido in the northeast of Buenos Aires Province in Argentina .,1,Ang Navarro ay isang partido sa hilagang-silangan ng lalawigan ng Buenos Aires sa Argentina.
39805,Shivachevo is a small town in the Sliven Province located on the southern slopes of the Balkan Mountains in central eastern Bulgaria .,"Shivachevo is a small town in the province of Sliven , on the southern slopes of the Balkan Mountains in Central Eastern Bulgaria .",1,Ang Shivachevo ay isang maliit na bayan sa Lalawigan ng Sliven na matatagpuan sa mga katimugang dalisdis ng Kabundukan ng Balkan sa gitnang-silangang Bulgaria.
25575,"Skapetis had trials at several clubs including Derby County , Cardiff City and Sheffield United late in 2016 .","Late in 2016 , Skapetis had attempts at several clubs , including Derby County , Cardiff City , and Sheffield United .",1,"Nagkaroon si Skapetis ng mga pagsubok sa ilang mga klub kabilang ang Derby County, Cardiff City, at Sheffield United noong huling bahagi ng 2016."
10867,"On May 6 , 2016 it was announced that Palafox signed to New York Cosmos B of the National Premier Soccer League .","On 6 May 2016 , it was announced that Palafox had signed the National Premier Soccer League after New York Cosmos B .",1,"Noong Mayo 6, 2016, inanunsyo na pumirma si Palafox sa New York Cosmos B ng National Premier Soccer League."
32453,This introduction to travel began a lifelong passion that led her to study in the remote areas of Alaska and British Columbia .,This introduction to the journey began with a lifelong passion that led her to study in the remote areas of Alaska and British Columbia .,1,Ang panimulang ito sa paglalakbay ang nagpasimula ng isang panghabambuhay na hilig na nagdala sa kanya upang mag-aral sa mga liblib na lugar ng Alaska at British Columbia.
33849,"Under his direction , the choir also gave concert tours in Australia ( 1987 ) , Israel ( 1988 ) and Estonia ( 1989 , 1990 ) .","The choir also gave concert tours in Australia ( 1987 ) , Israel ( 1988 ) , and Estonia ( 1989 , 1990 ) under his leadership .",1,"Sa ilalim ng kanyang pamumuno, nagkaroon din ang koro ng mga konsiyerto sa Australia (1987), Israel (1988) at Estonia (1989, 1990)."
3729,"This book was written by Arthur Laurents , with music by Leonard Bernstein , text by Stephen Sondheim and choreography by Jerome Robbins .","The book was written by Arthur Laurents , with music by Leonard Bernstein , lyrics by Stephen Sondheim , and choreography by Jerome Robbins .",1,"Ang aklat na ito ay isinulat ni Arthur Laurents, na may musika ni Leonard Bernstein, teksto ni Stephen Sondheim, at koreograpiya ni Jerome Robbins."
27826,"In March 2008 , Sophina participated in the Heart of a Champion Invitational as a Level 10 where she won the all-around title .","In March 2008 , Sophina participated in the heart of a Champion Invitational as Level 10 , where she won the total title .",1,"Noong Marso 2008, lumahok si Sophina sa Heart of a Champion Invitational bilang Level 10 kung saan niya napanalunan ang titulong all-around."
23471,"Eurosta is a species of the Tephritidae family , known in Europe as fruit flies and in North America as wing flies .","Eurosta is a genus of the family Tephritidae , known as fruit flies in Europe and Picture wing flies in North America .",1,"Ang Eurosta ay isang uri ng pamilyang Tephritidae, na kilala sa Europa bilang mga langaw ng prutas at sa Hilagang Amerika bilang mga langaw na may pakpak."
9789,"Twin Falls High School is a public secondary school in Twin Falls , Idaho , one of the two traditional high schools operated by the Twin Falls School District .","Twin Falls High School is a public secondary school in Twin Falls , Idaho , one of two traditional high schools operated by the Twin Falls School District .",1,"Ang Twin Falls High School ay isang pampublikong paaralang sekundarya sa Twin Falls, Idaho, isa sa dalawang tradisyonal na mataas na paaralan na pinapatakbo ng Twin Falls School District."
3366,"The crash of Aerosucre Flight 4544 was the second aviation incident involving Aerosucre , the first being the crash of another Boeing 727 on November 18 , 2006 .","The crash of Aerosucre Flight 4544 was the second flight incident involving Aerosucre , the first being the crash of another Boeing 727 on November 18 , 2006 .",1,"Ang pagbagsak ng Aerosucre Flight 4544 ang pangalawang insidente sa aviasyon na kinasangkutan ang Aerosucre, ang una ay ang pagbagsak ng isa pang Boeing 727 noong Nobyembre 18, 2006."
16531,"This scene was rewritten , although its opening recitative in cut form was present in the first production .","This scene has been rewritten , although its opening recitative was present in cut form in the first production .",1,"Ang eksenang ito ay muling isinulat, bagaman ang pambungad nitong recitative sa cut form ay naroon na sa unang produksiyon."
24249,"The first settlers were Dr. Henry Clay Fish , Richard Dobbs and James G. Christian , all coming from Missouri to Illinois .","The first settlers were Dr. Henry Clay Fish , Richard P. Dobbs and James G. Christian , who all came to Illinois from Missouri .",1,"Ang mga unang nanirahan ay sina Dr. Henry Clay Fish, Richard Dobbs, at James G. Christian, na lahat ay galing sa Missouri patungong Illinois."
36471,"Following the death of his father , King George , he was elected King on 4th March 1827 in the presence of James Holman .","After the death of his father , King George , he was elected king in the presence of James Holman on 4 March 1827 .",1,"Pagkamatay ng kanyang ama, si Haring George, siya ay hinirang na Hari noong ika-4 ng Marso 1827 sa harap ni James Holman."
18236,"The bay is centred ( British mapping 1968 , Bulgarian mapping in 1993 and detailed Spanish mapping in 2005 and 2009 ) .","The bay is centred at ( British mapping in 1968 , Bulgarian mapping in 1993 , and detailed Spanish mapping in 2005 and 2009 ) .",1,"Ang golpo ay nasa gitna (mapa ng Britanya noong 1968, mapa ng Bulgaria noong 1993, at detalyadong mapa ng Espanya noong 2005 at 2009)."
213,"Alycia Moulton defeated Billie Jean King at 6 -- 0 , 7 -- 5 .","Alycia Moulton defeated Billie Jean King 6 -- 0 , 7 -- 5 .",1,"Tinalo ni Alycia Moulton si Billie Jean King sa iskor na 6–0, 7–5."
47702,This was a limited release -- only 300 red vinyl and 200 black vinyl copies were put out .,This was a limited release -- only 300 red vinyl and 200 black vinyl copies were issued .,1,Ito ay isang limitadong paglabas -- 300 kopya ng pulang vinyl at 200 kopya ng itim na vinyl lamang ang inilabas.
4760,John Ikin ( born 1957 in Lower Hutt ) is a furniture designer from New Zealand .,Humphrey John Ikin ( born 1957 in Lower Hutt ) is a New Zealand furniture designer .,1,Si John Ikin (ipinanganak noong 1957 sa Lower Hutt) ay isang taga-disenyo ng muwebles mula sa New Zealand.
4778,"In addition to artificial insemination by rams , natural insemination and embryo transfers have been used in sheep breeding programs for many years in Australia and New Zealand .","In addition to artificial insemination by rams , natural insemination and embryo transfers in sheep farming programmes have been used for many years in Australia and New Zealand .",1,"Bukod sa artipisyal na inseminasyon gamit ang mga tupa, ginamit na rin ang natural na inseminasyon at paglilipat ng embriyo sa mga programa ng pagpaparami ng tupa sa loob ng maraming taon sa Australia at New Zealand."
42437,"The song was originally produced by Johnny J and features Hurt-M-Badd , Big Syke , Mopreme Shakur , Yaki Kadafi & E.D.I..","The song was originally produced by Johnny J and features Hurt-M-Badd , Big Syke , Mopreme Shakur , Yaki Kadafi 's E.D.I .",1,"Ang kanta ay orihinal na pinrodyus ni Johnny J at tampok sina Hurt-M-Badd, Big Syke, Mopreme Shakur, Yaki Kadafi, at E.D.I."
43324,The vesicular monoamine transporter ( VMAT ) is a transport protein integrated into the membrane of synaptic vesicles of presynaptic neurons .,The Vesicular Monoamine Transporter ( VMAT ) is a transport protein that is integrated into the membrane of synaptic vesicles of presynaptic neurons .,1,Ang vesicular monoamine transporter (VMAT) ay isang transport protein na nakapaloob sa membrano ng mga sinapikong vesikulo ng mga presinaptikong neuron.
25628,"In many problems , it is more convenient to work with D and the total charges than with E and the free charge .","In the case of many problems , it is more convenient to work with D and total fees than with E and the free charge .",1,"Sa maraming problema, mas maginhawa na gamitin ang D at ang kabuuang singil kaysa sa E at ang malayang singil."
49182,"Of Scotland , His father had been a blacksmith and an inventor , and had worked with iron rope in California .",His father had been a blacksmith and inventor and had worked with an iron rope in California .,1,"Taga-Scotland, ang kanyang ama ay naging panday at imbentor, at nagtrabaho sa bakal na lubid sa California."
