id,sentence1,sentence2,label,deepl_translated
29568,"The estuary of the Batten Kill is in East Dorset , Vermont , and the source of the river is in Easton , New York .","The mouth of the Batten Kill is in East Dorset , Vermont , and the source of the river is in Easton , New York .",1,"Ang estuaryo ng Batten Kill ay nasa East Dorset, Vermont, at ang pinagmulan ng ilog ay nasa Easton, New York."
45829,"La tempestad ( International translation : The Tempest , dubbed The Storm by Univision ) is a 2013 Mexican telenovela produced by Salvador Mejía Alejandre for Televisa .","La Tempestad ( International Translation : The Storm , called by Univision the Storm ) is a 2013 Mexican telenovela produced by Salvador Mejía Alejandre for Televisa .",1,"La Tempestad (internasyonal na pagsasalin: The Tempest, tinawag na The Storm ng Univision) ay isang telenobela ng Mehiko noong 2013 na iprodyus ni Salvador Mejía Alejandre para sa Televisa."
46990,"Since 2006 , when Josephine Alhanko placed himself in the Top 20 , Cerljen was the first delegate from Sweden to the international final .",Cerljen was also the first delegate from Sweden at the international final since 2006 when Josephine Alhanko placed in the Top 20 .,1,"Mula noong 2006, nang mapasama si Josephine Alhanko sa Top 20, si Cerljen ang kauna-unahang delegado mula sa Sweden sa pandaigdigang final."
13893,"He married Lady Florence Jane Taylour , daughter of Amelia Thompson , 3rd Marquess of Headfort and Thomas Taylour , on 5 August 1875 .","He married Lady Florence Jane Taylour , the daughter of Amelia Thompson , 3rd Marquess of Headfort and Thomas Taylour , on 5 August 1875 .",1,"Ikinasal siya kay Lady Florence Jane Taylour, anak nina Amelia Thompson, ikatlong Markes ng Headfort, at Thomas Taylour, noong ika-5 ng Agosto 1875."
41986,Elati is a village in the Kozani Regional Unit in Greece .,"Elati is a village in the Kozani regional unit , Greece .",1,Ang Elati ay isang nayon sa Rehiyonal na Yunit ng Kozani sa Gresya.
1690,He had four siblings : twins Hope Gimbel and Caral Gimbel and the twins Peter Gimbel and David Gimbel .,He had four siblings : twins Peter Gimbel and David Gimbel ; and twins Hope Gimbel and Caral Gimbel .,1,"May apat siyang kapatid: ang kambal na sina Hope Gimbel at Caral Gimbel, at ang kambal na sina Peter Gimbel at David Gimbel."
3098,"In addition , they are physically active , free to learn and eager to explore .","In addition , they are actively physically active , free to learn and eager to explore .",1,"Bukod dito, sila ay pisikal na aktibo, malaya sa pagkatuto, at sabik na mag-eksplora."
26108,"Solomons was born in Orsett , Essex and brought up with his four siblings in Thorpe Bay by his mother and father .","Solomons was born in Orsett , Essex and with his four siblings in Thorpe Bay brought up by his mother and his father .",1,"Ipinanganak si Solomons sa Orsett, Essex at pinalaki kasama ang kanyang apat na kapatid sa Thorpe Bay ng kanyang ina at ama."
26641,"Regardless of quick sorrow , he was known for his spiritual understanding and discipline .","He was known for his spiritual understanding and discipline , regardless of quick suffering .",1,"Sa kabila ng panandaliang kalungkutan, kilala siya sa kanyang espirituwal na pag-unawa at disiplina."
23768,"Other invitations followed and more sisters arrived for a hospital in Iloilo , schools in Vigan , Tuguegarao and Manila and a leprosary in Culion .","Other invitations followed and more Sisters arrived for a hospital in Iloilo , schools in Vigan , Tuguegarao , and Manila , and a Leprosarium in Culion .",1,"Sumunod pang mga paanyaya at dumating pa ang mas maraming mga madre para sa isang ospital sa Iloilo, mga paaralan sa Vigan, Tuguegarao at Maynila, at isang leprosaryo sa Culion."
39715,"In 1975 a group of five young photographers ( including Bronson Fellow Christopher Rauschenberg , son of Robert Rauschenberg ) pooled their resources to start a small gallery .","In 1975 , a group of five young photographers ( including Bronson Fellow Christopher Rauschenberg , son of Robert Rauschenberg ) collected their resources to start a small gallery .",1,"Noong 1975, pinagsama-sama ng limang kabataang potograpo (kabilang si Bronson Fellow Christopher Rauschenberg, anak ni Robert Rauschenberg) ang kanilang mga mapagkukunan upang magtayo ng isang maliit na galeriya."
23,"In mathematical astronomy , his fame is due to the introduction of the astronomical globe , and his early contributions to understanding the movement of the planets .",His fame is due in mathematical astronomy to the introduction of the astronomical globe and to his early contributions to the understanding of the movement of the planets .,1,"Sa matematikal na astronomiya, ang kanyang katanyagan ay dahil sa pagpapakilala ng astronomikal na globo at sa kanyang mga maagang ambag sa pag-unawa ng paggalaw ng mga planeta."
24797,"From 1898 to 1902 , about 1,300 birds were imported from America and released from Southland to Northland in many parts of the North and South Islands .","From 1898 to 1902 , some 1300 birds were imported from America and released in many parts of the North and South Islands , from Southland to Northland .",1,"Mula 1898 hanggang 1902, humigit-kumulang 1,300 na ibon ang inangkat mula sa Amerika at pinalaya mula sa Southland patungong Northland sa maraming bahagi ng Hilagang Pulo at Katimugang Pulo."
34886,"The five elected candidates were Bahrain , Brazil , Gabon , Gambia and Slovenia .","The five candidates elected were Bahrain , Brazil , Gabon , Gambia , and Slovenia .",1,"Ang limang nahalal na kandidato ay Bahrain, Brazil, Gabon, Gambia at Slovenia."
4410,The next two functions are analogous to the above two functions and are used for base clusters .,The next two functions are analogous to the above two and are used for base clusters .,1,Ang susunod na dalawang function ay katulad ng sa nakaraang dalawang function at ginagamit para sa mga base cluster.
9941,The Squadron RAF was a unit of the Royal Air Force in Egypt during the Second World War and then in Italy and North Africa .,651 Squadron RAF was a unit of the Royal Air Force in Egypt during the Second World War and afterwards in Italy and North Africa .,1,Ang Squadron RAF ay isang yunit ng Royal Air Force sa Ehipto noong Ikalawang Digmaang Pandaigdig at pagkatapos ay sa Italya at Hilagang Aprika.
4704,The 1983 TV movie `` Sam Elliott : The Empty Copper Sea '' starred Travis McGee .,The TV movie 1983 `` Sam Elliott : The Empty Copper Sea '' played Travis McGee .,1,"Ang 1983 na pelikulang pang-telebisyon na ""Sam Elliott: The Empty Copper Sea"" ay pinagbidahan ni Travis McGee."
43116,"Bentley and carvings by Hugh Stannus , while the meeting room contains a decorative ceiling by Thomas Earp .",Bentley and carvings by Hugh Stannus while the board room contains a decorative ceiling by Thomas Earp .,1,"Ang Bentley at mga ukit ni Hugh Stannus, habang ang silid-pulong ay may palamuting kisame ni Thomas Earp."
39241,"In bioinformatics , inverted indexes are very important in the sequence assembly of short fragments of sequenced DNA .","In bioinformatics , inverted indices in the sequence assembly of short fragments of sequenced DNA are very important .",1,"Sa bioinformatics, napakahalaga ng mga inverted index sa pagsasanib ng mga maikling fragment ng na-sequence na DNA."
39290,"It is endemic to Hawaii , where it is known only from the northern Koolau Mountains of Oahu .","It is endemic to Hawaii , where it is only known from the northern Koolau Mountains of Oahu .",1,"Endemiko ito sa Hawaii, kung saan kilala lamang ito mula sa hilagang Kabundukan ng Koolau sa Oahu."
1923,"The album contains 16 tracks recorded during two May 2002 performances , one in Memphis , Tennessee , and the other in Chicago , Illinois .","The album contains 16 tracks recorded during two appearances in May 2002 , one in Memphis , Tennessee , and the other in Chicago , Illinois .",1,"Ang album ay naglalaman ng 16 na kanta na naitala sa dalawang pagtatanghal noong Mayo 2002, isa sa Memphis, Tennessee, at ang isa pa sa Chicago, Illinois."
104,Ruffell was employed as an engineer in Southampton Docks and died on 3 October 1940 in Southampton on his 73rd birthday .,"Ruffell was employed as an engineer in Southampton Docks . He died in Southampton on his 73rd birthday , 3 October 1940 .",1,Si Ruffell ay nagtrabaho bilang inhinyero sa Southampton Docks at namatay noong ika-3 ng Oktubre 1940 sa Southampton sa kanyang ika-73 kaarawan.
22637,The tendered speed limit is generally reduced as low as within the two cities .,"The posted speed limit is generally , reduced as low as within the two cities .",1,Ang inihandang limitasyon ng bilis ay karaniwang binabawasan hanggang sa pinakamababa sa pagitan ng dalawang lungsod.
4131,"Adam Ludwik Czartoryski was married to Prince Maria , married on August 31 , 1901 in Warsaw .","Adam Adam Ludwik Czartoryski was married to Prince Maria , who married in Warsaw on 31 August 1901 .",1,"Si Adam Ludwik Czartoryski ay ikinasal kay Prinsipe Maria noong Agosto 31, 1901 sa Warsaw."
38621,"In 1955 , Johannes Herman Johannes married Annie Marie Gilbertine Amalo .",Annie Marie Gilbertine Amalo married Herman Johannes in 1955 .,1,"Noong 1955, nagpakasal si Johannes Herman Johannes kay Annie Marie Gilbertine Amalo."
4221,"C2c uses Class 357 and Class 387 units on the London , Tilbury and Southend Railway from Shoeburyness and Southend to London Fenchurch Street .","C2c uses Class 357 and Class 387 units on services down the London , Tilbury and Southend Railway line from Shoeburyness and Southend to London Fenchurch Street .",1,"Gumagamit ang C2c ng mga yunit ng Class 357 at Class 387 sa London, Tilbury and Southend Railway mula Shoeburyness at Southend papuntang London Fenchurch Street."
45606,"In 1958 he spoke throughout East Asia and in Western Europe , and in 1961 in Northern Ghana .",In 1958 he spoke throughout East Asia and Western Europe and in 1961 in Northern Ghana .,1,"Noong 1958, nagsalita siya sa buong Silangang Asya at sa Kanlurang Europa, at noong 1961 sa Hilagang Ghana."
36703,"In addition , the song `` Calling All Angels '' is included in the film by Jane Siberry and is played on the audio track .","In addition , the song `` Calling All Angels '' by Jane Siberry is included in the film and is played on the soundtrack .",1,"Bilang karagdagan, kasama sa pelikula ang kantang ""Calling All Angels"" ni Jane Siberry at pinatutugtog ito sa audio track."
5914,"The area was once served by Edinburgh Waverley Railway Station , which provided direct access to the railway to Corstorphine .",The area was once served by Edinburgh Waverley railway station which provided direct railway access to Corstorphine .,1,"Noong una, pinaglilingkuran ang lugar ng Edinburgh Waverley Railway Station, na nagbigay ng direktang daan patungo sa riles papuntang Corstorphine."
18516,Morris Township is located in the 25th Congressional District and is part of the 11th State Legislative District of New Jersey .,Morris Township is located in the 25th Congressional District and is part of New Jersey 's 11th state legislative district .,1,Ang Morris Township ay matatagpuan sa ika-25 Distrito Kongresyonal at bahagi ng ika-11 Distrito ng Lehislatura ng Estado ng New Jersey.
23134,"He died on 24 August 1878 in Wyandotte ( now part of Kansas City ) , Kansas .","He died in Wyandotte ( now a part of Kansas ) , Kansas City , August 24 , 1878 .",1,"Pumanaw siya noong ika-24 ng Agosto 1878 sa Wyandotte (na ngayon ay bahagi ng Kansas City), Kansas."
16734,"In the , Daniel Dewey ( F ) resigned February 24 , 1814 and was replaced in a special election by John W. Hulbert ( F )","In Daniel Dewey ( F ) resigned February 24 , 1814 , and was replaced by a special election of John W. Hulbert ( F ) .",1,"Sa , nagbitiw si Daniel Dewey ( F ) noong Pebrero 24, 1814 at pinalitan sa isang espesyal na halalan ni John W. Hulbert ( F )"
5512,ObjecTime Developer ( or ObjecTime or OTD ) is a software automation tool designed to meet the development needs of short-term software development teams .,"ObjecTime Developer ( or ObjecTime or OTD , for real ) is a software automation tool designed to meet the development needs of short-time software development teams .",1,Ang ObjecTime Developer (o ObjecTime o OTD) ay isang software automation tool na idinisenyo upang matugunan ang mga pangangailangan sa pag-unlad ng mga pansamantalang koponan sa pag-develop ng software.
1512,Manipur is also a tourist hotspot in the state of Ukhrul .,Manipur is also a tourist hotspot of Ukhrul state .,1,Ang Manipur ay isa ring patok na destinasyon ng mga turista sa lalawigan ng Ukhrul.
40859,"Music is in his blood because he inherited this art from his grandfather , Ustad Banne Khan , who is himself a singer .",Music runs in his blood as he has inherited this art from his grandfather Ustad Banne Khan who is a singer himself .,1,"Nasa dugo niya ang musika dahil minana niya ang sining na ito mula sa kanyang lolo, si Ustad Banne Khan, na siya mismo ay isang mang-aawit."
17094,"Balıklı is a village in the District of Gümüşhacıköy , Amasya Province , Turkey .","Balıklı is a village in the district Gümüşhacıköy , Turkey , province of Amasya .",1,"Ang Balıklı ay isang nayon sa Distrito ng Gümüşhacıköy, Lalawigan ng Amasya, Turkey."
4885,"He was created a doctor of the Sorbonne , and afterwards elected prior of St. Edmund 's in 1689 .","He was created a doctor of the Sorbonne , and later elected Prior of St. Edmund in 1689 .",1,"Ginawang doktor siya ng Sorbonne, at pagkatapos ay hinirang na prior ng St. Edmund's noong 1689."
6317,"The new year , the spring , the wine and the joyful are also loved .","Also , The new year , the spring , the wine and the joyful are beloved .",1,"Ang bagong taon, ang tagsibol, ang alak at ang kagalakan ay minamahal din."
38138,In the 1970s Suzuki was one of the first buyers of Woolrich fashion in Japan . In 2006 he became a designer for Woolrich Woolen Mills in America .,In the 1970s Suzuki was one of the first buyers of Woolrich Mode in Japan and became Designer for Woolrich Woolen Mills in America in 2006 .,1,"Noong dekada 1970, isa si Suzuki sa mga unang mamimili ng moda ng Woolrich sa Japan. Noong 2006, naging taga-disenyo siya para sa Woolrich Woolen Mills sa Amerika."
15523,"An alternative extension to compact groups is the Peter -- Weyl theorem , which proves results about representations of compact groups analogous to those about finite groups .","An alternative extension to compact groups is the Peter -- Weyl -- Theorem , which shows results about representations of compact groups analogous to those about finite groups .",1,"Isang alternatibong pagpapalawig sa mga compact na grupo ang Teorema ni Peter–Weyl, na nagpapatunay ng mga resulta tungkol sa representasyon ng mga compact na grupo na katulad ng sa mga finite na grupo."
48700,"In order to obtain a biomarker for diagnostics , the sample material must be as easy to use as possible .","In order to obtain a biomarker for diagnostics , the sample material must be as simple as possible to use .",1,"Upang makakuha ng biomarker para sa diagnostika, dapat na maging kasing-dali ng posibleng gamitin ang materyal na sample."
8725,Protein FAM40A is a protein that is located on chromosome 1 in humans and is encoded by the `` FAM40A '' gene .,FAM40A is a protein that is chromosome 1 in humans and is encoded by the `` FAM40A '' gene .,1,"Ang protinang FAM40A ay isang protina na matatagpuan sa kromosoma 1 sa mga tao at ini-encode ng gen na ""FAM40A""."
23582,The screenplay by Robert Carrington and Jane-Howard Carrington is based on the 1966 play by Frederick Knott .,The screenplay by Robert Carrington and Jane - Howard Carrington is based on the 1966 play by Frederick Knott .,1,Ang screenplay nina Robert Carrington at Jane-Howard Carrington ay batay sa dula noong 1966 ni Frederick Knott.
29849,"For scalar spectral fluctuations , formula _ 9 is referred to as the scalar index , with formula _ 10 corresponding to scale invariant fluctuations .","For scalar spectral fluctuations , Formula 9 is referred to as the scalar index , with the formula 10 corresponding to scalar invariant fluctuations .",1,"Para sa mga scalar na spectral na pag-uga, tinutukoy ang pormula 9 bilang scalar index, habang ang pormula 10 naman ay tumutukoy sa mga pag-uga na hindi nag-iiba sa anumang sukat."
21573,"Kerwin Moore would see action in 24 games for the Athletics that fall , and was traded to the Florida Marlins after the season in exchange for Abbott .","Kerwin Moore saw action in 24 games for the athletics that fall , and was traded to the Florida - Marlins after the season in exchange for Abbott .",1,"Si Kerwin Moore ay nakalaro sa 24 na laro para sa Athletics noong taglagas na iyon, at ipinagpalit siya sa Florida Marlins pagkatapos ng season kapalit ni Abbott."
36465,"Dorchester is sometimes associated with Avenue D , since Ditmas and Ditmas Avenue and Dorchester Road start with the letter `` D '' .","Dorchester are sometimes associated with Avenue D , since Ditmas and Ditmas Avenue and Dorchester Road start with the letter `` D '' .",1,"Minsan ay iniuugnay ang Dorchester sa Avenue D, dahil ang Ditmas at Ditmas Avenue at ang Dorchester Road ay nagsisimula sa letrang ""D""."
27861,"The Russian villain is , however , an original and sometimes interesting danger .","The Russian villain , however , is an original and sometimes interesting menace. ``",1,"Ang kontrabida na Ruso ay, gayunpaman, isang orihinal at kung minsan ay kawili-wiling panganib."
19223,It was believed that true philosophy could be separated from popular wisdom by this method .,It was believed by this method true philosophy could be separated from popular wisdom .,1,Ipinaniniwala na sa pamamagitan ng pamamaraang ito ay maaaring paghiwalayin ang tunay na pilosopiya mula sa karaniwang karunungan.
46127,"He sang with success also at La Fenice in Naples , at the Maggio Musicale Fiorentino in Florence and at the Teatro San Carlo in Venice .","He also sang with success at La Fenice in Naples , the Maggio Musicale Fiorentino in Florence , and the Teatro San Carlo in Venice .",1,"Matagumpay din siyang kumanta sa La Fenice sa Naples, sa Maggio Musicale Fiorentino sa Florence, at sa Teatro San Carlo sa Venice."
3785,He is a professor of adult education at Åbo Akademi University in Finland ( Vaasa ) .,"He is a Professor of Adult Education at Åbo Akademi University in Vaasa , Finland .",1,Siya ay propesor ng edukasyon para sa mga matatanda sa Åbo Akademi University sa Finland (Vaasa).
6714,It was created with the redistribution in 1972 and replaced the abolished Toowoomba East .,"It was created with the 1972 redistribution , and replaced the abolished Toowoomba East .",1,Itinatag ito sa muling pamamahagi noong 1972 at pinalitan ang inalis na Toowoomba East.
47971,"`` , Williams turned heel and reformed the British Invasion with Magnus by attacking the team of Eric Young and Orlando Jordan .",Williams turned the heel and reformed the British invasion with Magnus by attacking the Eric Young and Orlando Jordan team .,1,", nagbago si Williams at muling binuo ang British Invasion kasama si Magnus sa pamamagitan ng pag-atake sa koponan nina Eric Young at Orlando Jordan."
3891,"Shaffer Creek is an tributary of Raystown Branch Juniata River ( Brush Creek ) in Bedford County , Pennsylvania in the United States .","Shaffer Creek is a tributary of the Raystown Branch Juniata River ( Brush Creek ) in Bedford County , Pennsylvania , United States .",1,"Ang Shaffer Creek ay isang sanga ng Raystown Branch ng Ilog Juniata (Brush Creek) sa Bedford County, Pennsylvania, Estados Unidos."
2661,"He was survived by his wife , former Barbara Crutchley , his sons Norman F. Boas and Donald P. Boas and his daughter , Helen Tuthill Sisson .","He was survived by his wife , the former Barbara Crutchley , his sons Norman F. Boas and Donald P. Boas , and his daughter Helen Tuthill Sisson .",1,"Naiwan siyang mabuhay ng kanyang asawa, ang dating Barbara Crutchley, ng kanyang mga anak na lalaki na sina Norman F. Boas at Donald P. Boas, at ng kanyang anak na babae na si Helen Tuthill Sisson."
32792,"In 1992 , he was elected Croydon North West for the first time after having previously denied the seat unsuccessfully in 1987 .",He was first elected in 1992 for Croydon North West after having previously contested the seat unsuccessfully in 1987 .,1,"Noong 1992, siya ay nahalal sa Croydon North West sa unang pagkakataon matapos niyang hindi matagumpay na makuha ang upuan noong 1987."
1941,"Farrer was born in London , the younger brother of Thomas Charles Farrer , an artist .","Farrer was born in London , the younger brother of artist Thomas Charles Farrer .",1,"Ipinanganak si Farrer sa London, nakababatang kapatid ni Thomas Charles Farrer, isang alagad ng sining."
323,He also wrote a large number of vocal arrangements and orchestral accompaniments to varieties .,He also wrote a large number of vocal arrangements and orchestral accompaniments for varieties .,1,Nagsulat din siya ng maraming vocal arrangement at orchestral accompaniment para sa iba't ibang uri.
42408,"Eileen Chong was born in Singapore in 1980 , moved to Sydney in 2007 .","Eileen Chong was born in 1980 in Singapore . She moved to Sydney , Australia in 2007 .",1,Si Eileen Chong ay ipinanganak sa Singapore noong 1980 at lumipat sa Sydney noong 2007.
39,"He was born in New York City in East Broadway on October 23 , 1806 .","He was born on 23 October 1806 in New York , East Broadway .",1,"Ipinanganak siya sa Lungsod ng New York sa East Broadway noong Oktubre 23, 1806."
45491,"A market was perceived for future tours and destinations , Scandinavia followed in April 1975 and in September followed another tour to Switzerland .",A market was perceived for future tours and destinations . Scandinavia followed in April 1975 and there was another tour to Switzerland in September .,1,"Napansin ang isang merkado para sa mga hinaharap na paglilibot at mga destinasyon; sinundan ito ng Scandinavia noong Abril 1975, at noong Setyembre ay sinundan pa ng isa pang paglilibot sa Switzerland."
17394,Homer Township was established by a division of Albion Township in 1837 .,Homer Township was founded in 1837 by a division of Albion Township .,1,Itinatag ang Homer Township sa pamamagitan ng paghahati ng Albion Township noong 1837.
39888,"Inception is a science fiction film from 2010 , co-produced by Emma Thomas and written , co-produced and staged by Christopher Nolan .","Inception is a science fiction film from 2010 , written , co-produced and staged by Christopher Nolan and co-produced by Emma Thomas .",1,"Ang Inception ay isang pelikulang science fiction noong 2010, na co-produced ni Emma Thomas at isinulat, co-produced, at dinirek ni Christopher Nolan."
39077,"He was likely the son of the painter Girolamo Danti , also from Pesaro , who had married the sister of the painter Giovanni Antonio Pandolfi .","He was probably the son of painter Girolamo Danti , also from Pesaro who married the sister of the painter Giovanni Antonio Pandolfi .",1,"Malamang siya ang anak ng pintor na si Girolamo Danti, na taga-Pesaro rin, na ikinasal sa kapatid ng pintor na si Giovanni Antonio Pandolfi."
34073,"Portsmouth won 4 -- 1 , with goals of Bert Barlow , John Anderson and two from Cliff Parker .","Portsmouth won 4 -- 1 , with goals from Bert Barlow , John Anderson and two by Cliff Parker .",1,"Nanalo ang Portsmouth ng 4-1, na may mga goal mula kina Bert Barlow, John Anderson, at dalawa mula kay Cliff Parker."
31963,"The 8 talukas of this district are Devgad , Kankavli , Malvan , Kudal , Sawantwadi , Vengurla and Dodamarg and Vaibhavwadi .","The 8 Talukas of this area are Devgad , Kankavli , Malvan , Kudal , Sawantwadi , Vengurla and Dodamarg and Vaibhavwadi .",1,"Ang walong taluka ng distritong ito ay Devgad, Kankavli, Malvan, Kudal, Sawantwadi, Vengurla, Dodamarg, at Vaibhavwadi."
9931,Dowa s a district in the Central Region of Malawi . The capital is Dowa .,Dowa is a district in the central region of Malawi with the capital Dowa .,1,Ang Dowa ay isang distrito sa Rehiyon ng Sentral ng Malawi. Ang kabisera nito ay Dowa.
6905,The NFL Europe League season 1999 was the fifth season for the franchise in the Rhine Fire ( NFLEL ) .,The 1999 NFL Europe League season was the fifth season for the franchise in the Rhein Fire ( NFLEL ) .,1,Ang panahon ng 1999 ng NFL Europe League ang ikalimang panahon para sa prangkisa sa Rhine Fire (NFLEL).
42181,Dunne played in Dublin with Stella Maris before playing in England for Everton .,She played with Stella Maris in Dublin before playing for Everton in England .,1,Naglaro si Dunne sa Dublin kasama ang Stella Maris bago maglaro sa Inglatera para sa Everton.
2457,"The 1962 U.S. United States Senate election was held on November 6 , 1962 to select the South Carolina .","The U.S. Senate election of 1962 was held on November 6 , 1962 to select the South Carolina .",1,"Ang halalan sa Senado ng Estados Unidos noong 1962 ay ginanap noong Nobyembre 6, 1962 upang piliin ang South Carolina."
27816,"In February 2016 , it was announced that Steve Poizner has joined Governor John Kasich of Ohio as National Co Chairman and California State Chairman for Kasich as President .",In February 2016 it was announced that Steve Poizner has joined Governor John Kasich of Ohio as National Co Chairman and California State Chairman for Kasich for President .,1,"Noong Pebrero 2016, inanunsyo na sumali si Steve Poizner kay Gobernador John Kasich ng Ohio bilang Pambansang Co-Chairman at Estado ng California Chairman para sa Kasich bilang Pangulo."
5136,Mark Williams is played in the TV series by Olaf Petersen .,Mark Williams is played by Olaf Petersen in the television series .,1,Ang papel ni Mark Williams sa serye sa telebisyon ay ginagampanan ni Olaf Petersen.
