id,sentence1,sentence2,label,deepl_translated
9433,"The team 's statistical leaders included Kyle Boller , with 1,741 passing yards , Charon Arnold with 688 Rushing Yards , and Terrell Williams with 606 reception - Yards .","The team 's statistical leaders included Kyle Boller with 1,741 passing yards , Charon Arnold with 688 rushing yards and Terrell Williams with 606 receiving yards .",1,"Kasama sa mga nangungunang estadistika ng koponan sina Kyle Boller na may 1,741 yarda sa pasa, si Charon Arnold na may 688 yarda sa pagtakbo, at si Terrell Williams na may 606 yarda sa pagtanggap."
10555,"However , Szabo 's method of double-spending protection was vulnerable to Sybil attacks .","Szabo 's method of double protection , however , was vulnerable to Sybil attacks .",1,"Gayunpaman, ang paraan ni Szabo para maiwasan ang dobleng paggastos ay mahina laban sa mga pag-atake ng Sybil."
6719,"Vidyanandana , Shri Suryavarmadeva , or Cham , was a Suryavarman prince in Cambodia , who in 1182 put down a revolt that broke out at Malyang against Jayavarman VII .","Vidyanandana , Shri Suryavarmadeva , or Cham , was a Suryavarman prince in Cambodia , who broke down a revolt in 1182 that erupted in Malyang against Jayavarman VII .",1,"Si Vidyanandana, Shri Suryavarmadeva, o Cham, ay isang prinsipe ng Suryavarman sa Cambodia na noong 1182 ay pinigilan ang isang pag-aalsa na sumiklab sa Malyang laban kay Jayavarman VII."
34689,"On June 30 , 2016 , Infante agreed to a minor league deal with the Braves . He was released by the Atlanta Braves on August 16 , 2016 .","On 30 June 2016 , Infante agreed to a Minor League Deal with the Braves and was released by the Atlanta Braves on August 16 , 2016 .",1,"Noong Hunyo 30, 2016, pumayag si Infante sa isang kontratang minor league sa Braves. Pinalaya siya ng Atlanta Braves noong Agosto 16, 2016."
5644,"Neighboring communities include Libertyville , Mundelein , Round Lake Park , Hainesville , Round Lake Beach , Lindenhurst , Third Lake , Gages Lake and Wildwood .","Neighbouring communities include Libertyville , Mundelein , Round Lake Park , Hainesville , Round Lake Beach , Lindenhurst , Third Lake , Gages Lake and Wildwood .",1,"Kasama sa mga kalapit na pamayanan ang Libertyville, Mundelein, Round Lake Park, Hainesville, Round Lake Beach, Lindenhurst, Third Lake, Gages Lake, at Wildwood."
47225,"In 2015 , municipal elections for Serampore Municipality Congress won 22 seats , CPI ( M ) 4 seats , Trinamool - Congress 1 seat and Independent 2 seats .","In the 2015 , municipal elections for Serampore Municipality Congress won 22 seats , CPI ( M ) 4 seats , Trinamool Congress 1 seat and Independents 2 seats .",1,"Noong 2015, sa halalang munisipal ng Serampore, nanalo ang Kongreso ng 22 upuan, ang CPI(M) ng 4 na upuan, ang Trinamool–Kongreso ng 1 upuan, at ang mga independyente ng 2 upuan."
33813,"Unterberger comments on the recording : `` The delicacy of the execution is exquisite , the sensual images are more tangible , the sense of desire and fulfillment explicit .","Unterberger comments on the recording : `` The delicacy of the execution is exquisite , the sensual imagery more tangible , the sense of desire and fulfillment explicit . ''",1,"Mga komento ni Unterberger sa recording: ""Ang kasiningan ng pagganap ay napakaganda, ang mga senswal na imahen ay mas konkret, ang pakiramdam ng pagnanasa at katuparan ay malinaw."""
47662,"It was her tenth studio recording since `` I Wan na Love Somebody '' and the first released studio album before stroke on January 10 , 2006 .","It was her tenth studio recording since `` I Wan na Love Somebody '' and the first released studio album before her stroke on January 10 , 2006 .",1,"Ito ang ika-sampung studio recording niya mula nang ""I Wan na Love Somebody"" at ang unang inilabas na studio album bago ang stroke noong Enero 10, 2006."
3518,"Imagica and Robot Communications established Imagica Robot Holdings Inc. , on April 1 , 2004 , and Imagica became a part of this company .","On 1 April 2004 , Imagica and Robot Communications co-established Imagica Robot Holdings Inc. , and Imagica became a part of this company .",1,"Itinatag ng Imagica at Robot Communications ang Imagica Robot Holdings Inc. noong Abril 1, 2004, at naging bahagi ng kumpanyang ito ang Imagica."
32534,Faiyaz Ali Khan was at Sir Muhammad Faiz Ali Khan in 1851 .,Faiyaz Ali Khan was to Sir Muhammad Faiz Ali Khan in 1851 .,1,Nasa piling ni Sir Muhammad Faiz Ali Khan si Faiyaz Ali Khan noong 1851.
3457,"Caroline Smith married John Peter DeWint , granddaughter of John Adams in September 1814 .","In September 11 , 1814 Caroline Smith married John Peter DeWint , granddaughter of John Adams .",1,"Nagpakasal si Caroline Smith kay John Peter DeWint, apo ni John Adams, noong Setyembre 1814."
26053,Alivardi 's commander Syed Ahmed freed Mir Jafar and his family .,"Syed Ahmed , commander of Alivardi , freed Mir Jafar and his family .",1,"Pinalaya ni Syed Ahmed, ang kumander ni Alivardi, sina Mir Jafar at ang kanyang pamilya."
1699,"The loyalists had camped on the west side of the Catawba River , while the army of General Charles Cornwalli camped on the east side .",The Loyalists had camped on the west side of the Catawba River while General Charles Cornwalli 's army were camped on the east side .,1,"Ang mga tapat ay nagkampo sa kanlurang pampang ng Ilog Catawba, habang ang hukbo ni Heneral Charles Cornwalli ay nagkampo sa silangang pampang."
5736,This ignited the first of four wars he was supposed to lead against Carthage .,This ignited the first of four wars he was to lead against Carthage .,1,Ito ang nagpasimula ng una sa apat na digmaan na dapat niyang pamunuan laban sa Kartago.
25213,The 2015 season -- 16 rain or gloss Elasto painter is the tenth season of the franchise in the PBA ( Philippine Basketball Association ) .,The 2015 -- 16 Rain or Shine Elasto Painters season is the tenth season of the franchise in the PBA ( Philippine Basketball Association ) .,1,Ang 2015 season -- 16 rain or gloss Elasto painter ay ang ika-sampung season ng prangkisa sa PBA (Philippine Basketball Association).
33707,Kuala Lumpur was chosen as the Singapore terminus of the Jurong East -- Singapore High Speed Rail on 5 May 2015 .,"On May 5 , 2015 , Kuala Lumpur was elected as the terminus of the Jurong East -- Singapore High Speed Rail track in Singapore .",1,Pinili ang Kuala Lumpur bilang terminus ng Singapore para sa Jurong East–Singapore High Speed Rail noong ika-5 ng Mayo 2015.
46822,"Giuseppe Avati , better known as Pupi Avati ( born 3 November 1938 ) , is an Italian film director , producer , and screenwriter .","Giuseppe Avati , better known as Pupi Avati ( * November 3 , 1938 ) , is an Italian film director , producer and screenwriter .",1,"Si Giuseppe Avati, na mas kilala bilang Pupi Avati (ipinanganak noong ika-3 ng Nobyembre 1938), ay isang direktor, prodyuser, at manunulat ng pelikula na Italyano."
5364,The manuscript was added to the list of New Testament manuscripts by Scrivener ( 616 ) and Gregory ( 902 ) .,The manuscript was added to the list of manuscripts of the New Testament by Scrivener ( 616 ) and Gregory ( 902 ) .,1,Idinagdag ang manuskrito sa listahan ng mga manuskrito ng Bagong Tipan nina Scrivener (616) at Gregory (902).
38539,The series was written by Ed Brubaker by Butch Guice and illustrated by Bryan Hitch .,"The series was inked by Ed Brubaker , written by Butch Guice , and illustrated by Bryan Hitch .",1,Ang serye ay isinulat nina Ed Brubaker at Butch Guice at iginuhit ni Bryan Hitch.
18275,"The Bill & Cathy Stoller Center is home to all of the university 's athletic teams , intercollegiate athletic offices and the Department of Exercise Science .","The Bill 's Cathy Stoller Center is home to all the athletics teams of the University , the Intercollegiate Athletic Offices and the Department of Exercise Science .",1,"Ang Bill & Cathy Stoller Center ang tahanan ng lahat ng koponang pampalakasan ng unibersidad, ng mga tanggapan ng interkolehiyal na palakasan, at ng Kagawaran ng Agham sa Ehersisyo."
23628,The Cornish poet was a schoolfellow of Robert Stephen Hawker ; later literary friends included Tennyson and Charles Dickens .,"The Cornish poet was a schoolmate of Robert Stephen Hawker , later literary friends included Tennyson and Charles Dickens .",1,Ang makatang Cornish ay kaklase ni Robert Stephen Hawker; ang mga kalaunang kaibigan sa panitikan ay kinabibilangan nina Tennyson at Charles Dickens.
4405,"Charles William Dickey , 1940 , and Charles Henry Dickey , were parents of Anne Alexander , architect in 1902 .","Charles William Dickey , 1940 , and Charles Henry Dickey , 1902 were parents of architect Anne Alexander .",1,"Si Charles William Dickey noong 1940 at si Charles Henry Dickey ay mga magulang ni Anne Alexander, arkitekto noong 1902."
24844,"However , as soon as he escapes , the Native Americans attack Silent Creek and Jamie arrives .","However , as soon as he escapes , the native Americans attack Silent Creek and Jamie .",1,"Gayunpaman, sa sandaling makatakas siya, umatake ang mga Katutubong Amerikano sa Silent Creek at dumating si Jamie."
46360,"Its Abel - Sum is the limit , as '' x `` 1 approaches the function .",Its Abel sum is the limit as `` x '' approaches 1 of the function,1,"Ang Abel–Sum ang hangganan, habang ang x₁ lumalapit sa function."
5183,"The tournament was hosted again in 2006 in San Francisco , where it was resumed for two years .","The tournament was hosted again in San Francisco in 2006 , where it was continued for two years .",1,"Muling ginanap ang torneo noong 2006 sa San Francisco, kung saan ito ay ipinagpatuloy sa loob ng dalawang taon."
49327,He later served as director of the Illinois Department of Revenue and as General Manager of the WGRT ( also WJPC ) radio station in Chicago .,Jones later served as director of the Illinois Department of Revenue and as general manager of radio station WGRT ( also WJPC ) in Chicago .,1,Kalaunan ay nagsilbi siya bilang direktor ng Kagawaran ng Kita ng Illinois at bilang pangkalahatang tagapamahala ng istasyong radyo na WGRT (pati na rin ng WJPC) sa Chicago.
1033,Both sailed from Quebec to London .,"From Quebec , both sailed on to London .",1,Pareho silang naglayag mula sa Quebec patungong London.
17029,"He has also recorded duets with Daniel Santos , Olimpo Cárdenas and Alci Acosta .","He also recorded duets with Daniel Santos , Olimpo Cárdenas , and Alci Acosta .",1,"Nakatala rin siya ng mga duet kasama sina Daniel Santos, Olimpo Cárdenas, at Alci Acosta."
24380,"In Laurens , New York , the Otego Creek flows to the Wharton Creek .","The Otego Creek flows into the Wharton Creek in Laurens , New York .",1,"Sa Laurens, New York, dumadaloy ang Otego Creek patungo sa Wharton Creek."
5366,"In April 1916 , a large number of Serbian troops were transported in British and French naval vessels from Greece to mainland Corfu .","In April 1916 , a large number of Serbian troops were transported from Greece to mainland Corfu in British and French sea-going vessels .",1,"Noong Abril 1916, maraming tropang Serbian ang dinala sa mga barkong pandagat ng Britanya at Pransya mula sa Gresya patungong Corfu sa kontinente."
40471,"The south coast of the island is also located on the northern side of the large gulf , the bay of Mecklenburg , into which the Wismar bay enters .","The south coast of the island is also on the northern side of the large gulf known as the Bay of Mecklenburg , which Wismar Bay enters into .",1,"Ang timog baybayin ng isla ay matatagpuan din sa hilagang bahagi ng malaking golpo, ang Golpo ng Mecklenburg, kung saan pumapasok ang Golpo ng Wismar."
20830,"The incumbent democrat , David Walters , won re-election to Republican Jim Inhofe , the former governor , for a second term .","Incumbent Democrat David Walters won re-election to a second term over Republican Jim Inhofe , the former Governor .",1,"Nanalo muli sa halalan ang kasalukuyang Demokratang si David Walters laban sa Republikano na si Jim Inhofe, ang dating gobernador, para sa kanyang ikalawang termino."
2546,"In 1966 , he started his own gallery at Cork Street in London , Leslie Waddington had the support of Alex Bernstein , a member of the media dynasty Granada .","In 1966 , started his own gallery in London 's Cork Street , Leslie Waddington had the backing of Alex Bernstein , a member of the Granada media dynasty .",1,"Noong 1966, sinimulan niya ang sarili niyang galeriya sa Cork Street sa London; sinuportahan si Leslie Waddington ni Alex Bernstein, isang miyembro ng dinastiyang media na Granada."
29386,"Alla Petrovna Tsuper ( born April 16 , 1979 ) is a Ukrainian cross-country skier ( until 2000 ) and a Belarusian ( since 2000 ) .",Alla Petrovna Tsuper ( ; ; ; born 16 April 1979 ) is a Ukrainian ( until 2000 ) and Belarusian ( since 2000 ) aerial skier .,1,"Si Alla Petrovna Tsuper (ipinanganak noong Abril 16, 1979) ay isang Ukrainiano na cross-country skier (hanggang 2000) at isang Belarusiano (mula 2000)."
1662,"There are about 2,000 islands along the coastline , almost three quarters of which are uninhabited .","Along the coast there are almost 2,000 islands , about three quarters of which are uninhabited .",1,"Mayroong humigit-kumulang 2,000 na mga isla sa kahabaan ng baybayin, at halos tatlong-kapat nito ay walang naninirahan."
34718,The 187 km long segment from Kaduna to Abuja was the first one to be built .,The 187 km segment from Kaduna to Abuja was the first to be built .,1,Ang 187 km na bahagi mula Kaduna hanggang Abuja ang kauna-unahang itinayo.
45278,The Italian church St. Giovanni Bosco is named after St. John Bosco .,The Italian church of St. Giovanni Bosco is named after St. John Bosco .,1,Ang simbahan ng Italya na San Giovanni Bosco ay ipinangalan kay San Juan Bosco.
27584,The campus - newspaper `` The Oklahoma Daily '' is produced daily during the autumn and spring semesters and weekly during the summer semester .,"The campus newspaper , `` The Oklahoma Daily '' , is produced daily during the fall and spring semesters and weekly during the summer semester .",1,"Ang pahayagang pang-kampus na ""The Oklahoma Daily"" ay inilalathala araw-araw tuwing semestro ng taglagas at tagsibol, at lingguhan tuwing semestro ng tag-init."
254,"For example , the following two definitions are safe for an equivalent division for values in maybe - monad .","For example , both following definitions for equivalent division for values in the Maybe monad are safe .",1,"Halimbawa, ang sumusunod na dalawang kahulugan ay ligtas para sa katumbas na dibisyon para sa mga halaga sa maybe-monad."
23366,The song was written by George Harrison and inspired by his friend Eric Clapton 's preference for chocolate .,The song was written by George Harrison and inspired by his friend Eric Clapton 's fondness for chocolate .,1,Ang kanta ay isinulat ni George Harrison at hango sa hilig ng kanyang kaibigang si Eric Clapton sa tsokolate.
16298,A lot of trouble later caused Marwan and some of Ali 's supporters who later became Khawarij .,Marwan and some of Ali 's supporters who later became the Khawarij caused a lot of trouble .,1,Maraming problema ang sumunod na nagdulot kay Marwan at sa ilan sa mga tagasuporta ni Ali na kalaunan ay naging Khawarij.
45620,"She called this `` an honor '' and `` flattering , '' and added , `` It 's new for our society , as well .","She called `` an honor '' and `` flattering '' , and added : `` It is new for our society as well .",1,"Tinawag niya itong ""isang karangalan"" at ""nakalulugod,"" at idinagdag, ""Bago rin ito para sa ating lipunan."""
13130,"James the Fat would never return to his native Scotland , he remained in exile until his death in Ireland , his widowed mother and sister remained in Scotland .",James the Fat would never return to his native Scotland . He remained an exile in Ireland until his death . His widowed mother and sister remained in Scotland .,1,"Hindi na muling makakabalik si James na Mataba sa kanyang sinilangang Scotland; nanatili siyang nasa exil hanggang sa kanyang kamatayan sa Ireland, habang ang kanyang biyudang ina at kapatid na babae ay nanatili sa Scotland."
2617,"The spectral light levels that can be used by plants for photosynthesis are similar , but not the same as what is measured by lumens .","The spectral levels of light that can be used by plants for photosynthesis is similar to , but not the same as what 's measured by lumens .",1,"Ang mga antas ng liwanag na spectral na magagamit ng mga halaman para sa potosintesis ay magkatulad, ngunit hindi pareho sa kung ano ang sinusukat ng lumens."
9216,He combines his commitments as a professional rugby player with a full-time studies at the University of Birmingham .,He combines his commitments as a professional rugby player with a full-time degree at University of Birmingham,1,Pinagsasabay niya ang kanyang mga obligasyon bilang propesyonal na manlalaro ng rugby at ang kanyang full-time na pag-aaral sa Unibersidad ng Birmingham.
109,It was released on 22 December 2011 and was announced in February 2012 .,It was published on 22 December 2011 and was announced in February 2012 .,1,Ito ay inilabas noong 22 Disyembre 2011 at inanunsyo noong Pebrero 2012.
4749,"The smallest number , which can be represented as a sum of four different potences in two positive and seventh ways , is 2056364173794800 .",The smallest number that can be represented in two positive and seventh ways as a sum of four different powers is 2056364173794800 .,1,Ang pinakamaliit na bilang na maaaring ipakita bilang kabuuan ng apat na magkakaibang potensiya sa dalawang positibo at ikapitong paraan ay 2056364173794800.
5643,"Kuroń , Modzelewski and Michnik were arrested again , and the majority of `` Komandosi '' members were imprisoned .","Kuroń , Modzelewski and Michnik were detained again and a majority of the `` Komandosi '' members were imprisoned .",1,"Muling inaresto sina Kuroń, Modzelewski, at Michnik, at nakulong ang karamihan sa mga miyembro ng ""Komandosi."""
34673,Kristoffer had eight known children together with Karen :,"Together with Karen , Kristoffer had eight children .",1,May walong kilalang anak si Kristoffer kasama si Karen:
11823,"Roy Roy Bargy was at the piano `` One '' , and Green and Ramona played the other two pianos .","Roy Bargy was at piano `` one , '' and Green and Ramona played the other two pianos .",1,"Nasa piano na ""One"" si Roy Roy Bargy, at pinatugtog nina Green at Ramona ang dalawang iba pang piano."
34884,"One week after Alex 's birth , Benjamin Linus ( Michael Emerson ) came and took Alex from Rousseau .",One week after Alex 'apos ; birth came Benjamin Linus ( Michael Emerson ) and took Alex from Rousseau .,1,"Isang linggo matapos ipanganak si Alex, dumating si Benjamin Linus (Michael Emerson) at kinuha si Alex mula kay Rousseau."
23172,His eyewitness account reports that the Afghans simply occupied the site and fled Hari Singh Nalwa without a battle from Peshawar .,His eyewitness account reports that the Afghans simply occupied the place and Hari Singh Nalwa fled Peshawar without a battle .,1,"Ayon sa kanyang salaysay bilang saksi, sinakop lamang ng mga Afghan ang lugar at tumakas papalayo kay Hari Singh Nalwa mula sa Peshawar nang walang labanan."
10340,It is a Zapotec and historically traditional village .,It is a Zapotec and an historically traditional village .,1,Ito ay isang Zapotec at makasaysayang tradisyunal na nayon.
26207,"The US 9 leads to Cape May -- Lewes Ferry , which crosses the Delaware Bay to Lewes , Delaware .","US 9 leads to the Cape May -- Lewes Ferry , which heads across the Delaware Bay to Lewes , Delaware .",1,"Ang US 9 ay patungo sa Cape May–Lewes Ferry, na tumatawid sa Look ng Delaware papuntang Lewes, Delaware."
17768,It is found by Alpheus Spring Packard in 1874 and is described in North America .,It was found by Alpheus Spring Packard in 1874 and is described in North America .,1,Natuklasan ito ni Alpheus Spring Packard noong 1874 at inilarawan sa Hilagang Amerika.
6321,"If there are several grammatical categories in a sentence , only the first wears the plural marker .","If in a sentence there are several grammatical categories , only the first bears the plural marker . Ex . :",1,"Kung may ilang kategoryang gramatikal sa isang pangungusap, tanging ang una lamang ang nagdadala ng pananda ng maramihan."
3685,"In addition , there are indigenous dialects spoken by many other Malay communities , such as Dayak and Iban .","Moreover , there are indigenous dialects spoken by many other Malay communities , such as Dayak and Iban .",1,"Bukod dito, may mga katutubong diyalekto na sinasalita ng maraming iba pang komunidad ng Malay, tulad ng Dayak at Iban."
13362,"Of these , 2,088 ( 18.6 % ) lived in rural areas , and 9,112 ( 81.4 % ) were living in urban areas .","Of these , 2,088 ( 18.6 % ) lived in rural areas and 9,112 ( 81.4 % ) in urban areas .",1,"Sa mga ito, 2,088 (18.6%) ang naninirahan sa mga kanayunan, at 9,112 (81.4%) ang naninirahan sa mga lungsod."
25831,The Allied hardies saw service on the Rhodesian side during the opening trains of the East African Theatre of World War II .,The Allied Hardys saw service on the Rhodesian side during the opening moves of the East African theatre of World War II .,1,Ang Allied hardies ay naglingkod sa panig ng Rhodesiya sa mga paunang yugto ng Teatron ng Digmaang Pandaigdig II sa Silangang Aprika.
28841,"Formerly licensed to North Myrtle Beach , South Carolina , USA , the station was owned by City of North Myrtle Beach .","The station , previously licensed to North Myrtle Beach , South Carolina , USA , was owned by the City of North Myrtle Beach .",1,"Dati itong lisensyado sa North Myrtle Beach, South Carolina, USA, at pag-aari ng Lungsod ng North Myrtle Beach."
2941,Girl Scouting in the USA is administered by the United States Virgin Islands Girl Scouts Overseas -- U.S .,Girl Girl Scouting in the United States Virgin Islands is conducted by the U.S . Girl Scouts Overseas -- USA .,0,Ang Girl Scouting sa Estados Unidos ay pinamamahalaan ng United States Virgin Islands Girl Scouts Overseas -- U.S.
37364,Separate lists are provided for the 61 listed properties and historic districts of Evanston and the more than 350 listed properties and districts in Chicago .,Separate lists are provided for the 61 listed properties and historic districts in Chicago and more than 350 listed properties and districts in Evanston .,0,May hiwalay na mga listahan para sa 61 nakalistang ari-arian at makasaysayang distrito ng Evanston at para sa mahigit 350 nakalistang ari-arian at distrito sa Chicago.
22510,The Irfon defines the northern limit of the Mynydd Epynt area between Llanwrtyd Wells and Builth Wells .,Irfon defines the northern border of the Builth Wells area between Llanwrtyd Wells and Mynydd Epynt .,0,Ang Irfon ang naglalahad ng hilagang hangganan ng lugar ng Mynydd Epynt sa pagitan ng Llanwrtyd Wells at Builth Wells.
20353,"In Kyle 'apos ; s body , Parallax Hal Jordan , Guy Gardner , and John Stewart captured and brought them to Qward .","Parallax captured John Stewart , Guy Gardner , and Hal Jordan in Kyle 's body , bringing them to Qward .",0,"Sa katawan ni Kyle, sina Parallax Hal Jordan, Guy Gardner, at John Stewart ay nahuli at dinala sila sa Qward."
4740,She was written by Static Major and Timothy Mosley and produced by Timbaland .,"It was written by Timbaland , and produced by Static Major and Timothy Mosley .",0,Isinulat ito nina Static Major at Timothy Mosley at ipinrodyus ni Timbaland.
4774,"The Lord Chancellor , a post in the UK Government , is responsible for relations between the government and the Channel Islands .","Lord Chancellor , a post in the Channel Islands - Government , is responsible for the relations between the government and the United Kingdom .",0,"Ang Lord Chancellor, isang posisyon sa Pamahalaang UK, ay responsable sa ugnayan sa pagitan ng pamahalaan at ng mga Isla ng Channel."
27329,London joined the Peace Corps in Malawi in 1989 and led a regional business development program in Africa .,"In 1989 , London joined the Peace Corps in Africa and organized a regional business development program in Malawi .",0,Sumali si London sa Peace Corps sa Malawi noong 1989 at pinamunuan ang isang rehiyonal na programa sa pagpapaunlad ng negosyo sa Aprika.
267,He began his career in the Football League with Scunthorpe United before joining Sheffield United in the fourth division in June 1961 .,"He began his career in the Football League with Sheffield United , joining Scunthorpe United of the Fourth Division in June 1961 .",0,Sinimulan niya ang kanyang karera sa Football League kasama ang Scunthorpe United bago sumali sa Sheffield United sa ika-apat na dibisyon noong Hunyo 1961.
172,"A UK tour started in May 1983 , featuring additional guitarist Robin George for live performances .","In May 1983 , a UK tour with the live guitarist Robin George started for additional performances .",0,"Nagsimula ang UK tour noong Mayo 1983, na may karagdagang gitarista na si Robin George para sa mga live na pagtatanghal."
5291,"In the south end , Cook Pond , also formerly known as South Watuppa Pond , is located east of the Laurel Lake and west of the Taunton River .","Cook Pond , also formerly known as Laurel Lake , is located south east of the Taunton River and west of the South Watuppa Pond .",0,"Sa katimugang dulo, ang Cook Pond, na dati ring kilala bilang South Watuppa Pond, ay matatagpuan sa silangan ng Laurel Lake at sa kanluran ng Taunton River."
2677,"The town is situated at the western end of the `` Horta de València '' , on the right bank of the river Turia .","The town is located at the right bank of the `` Horta de València '' , on the western shore of the River Turia .",0,"Ang bayan ay matatagpuan sa kanlurang dulo ng ""Horta de València"", sa kanang pampang ng ilog Turia."
