text,summary
"Si Helen Bailey ay natagpuan na naputol ang kanyang lalamunan noong Agosto 1975. Ang walong taong gulang na bata ay nawala habang nakasuot ng asul na damit at binansagan na ""Little Girl Blue"". Narinig ng isang pagsisiyasat noong 1976 na maaaring namatay siya bilang isang resulta ng isang ""aksidente o praktikal na biro na nagkamali"" at ang mga hurado ay nagbalik ng isang bukas na hatol. Ngunit pinawalang-bisa ito ng mga hukom, na binabanggit ang ebidensya mula 2014 na siya ay na-strangled. Sa pag-upo kasama si Mrs. Justice Whipple sa London, sinabi ni Lord Justice Hickinbottom: ""Sa aking pananaw, ang paglitaw ng bagong ebidensya na ito ay maaaring humantong sa konklusyon na ang katotohanan kung paano nakilala ni Helen ang kanyang kamatayan ay hindi isiniwalat sa unang pagsisiyasat. "" Kumbinsido ako na ang kapakanan ng katarungan ay ginagawang kanais-nais ang karagdagang pagsisiyasat."" Para sa balita at mga update mula sa West Midlands Narinig ng korte na umalis si Helen sa kanyang bahay sa lugar ng Perry Barr ng Birmingham upang maglaro bandang 15:30 BST noong Agosto 10. Inalerto ng kanyang ina ang pulisya nang hindi siya umuwi at natagpuan ang kanyang bangkay sa kakahuyan kinabukasan. Sa isang post-mortem examination sa oras na iyon, natukoy ang isang hiwa sa kanyang lalamunan bilang sanhi ng kamatayan. Natuklasan ng pathologist na walang mga palatandaan ng isang pakikibaka at ang mga pangyayari ay ""kulang sa mahahalagang katangian ng isang pag-atake ng pagpatay"". Gayunpaman, ang pagsisiyasat sa kanyang pagkamatay ay muling binuksan noong 2014, na may isang pathologist na nagtapos na si Helen ay na-strangled bago ang kanyang lalamunan ay pinutol sa isang ""malinaw na kaso ng pagpatay"". Sinabi ni Lord Justice Hickinbottom na ito ay naaayon sa isang ""pagtatapat"" ng isang suspek na sinisiyasat ng West Midlands Police, ngunit nagpasya ang Crown Prosecution Service na huwag siyang usigin. Hiniling ng puwersa sa senior coroner ng Birmingham at Solihull na si Louise Hunt na humingi ng pahintulot na ibasura ang orihinal na hatol sa pagsisiyasat. Ang ina ni Helen na si Margaret Bailey ay sumuporta sa isang apela ng pulisya para sa impormasyon noong nakaraang taon. Sundin ang BBC West Midlands sa Facebook, sa Twitter, at mag-sign up para sa mga lokal na update ng balita nang direkta sa iyong telepono.",Iniutos ng mataas na hukuman ang panibagong pagsisiyasat sa hindi nalutas na pagpatay sa isang batang babae na natagpuang patay sa isang kakahuyan 43 taon na ang nakararaan.
"Si Joel Elphick, 21, ng East Preston, ay tumama sa isang nakaparadang kotse sa junction ng Wallace Avenue at West Parade, Worthing, West Sussex, sa 04:30 BST noong Setyembre 13. Ang German shepherd na si Vinnie ay dinala sa lugar kung saan sinubaybayan niya si Elphick sa apat na kalye hanggang sa mga kubo sa dalampasigan. Inamin ni Elphick na umiinom siya at nagmamaneho nang humarap siya sa mga mahistrado ng Worthing noong nakaraang Biyernes at pinagbawalan siyang magmaneho sa loob ng 20 buwan. Pinagmulta din siya ng £ 92 at inutusang magbayad ng mga gastos.",Isang aso ng pulisya ang tumulong sa paghahanap sa isang drayber na umiinom na tumakas sa pinangyarihan ng aksidente.
"Ang kotse ng Vauxhall ay kasangkot sa aksidente sa southbound motorway, malapit sa junction three sa Corley, Warwickshire, sa 17:00 GMT noong Sabado. Ang pormal na pagkakakilanlan ng driver, isang lalaki na nasa edad 40, ay hindi pa nagaganap, sabi ng Warwickshire Police. Ang mga pinsala ng iba pa sa kotse ay hindi nagbabanta sa buhay, sinabi nito. Hinimok ni Sgt Shaun Bridle, mula sa puwersa, ang sinumang nakakita ng kotse bago ang banggaan na lumapit. Sundin ang BBC West Midlands sa Facebook, Twitter at Instagram. Ipadala ang iyong mga ideya sa kuwento sa: newsonline.westmidlands@bbc.co.uk",Isang driver ang namatay at tatlong tao ang nasugatan nang mabangga ng isang kotse ang central reservation sa M6.
"Ang mga opisyal ay puwersahang pumasok sa Kasablanca sa lugar ng Highgate ng Birmingham sa 01:00 BST noong Oktubre 24. Makikita sa video na nai-post sa YouTube ang mga opisyal na pinipilit na pumasok sa smokers' lounge sa Moseley Street, na may mga hiyawan na naririnig habang pinapakalat nila ang mga tao. Ang venue ay lumabag sa mga paghihigpit nang mas maaga sa buwang ito, sinabi ng pulisya. Ang Birmingham at ang mas malawak na pinagsamang lugar ng awtoridad ng West Midlands ay malawak na hinulaang lilipat sa tier three na ""napakataas na alerto"" na mga hakbang sa pagtatapos ng susunod na linggo, habang patuloy na tumataas ang mga rate ng impeksyon. Sa isang hiwalay na insidente, ang may-ari ng isang venue sa Smethwick, West Midlands, ay pinagmulta ng £ 10,000, matapos mag-host ng isang pagdiriwang ng kasal para sa higit sa 70 katao. Sinabi ni Ch Supt Andy Beard: ""Hindi katanggap-tanggap na ang mga negosyong ito ay patuloy na lumalabag sa batas, na naglalagay ng mga buhay sa panganib at nagdaragdag ng panganib ng mga impeksyon habang patuloy na kumakalat ang nakamamatay na virus na ito. "" Ito ay isang mahirap na oras para sa lahat, ngunit hindi namin makokontrol ang pandemyang ito at bumalik sa isang pakiramdam ng normalidad kung patuloy itong nangyayari. "" Ang mga saradong lugar ay sinusuri ang kanilang mga order bawat linggo ng lokal na awtoridad at dapat patunayan ng mga may-ari na sumusunod sila sa batas bago muling buksan, sinabi ng puwersa. Sundin ang BBC West Midlands sa Facebook, Twitter at Instagram. Ipadala ang iyong mga ideya sa kuwento sa: newsonline.westmidlands@bbc.co.uk","Isinara ng pulisya ang isang shisha café matapos makita ang mga 150 katao sa loob, ilang araw matapos ang venue ay tinamaan ng multa na £ 10,000 para sa mga paglabag sa Covid-19."
"Ang dula, na isinulat ng manunulat ng Doctor Foster na si Mike Bartlett, ay inangkop sa isang one-off drama para sa BBC Two. Ang Olivier Award-winning play ay nag-iisip ng pag-akyat ni Prince Charles sa trono kasunod ng pagkamatay ng Reyna. Si Tim Pigott-Smith, na gumanap bilang King Charles sa entablado, ay muling gumanap sa papel para sa TV. Si Charlotte Riley, na lumitaw din sa mini-serye na Close to the Enemy at ang pelikulang London Has Fallen, ay nagsabi na siya ay ""talagang nasasabik"" na tanggapin ang ""hamon"" ng paglalaro ni Kate Middleton. Sabi niya, ""Kakaiba ang project na ito. Upang maging parehong moderno at mayaman sa taludtod at upang i-play ang isang tao na totoo ngunit pa ganap na re-imagined para sa kuwentong ito ay isang kapana-panabik na prospect para sa isang artista. ""Si Kate Middleton ay isang talagang kagiliw-giliw na babae, lalo na sa konteksto ng dula na ito, at ito ay isang hamon na talagang inaabangan ko."" Krisis sa konstitusyon Sa dula, tumanggi si Haring Charles na lagdaan ang isang kontrobersyal na panukalang batas sa batas, na humahantong sa kaguluhan sa pulitika, krisis sa konstitusyon at kaguluhan sa mga lansangan. Sinabi ni Pigott-Smith na mahalaga na ang dula, na inilipat din sa Broadway, ay kinukunan. ""Ito ay isang drama tungkol sa amin, ngayon, kung sino kami, at ang kahalagahan ng aming monarkiya,"" sabi niya. ""Ang telebisyon ay nagbibigay nito ng isang mahalagang demokratikong boses."" Ang iba pang mga miyembro ng cast mula sa bersyon ng entablado na naka-star din sa pagbagay ay sina Oliver Chris bilang William, Richard Goulding bilang Harry at Margot Leicester bilang Camilla. Sinabi ni Bartlett na ang produksyon ay ganap na ngayon at malapit nang magsimulang mag-shoot. ""Mayroon kaming isang pambihirang koponan, kapwa sa harap at sa likod ng camera, at inaasahan kong dalhin ang napaka-kontemporaryong trahedya ng hari sa isang pambansang madla sa telebisyon,"" sabi niya. Sundin kami sa Twitter @BBCNewsEnts, sa Instagram sa bbcnewsents, o kung mayroon kang isang mungkahi sa kuwento sa email entertainment.news@bbc.co.uk.",Ang aktres ng Peaky Blinders na si Charlotte Riley ay itinapon bilang Duchess of Cambridge sa TV adaptation ng award-winning play na King Charles III.
"Ang 22-taong-gulang na producer at songwriter ay ang unang non-X Factor na kaakibat na pumirma sa Syco label ni Cowell noong 2010. ""Hinahayaan ako ni Simon na bumuo ng isang hakbang nang paisa-isa. Hindi mo karaniwang nakikita iyon sa mga artist ng X Factor, karaniwan ay isang kalsada lamang,"" sabi niya. ""[Sa X Factor] Pisilin nila ang mga ito nang mabilis."" ""Sa akin pinapayagan niya akong lumago dahil naniniwala siya na marami akong magagawa at mahaba ang buhay, manatili sa paligid."" Nagsasalita sa V Festival noong nakaraang katapusan ng linggo, sinabi niya: ""Ito ay talagang cool na siya ay handa na magbigay ng sustansya ng talento. "" Gustung-gusto ko ang The X Factor, ngunit hindi ko kailangang maging kasama dito. "" Ang 'nourishing' talent na si Labrinth ay naglabas lamang ng isang solo single, Let The Sun Shine, na umabot sa numero dalawa sa singles chart noong Setyembre noong nakaraang taon. Siya ang gumawa at co-wrote ang numero unong single ni Tinie Tempah na Pass Out. Sinabi ni Labrinth na naging abala siya sa tag-init sa pagganap sa mga festival, pagsulat at pagrekord ng bagong materyal. ""Kailangan kong gawin ang higit pa kaysa sa lahat ng mga artista doon,"" sabi niya. ""Tatlong trabaho ang ginagawa ko. Ginagawa nila ang isa. ""Ang kailangan lang nilang gawin ay magmukhang maganda at kumanta. Hindi ito ang pinakamadaling bagay ngunit sigurado ako na sa hinaharap ay ipapakita nito ang mga gantimpala. ""Kamakailan lang ay nag-record ako sa Chase & Status. Nakakatanggap ako ng mga baliw na tawag mula sa Amerika. Lahat ng artista na naiisip mo sa Amerika ay nasa kaso ko."" Inihayag din niya na kamakailan ay naghapunan siya kasama sina Tinie Tempah at Adele sa restawran na pagmamay-ari niya sa hilagang London. ""Nag-record ako kasama si Tinie at bumaba lang siya sa restaurant ko para kumain sa amin,"" pagsisiwalat niya. ""Si Adele ang may trout. Mayroon akong isang bote ng Châteauneuf-du-Pape.""",Sinabi ni Labrinth na binibigyan siya ni Simon Cowell ng mas maraming oras upang umunlad bilang isang artist kaysa sa mga nagtapos sa X Factor sa kanyang record label.
"Ang dalaga, ang binata at ang ina at sanggol na salamander ay sumali sa 10 iba pa na lahat ay dinisenyo ng master mason ng katedral at inspirasyon ng Awit 148. ""Ang pag-ukit ng mga gargoyle ay isang bihirang pagkakataon para sa amin na ipahayag ang aming sarili nang malikhain,"" sabi ni Pascal Mychalysin. ""Sigurado ako na ang aming mga katapat sa medyebal ay hindi nagpunta sa art school, kaya ipinagpatuloy namin ang tradisyong iyon."" Ang mga gargoyle ay ginagamit upang maglabas ng tubig mula sa bubong at malayo sa gilid ng isang gusali. 'Target practice' Ang kumbinasyon ng malamig at basa na kondisyon ay maaaring maging sanhi ng malubhang pinsala sa tela ng gusali tulad ng nangyari sa nakaraan sa hilagang transept ng Gloucester Cathedral, kung saan ang buong harapan ay kailangang palitan. Ang Gloucester Cathedral ay mayroon pa ring ilang mga Gothic gargoyles na inukit sa pagtatapos ng ika-12 siglo. Sinabi ni Sandie Conway mula sa katedral na karamihan sa mga umiiral na gargoyle ay walang ulo, dahil sa sinasadyang pinsala sa panahon ng Digmaang Sibil ng Ingles. Sinabi niya: ""May katibayan na ang mga gargoyle ay ginamit para sa target na pagsasanay ng mga sundalo ng Puritan at ang mga bato sa timog na pasilyo ay nagpapakita ng mga butas ng epekto mula sa mga bola ng musket.""",Tatlong bagong gargoyles ang itinaas sa posisyon sa timog na pasilyo ng Gloucester Cathedral.
"Ang operasyon ay bahagi ng isang pagsubok sa Europa upang makahanap ng isa pang uri ng paggamot para sa mga taong may karamdaman. Ang pagsubok, na kinasasangkutan ng 96 na pasyente, ay nagsasangkot ng elektrikal na pagpapasigla ng isa sa mga nerbiyos na humahantong sa puso. Inaasahan na ang pamamaraan ay maaaring paliitin ang puso at mapabuti ang pag-asa sa buhay. Ayon sa NHS, mahigit isang milyong matatanda sa UK ang nagdurusa sa pagpalya sa puso. Si John Joiner, mula sa Weston-super-Mare, ang unang pasyente sa Britanya na sumailalim sa pamamaraan, na nakikita ang mga surgeon na magkasya sa isang aparato - katulad ng isang pacemaker - sa vagus nerve na tumatakbo sa puso. 'Napansin ang pagpapabuti' Sa unang anim na buwan ng pagsubok, dalawa sa tatlong pasyente ang naka-on ang vagal nerve stimulator. Pagkalipas ng anim na buwan, ang lahat ng mga kalahok ay ipapasa ito. Sinabi ni Mr. Joiner na hindi niya alam kung na-activate pa ang kanyang aparato ngunit pinaghihinalaan niya na na-activate ito. ""Tiyak na napansin ko sa huling ilang linggo ang isang pagpapabuti sa aking paghinga, hindi gaanong ngunit ito ay isang bagay,"" sabi niya. ""Maaari akong umakyat ng hagdan nang mas madali at ang tagal ng aking paglalakad ay tila nakakakuha ng isang maliit na mas mahusay, maaari na akong maglakad ng hanggang sa tatlong milya."" Ang Bristol Heart Institute (BHI) ay ang unang site sa UK at ang pangatlo sa mundo upang itanim ang aparato. Sinabi ni Dr. Angus Nightingale, mula sa BRI: ""Ang pagpapasigla ng vagus nerve ay karaniwang ginagamit upang gamutin ang epilepsy at depression ngunit maaaring magkaroon ng iba pang mga makabuluhang benepisyo. "" Ang aparato ay napupunta sa ilalim ng balat sa dibdib at pagkatapos ay nakakabit sa vagus nerve sa leeg sa ilalim ng pangkalahatang pampamanhid. "" Sinabi niya na pinasigla ng aparato ang nerbiyos kapag naka-on. ""Ang ideya sa likod nito ay ang talamak na autonomic imbalance ay pinaniniwalaan na isang panganib na kadahilanan ng pag-unlad ng pagpalya ng puso at masamang mga kaganapan sa cardiovascular,"" dagdag niya. ""Ang pagpapasigla ay dapat baguhin ang balanse ng sistema at mapabuti ang pag-andar ng puso."" Ang pagsubok ay susuriin ang 96 na pasyente sa 25 mga site sa buong Europa.",Ang mga doktor sa Bristol ay ang unang sa UK na matagumpay na nagtanim ng isang nerve-stimulating device sa dalawang pasyente sa pagsisikap na gamutin ang mga taong may pagpalya sa puso.
"Iniimbestigahan ng pulisya sa Cardiff ang mga pag-atake, sa isang lugar na may mataas na populasyon ng mga estudyante, at sinabing masyadong maaga pa para malaman kung konektado sila. Natanggap ng mga opisyal ang pinakabagong ulat ng pag-atake sa isang babae, 19, sa Gorsedd Gardens sa 04:30 BST noong Huwebes. Kasunod ito ng isang insidente sa Cardiff Civic Centre noong Linggo ng madaling araw, at pangalawa sa Cathays Terrace noong Martes ng madaling araw. Isang 40-taong-gulang na lalaki mula sa Riverside ang dinala sa istasyon ng pulisya ng Cardiff Bay. Isang 22-taong-gulang, mula rin sa Cardiff, na naaresto noong Huwebes, ay nananatiling nasa kustodiya. Gayunman, binigyang-diin ng mga opisyal na masyado pang maaga para sabihin kung may kaugnayan ang mga pag-atake. Sinabi ni Chief Supt Belinda Davies sa press conference: ""Ang aking mensahe ay isa sa zero tolerance sa sinumang gumagawa ng mga kakila-kilabot na krimen na ito. "" Ang mga krimen na tulad nito ay hindi kailanman kasalanan ng biktima, ngunit nais kong samantalahin ang pagkakataong ito upang paalalahanan ang lahat na sundin ang pangunahing payo sa kaligtasan upang mapanatili nilang ligtas ang kanilang sarili at ang kanilang mga kaibigan. "" Ang unang pag-atake noong Linggo ay nangyari malapit sa mga pangunahing gusali ng Cardiff University sa sentro ng lungsod ng lungsod. Nangyari ito nang bumaha ang libu-libong estudyante sa Cardiff para sa pagsisimula ng bagong taon ng kolehiyo. Sinabi ng isang tagapagsalita ng Cardiff University na bumisita ang security team nito sa mga tirahan ng mga estudyante sa linggo ng mga fresher para talakayin ang personal na kaligtasan. ""Nakikipag-usap kami sa aming Unyon ng mga Mag-aaral at tinatalakay ang mga naaangkop na hakbang upang makatulong na matiyak ang kaligtasan ng aming mga mag-aaral."" ""Hinihikayat namin ang sinumang apektado ng mga kaganapang ito na makipag-usap sa isang tao sa Student Support,"" dagdag niya. Patuloy din ang karagdagang patrolya ng pulisya sa lugar upang magbigay ng katiyakan sa mga residente. Noong Miyerkules, pinayuhan din ng South Wales Police ang mga tao sa lugar na maglakad nang pares sa gabi, at manatili sa mga lugar na may ilaw.","Ang pangalawang lalaki ay naaresto matapos ang tatlong sekswal na pag-atake sa loob ng limang araw, lahat ay nasa loob ng isang milya mula sa isa't isa."
"Ang Wicksteed Park ay pumasok sa pangangasiwa noong Hunyo 15 dahil sa ""pinansiyal na strain"" ng lockdown ng coronavirus. Ang 99-taong-gulang na parke, na nakabase sa Kettering, Northamptonshire, ay pag-aari ng Wicksteed Charitable Trust. Sinabi ng chairman ng Trust na si Oliver Wicksteed na ang suporta ay ""tunay na natitirang"". Ang pera ay nangangahulugan na ang parke ay maaaring patuloy na malayang pumasok at pumunta sa mga tauhan, seguridad at mga bayarin, pati na rin ang pag-aalaga sa mga hayop at bakuran. Ang paglipat sa administrasyon ay humantong sa pagkawala ng 48 permanenteng kawani at 67 part-time at iba pang trabaho. Sinuportahan ng tiwala ang pagbuo ng isang bagong mas maliit na kumpanya, na may layuning makalikom ng pera upang muling buksan ang parke. Sa ngayon, ang mga well-wishers ay nakalikom ng £ 123,000 mula sa mga donasyon at naka-sponsor na mga aktibidad. Sinabi ni Mr. Wicksteed: ""Ang tugon mula sa mga lokal na tao ay tunay na napakahusay at hindi namin sila mapasalamatan nang sapat para sa kung ano ang kanilang nagawa at kung ano ang patuloy nilang ginagawa."" Ang pagpapatakbo ng parke nang mag-isa, nang walang mga pagsakay, ay nagkakahalaga ng humigit-kumulang na £ 110,000 sa isang buwan. Ang pagsiklab ng coronavirus ay nag-iwan sa tiwala na walang kita sa loob ng ilang buwan, maliban sa isang maliit na kontribusyon mula sa paradahan ng kotse. Ang Heritage Fund grant na £ 247,000 ay nagmula sa £ 50m Heritage Emergency Fund, na itinatag sa kalagayan ng lockdown. Hanapin ang BBC News: East of England sa Facebook, Instagram at Twitter. Kung mayroon kang isang mungkahi sa kuwento email eastofenglandnews@bbc.co.uk Mga Kaugnay na Link sa Internet Wicksteed Park Ang National Lottery Heritage Fund","Ang isang apela sa pangangalap ng pondo para sa isang theme park ay umabot sa £ 370,000 matapos makatanggap ng mga pondo mula sa mga well-wishers at isang emergency grant ng National Lottery Heritage Fund."
"Sinabi ni Chancellor Rishi Sunak sa Budget na ang Northampton ay isa sa 45 bayan na iginawad sa isang grant. Inaasahan na ang pera ay ""magsisimula ng isang balsa ng mga proyekto sa pag-unlad"" sa buong Northampton. Sinabi ng pinuno ng Northampton Borough Council na si Jonathan Nunn na siya ay ""tuwang-tuwa"" na matanggap ang buong halaga na bid ng awtoridad. Ang bid ay iniharap ng isang public-private partnership na kilala bilang Northampton Forward na kinabibilangan ng mga kinatawan mula sa konseho, isang hanay ng mga negosyo at interes ng komunidad. Kabilang sa mga plano para sa pera ang paggawa ng mga walang laman na dating Marks & Spencer at BHS unit sa Abington Street sa mga residential development, paglikha ng isang bagong arts center, pagpapalawak ng Charles Rennie Mackintosh-inspired 78 Derngate, at pagkumpleto ng naantala na pag-unlad ng Four Waterside. Sinabi ng Northampton Forward na ang pag-unlad ay lilikha ng 1,472 trabaho, na may trabaho na nakatakdang makumpleto sa tag-init ng 2026. Sinabi ni Mr. Nunn na ang pera ay makakatulong sa ""pagbabago ng aming High Streets"" at ""mapalakas din ang aming nakakahimok na alok sa kultura"". Ang grant ng gobyerno ay susuportahan ng match-funding na £ 13.5 milyon mula sa Council, Enterprise Zone, Getting Building Fund at National Heritage Lottery Fund. Sinabi ni Jo Gordon, punong ehekutibo ng Royal & Derngate at Northampton Forward board member: ""Ang pera na ito ay magbibigay-buhay sa iba't ibang kapana-panabik na proyekto, kabilang na ang ilang mabigat na pamumuhunan sa aming namumulaklak na Cultural Quarter, at magiging katalista para sa malaking halaga ng pamumuhunan sa pribadong sektor sa bayan."" Hanapin ang BBC News: East of England sa Facebook, Instagram at Twitter. Kung mayroon kang isang mungkahi sa kuwento, mag-email eastofenglandnews@bbc.co.uk","Ang isang grant ng gobyerno na £ 25m ay ""magbibigay-buhay"" sa Northampton, sinabi ng pinuno ng konseho ng bayan."
"Ang malaking mekanikal na maghuhukay ay kinuha mula sa isang kalapit na site ng gusali bago nadurog sa Co-op sa Havant, Hampshire, sa pagitan ng 04:33 at 04:41 GMT. Sinabi ng pulisya na ang cash machine ay itinaas mula sa pader at nahulog sa likuran ng isang van, na itinaboy palayo sa pinangyarihan sa Snowberry Crescent. Ang maghuhukay, na kalaunan ay inabandona sa paradahan ng kotse ng tindahan, ay nagdulot ng ""malawak na pinsala"", idinagdag ng puwersa. Ang pulisya ng Hampshire ay umapela para sa sinumang saksi o sinumang may impormasyon na makipag-ugnay sa mga opisyal.",Isang ninakaw na digger ang ginamit ng mga magnanakaw para punitin ang isang cash machine mula sa harap ng isang tindahan.
"Si Oliver Stephens, na kilala bilang Olly, ay idineklara na patay sa Bugs Bottom fields, Emmer Green, noong Linggo. Ang apela na itinatag ng mga kaibigan noong Miyerkules, na may paunang layunin na £ 17,000, ay umabot sa higit sa £ 16,000 sa mga donasyon. Bahagi rin ng pondo na nalikom ay mapupunta rin sa mga charity sa krimen ng kutsilyo. Dalawang batang lalaki, edad 13 at 14, at isang 13-taong-gulang na batang babae ang inakusahan ng pagpatay at pagsasabwatan upang gumawa ng malubhang pinsala sa katawan. Lahat sila ay nananatili sa kustodiya ng detensyon ng kabataan at nakatakdang harapin ang paglilitis sa Hunyo. Ang mga opisyal ay tinawag bago mag-16:00 GMT noong Linggo sa mga ulat ng isang saksak sa mga bukid sa hangganan ng Emmer Green at Caversham Heights, na sikat sa mga dog walker, joggers at pamilya. Sa isang pahayag na inilabas sa pamamagitan ng pulisya noong Miyerkules, inilarawan siya ng pamilya ni Olly bilang ""isang enigma"". Sinabi ng kanyang mga magulang na ang kanilang anak na lalaki ay isang ""kaakit-akit at maganda"" na tinedyer, at ang pagkakaroon ng parehong autism at pinaghihinalaang pag-iwas sa pathological demand ay nangangahulugang ""siya ay naging isang hamon na hindi namin kailanman iniiwasan ang"". Idinagdag pa nila: ""Isang butas na kasinglaki ng Olly ang naiwan sa aming mga puso.""",Ang isang crowdfunding page ay nakalikom ng libu-libong pounds para sa mga gastos sa libing ng isang 13-taong-gulang na batang lalaki na sinaksak hanggang sa mamatay sa Reading.
"Si Martin Currie, 36, ay magkasamang inakusahan kasama si Sarah O'Brien, 33, ng pagpatay kay Keigan O'Brien sa bahay ng pamilya sa Bosworth Road, Doncaster, noong Enero. Si Keigan ay nagdusa ng pagdurugo sa utak, posibleng dahil sa pagpindot ng kanyang ulo sa matigas na ibabaw, narinig ng Sheffield Crown Court. Dati, nabali ang kanyang gulugod, tadyang at braso, sinabi sa hurado. Parehong itinanggi ng mag-asawa ang pagpatay, mga alternatibong singil ng sanhi o pagpapahintulot sa pagkamatay ng isang bata, at isang karagdagang singil ng kalupitan sa bata. Narinig ng mga hurado na dati nang tinawag ng mag-asawa si Keigan sa mga mensahe sa isa't isa. Sinimulan ni Ms. O'Brien ang relasyon kay Mr. Currie, sa kabila ng mga babala na huwag siyang sumama sa kanya, anim na buwan bago namatay si Keigan, narinig ng korte. Noong Oktubre, hindi siya humingi ng tulong medikal nang magdusa ang kanyang anak na lalaki ng dalawang itim na mata habang nasa pangangalaga ni Mr. Currie, at sinabi sa kanyang kaibigan na nahulog ang sanggol sa hagdan. Ipinaliwanag ni Ms. O'Brien sa kaibigan na hindi niya siya dinala sa ospital dahil ""magsisimula silang magtanong"". Sa umaga Keigan ay nakamamatay nasugatan, siya ay sa pangangalaga ng Mr Currie habang Ms. O'Brien ay sa labas ng bahay. Tumawag ang mag-asawa sa 999 nang 10:55 GMT matapos sabihin na natagpuan siyang hindi humihinga sa kama. 'Agonal breathing' Sinabi ni Jason Pitter QC, na nag-uusig, na hinanap ni Mr. Currie sa internet dalawang oras na ang nakararaan para sa mga terminong may kaugnayan sa ""irregular breathing"", ""pagiging walang malay"" at ""gurgling"". Ang isa sa mga resulta, sinabi ng prosekusyon, ay ""agonal breathing"", na nagpapahiwatig na ang emergency na tulong medikal ay dapat humingi kaagad. Sinabi ng mag-asawa na natagpuan si Keigan na hindi tumutugon sa kama, at hindi ipinaliwanag kung paano siya napunta sa kanyang mga pinsala, sabi ni Mr. Piter. Nagpapatuloy ang paglilitis. Sundin ang BBC Yorkshire sa Facebook, Twitter at Instagram. Ipadala ang iyong mga ideya sa kuwento sa yorkslincs.news@bbc.co.uk.","Isang lalaking inakusahan ng pagpatay sa dalawang-taong-gulang na batang lalaki ng kanyang partner ang tumingin sa ""hindi regular na paghinga"" at ""walang malay"" dalawang oras bago tumawag sa 999, ayon sa isang korte."
"Sinabi ng mga opisyal mula sa West Midlands Police na ""namangha"" sila nang ihinto nila ang sasakyan sa Bilston noong Sabado ng gabi at natagpuan ang mga babae, na pawang mula sa magkakahiwalay na sambahayan. Sa ilalim ng mga patakaran sa lockdown, na nagsimula noong Nobyembre 5, ang mga tao ay hindi dapat makihalubilo sa mga mula sa ibang sambahayan sa loob ng bahay. Ang bawat babae ay pinagmulta ng £ 200 para sa paglabag sa mga regulasyon, sinabi ng puwersa. Sinabi ng West Midlands Police na ang limousine ay naglalakbay mula Bilston patungong Sedgley, Sinabi ng isang tagapagsalita: ""Ang sasakyan ay unang tumigil sa Bilston, kung saan ang lahat ng pito, na may edad na 20, 30 at 40, ay nagsabing nakatira sila sa iisang sambahayan. "" Sa pagbaba ng sasakyan sa Sedgley, naging malinaw sa mga opisyal na hindi ito ang kaso at ang mga multa ay inisyu."" Sundin ang BBC West Midlands sa Facebook, Twitter at Instagram. Ipadala ang iyong mga ideya sa kuwento sa: newsonline.westmidlands@bbc.co.uk",Pitong kababaihan ang pinagmulta dahil sa paglabag sa mga paghihigpit sa COVID-19 matapos mahuli na magkasama sa isang limousine.
