text,summary
"Sinabi ng Met Police na tinawag ang mga opisyal sa Holland Walk bandang 17:30 GMT sa mga ulat ng isang saksak. Dumalo ang mga paramedic at air ambulance ngunit sa kabila ng pagsisikap na iligtas siya, idineklara siyang patay sa pinangyarihan. Sinabi na sa kanya ang kanyang mga kamag-anak. Isang lalaki ang naaresto sa hinala ng pag-aaway. Ang Seksyon 60 - na nagpapahintulot sa mga opisyal na huminto at maghanap ng kapangyarihan - ay ipinagkaloob hanggang 07:00. Hinihikayat ang sinumang may impormasyon na makipag-ugnayan sa pulisya. Mga Kaugnay na Link sa Internet Ang Met Police","Patay ang isang tinedyer matapos siyang saksakin sa Islington, hilagang London."
"Sinabi ng Human Rights Watch (HRW) na ang mga pagsusuri sa hymen ay ""nakakapinsala at nakakahiya."" Sinabi ng isa pang grupo na maaaring katumbas sila ng pagpapahirap. Ipinagtanggol ng militar ng Indonesia ang mga pagsubok, na nagsasabing pinipigilan nito ang mga imoral na kababaihan na pumasok sa sandatahang lakas. Ang pulisya ng Indonesia ay nahaharap sa pagpuna noong nakaraang taon dahil sa pag-aatas ng mga pagsusuri. Bukod sa HRW, nagsalita rin ang International Rehabilitation Council for Torture Victims (IRCT) tungkol sa kasanayan bago ang isang kumperensya sa gamot militar sa Bali, Indonesia. Inilarawan ng IRCT ang pagsubok bilang ""isang matinding paglabag sa mga karapatan ng kababaihan at isa na maaaring katumbas ng maling pagtrato at pagpapahirap sa ilalim ng internasyonal na batas"". Sinabi rin ng dalawang organisasyon na ang mga nobyo ng mga lalaking opisyal ay kailangang suriin bago magpatuloy ang kasal, bagama't sinabi ng armadong pwersa sa AFP na hindi ito ang kaso. 'Masamang ugali' Sinabi ng isang tagapagsalita ng militar ng Indonesia, si Fuad Basya, sa BBC na ang pagsubok ay ""may kaugnayan pa rin"". Sinabi niya na nauunawaan niya kung bakit ang ilang mga di-birhen ay dapat maghangad na sumali sa militar, at idinagdag: ""Maaaring ito ay dahil sa isang aksidente, sakit o dahil sa isang ugali"" - ibig sabihin ay pakikipagtalik. ""Kung nakagawian nila ito, hindi maaaring tanggapin ng militar ng Indonesia ang mga potensyal na recruit na tulad nito,"" sabi ni Basya. Itinuturing ng World Health Organization (WHO) ang virginity tests bilang isang uri ng sekswal na karahasan. Sinasabi rin nito na ang kasanayan ay walang siyentipikong bisa. Mayroong maraming mga kadahilanan kung bakit ang hymen ng isang babae (isang lamad na bahagyang sumasaklaw sa vaginal opening) ay maaaring hindi lumitaw na ""buo"" sa pagsusuri. Matapos ang malawakang pagkondena noong 2014 sa paggamit ng puwersa ng pulisya ng Indonesia sa kasanayan para sa mga recruit, sinabi ng gobyerno na hindi na nito kakailanganin ang mga kababaihan na nag-enroll sa isang kolehiyo para sa mga kawani ng pamahalaan na sumailalim sa pagsusuri. Ang isang lokal na plano na ipag-uutos sa mga batang babae sa bahagi ng Java na sumailalim sa tinatawag na mga pagsusulit sa pagkabirhen bago sila makakuha ng diploma sa sekondarya ay tinanggal matapos ang isang sigaw nang mas maaga sa taong ito.",Hinimok ng mga aktibista ng karapatang pantao ang Indonesia na itigil ang pag-uutos sa mga babaeng rekrut ng militar na sumailalim sa tinatawag na virginity testing.
"Nagsimula ang sunog nang sirain ang gusali sa pagitan ng Martes ng gabi at Miyerkules ng umaga. Ang museo ay matatagpuan sa Bogside, malapit sa kung saan ang ilan sa 14 na biktima ng Bloody Sunday ay pinatay noong 1972. Sinabi ni John Kelly, na ang kapatid na si Michael, na ang pinsala sa gusali ay maaaring mas masahol pa. ""Tiningnan ko ito at naisip ko: ""Mabuti na Diyos, kung talagang nasunog iyon, maaari kaming magkaroon ng pagsabog"". Ang isang £ 2.4m na muling pagtatayo ng museo ng Glenfada Park ay nagsimula noong 2015 at ngayon ay malapit nang makumpleto. Si Mr. Kelly ay nagtatrabaho sa proyekto sa nakalipas na 10 taon. ""Ipinapakita nito ang kabuuang kawalang-galang sa aking kapatid at sa lahat ng namatay sa Bloody Sunday at lahat ng iba pa na nawalan ng buhay sa panahong iyon, lubos na kawalan ng respeto sa mga miyembro ng aming pamilya at sa kanilang memorya,"" sabi niya. ""Sinabi sa akin ng pulisya na may sunog at nasa likod ng tindahan, doon din kami may gas mains at electronic equipment. "" Ang gusali ay katabi ng mga bahay ng mga tao at maaaring naapektuhan ito ng lahat. Hindi na ito naglakbay pa, salamat sa Diyos, at mayroon pa rin kaming buo na gusali,"" dagdag ni Mr. Kelly. Sinabi ng foreman ng building site na si Dermott McGrotty na pinahusay na nila ang seguridad sa site. ""Kinailangan nilang umakyat sa isang walong talampakan na bakod upang makapasok, kaya ang magdamag na seguridad ay naayos na ngayon at tinitiyak namin na ang mga pintuan ay maayos na naka-secure."" Itinuturing ng Northern Ireland Fire Service ang sunog bilang sinasadya. Humingi na ng impormasyon ang pulisya.","Ang isang pag-atake ng panununog sa site ng bagong Museum of Free Derry ay nagpapakita ng ""kabuuang kawalang-galang"" para sa mga biktima, sinabi ng isang kamag-anak ng Bloody Sunday."
"Ang biktima ay kinagat sa kanyang bibig at napunit ang kanyang ilalim na labi sa Wolverhampton. Naglalakad siya pauwi sa isang alleyway papunta sa Ellerton Walk nang salakayin siya ng isang itim at puting aso. Nangyari ito sa 15:35 BST noong Oktubre 19. Naglabas ang pulisya ng graphic photo sa ngalan ng pamilya sa pagsisikap na masubaybayan ang hayop at ang may-ari nito. Sinabi ng West Midlands Police na ang batang babae ay nagdusa ng ""kakila-kilabot na pinsala"" sa pag-atake at mangangailangan ng malawakang plastic surgery. Ang aso, na nag-iisa nang walang makita, ay inilarawan bilang isang husky o German shepherd-type. Ang mga tiktik ay humihingi ng impormasyon.",Isang 12-anyos na batang babae ang naiwan na may mga pinsala na nagbabago sa buhay matapos na salakayin ng aso.
"Ito ay sa kabila ng isang 1% na pagbagsak sa kita bawat bahagi sa parehong oras. Ang survey ng pay consultancy na MM&K at ng proxy voting agency na Manifest ay tumingin sa pinakabagong taunang ulat ng 657 kumpanya. Ang ulat ay dumating habang ang mga kumpanya tulad ng Tesco ay nahaharap sa pagtaas ng galit ng mga mamumuhunan sa kanilang mga patakaran sa suweldo ng ehekutibo. Sa taunang pagpupulong ng Tesco noong Biyernes, 47% ng mga shareholder ang bumoto laban sa patakaran sa pagbabayad ng boardroom o nag-abstain. Ang Marks at Spencer ay nagdaraos ng taunang pagpupulong ng shareholder sa susunod na linggo at maaaring harapin ang katulad na backlash. Maraming mamumuhunan ang inaasahang bumoto laban sa ulat ng remunerasyon ng M&S bilang protesta laban sa bumper pay package na iginawad sa bagong punong ehekutibo na si Marc Bolland, na makakatanggap sa kanya ng halos £ 8.5m sa suweldo at mga gantimpala sa kompensasyon, at ang £ 2.8m bonus na iginawad sa papalabas na boss na si Sir Stuart Rose. Mga resulta v pagsisikap Pinapayuhan ng Manifest ang mga institusyonal na mamumuhunan sa pagboto sa mga bagay tulad ng sahod. ""Sa isang kamakailang pagpupulong sa isang malaking institutional investor, sinabi sa amin na ang mga kumpanya ay darating sa kanila at humihiling na ang mga executive ay gantimpalaan para sa mahirap na pagsisikap na ginawa nila sa kamakailang napakahirap na oras,"" sabi ng ulat. ""Ang mga namumuhunan ay hindi gaanong tumatanggap sa gayong mga kahilingan, mas pinipili na ang mga ehekutibo ay gagantimpalaan para sa mga output (resulta) sa halip na mga input (pagsisikap)."" Sinabi ni Cliff Weight, direktor ng MM&K, na natuklasan ng pag-aaral na ang mga scheme ng insentibo ay idinisenyo upang ""masiyahan ang punong ehekutibo at sa katunayan ay nag-aalok ng kaunting insentibo para sa anumang bagay na higit sa 'sapat' na pagganap"". ""Kung nais ng mga komite na maiwasan ang pagpuna sa AGM at tingnan ang mga shareholder sa mata, kailangan nilang magbago at maging mas masigasig at mapaghamong,"" dagdag niya. Mga Kaugnay na Link sa Internet Manifest MM & K Tesco Marks at Spencer","Ang mga boss sa nangungunang 100 nakalistang kumpanya ng UK ay nakakita ng pagtaas ng kanilang suweldo ng 5% mula noong 2008 sa average na £ 3.1m, sinabi ng isang ulat."
"Si Elton Gashaj ay namatay mula sa isang saksak sa dibdib sa Salt Hill Park, Slough, noong Setyembre 21. Ang 15-taong-gulang na akusado, na hindi maaaring pangalanan para sa mga legal na kadahilanan, ay nagsumamo na hindi nagkasala sa isang bilang ng pagpatay sa Reading Crown Court noong Miyerkules. Itinanggi rin niya ang isang bilang ng pag-aari ng isang artikulo na may talim. Nakatakdang humarap siya sa parehong hukuman sa Enero 20.",Itinanggi ng isang tinedyer ang pagpatay sa isang 15-taong-gulang na batang lalaki sa isang skate park.
"Ang Hafod y Gest ay binuksan bilang isang pansamantalang gusali at hindi inaasahang gagamitin pa rin. Nagpahayag naman ng pagkabahala ang mga pamilya ng 10 residente sa magiging epekto nito sa kanilang kalusugan kung kailangan nilang lumipat sa lugar. Sinabi ng isang ulat ng konseho na ang bahay ay maaaring magsara sa Abril 2014, at ang site ay gagamitin para sa suportadong pabahay. Inirekomenda ng mga opisyal na isara ang bahay. Sinabi ng ulat na isinasaalang-alang ng Older People Services Transformation Project Board ang pagpapanatili ng ari-arian at paggawa lamang ng mahahalagang gawain dito, o ganap na pag-renovate ng gusali at pagtaas ng kapasidad doon. Gayunpaman ang mga pagpipiliang iyon ay tinanggihan, at isinasaalang-alang ngayon ng konseho ang paggamit ng site para sa isang pagbuo ng dagdag na pabahay sa pangangalaga, para sa mga taong maaaring mabuhay nang mas malaya na may sapat na suporta. Sinabi ng ulat na magkakaroon ng isang buong talakayan sa mga residente at kanilang mga pamilya tungkol sa kanilang hinaharap na pabahay kung magsasara ang Hafod y Gest, at nabanggit na ang ilang mga residente ay nais na lumipat nang magkasama.",Isang 40-taong-gulang na care home sa Porthmadog ang magsasara kasunod ng desisyon ng mga konsehal ng Gwynedd.
"Ang £ 130m na proyekto ay inilagay sa pagsusuri sa paggastos ng gobyerno. Binigyan na ngayon ng Department for Transport ang konseho ng go-ahead upang mag-bid para sa pagpopondo matapos nitong bawasan ang gastos sa humigit-kumulang na £ 88m. Sa kabila ng pagtitipid, sinabi ng awtoridad na pinamumunuan ng Tory na ""lubos na nilalayon"" na matiyak na ang bypass ay magiging isang dual-carriageway road. Mayroon na itong hanggang Setyembre para gumuhit ng mas detalyadong bid sa pagpopondo. Ang gobyerno ay maglalabas ng pinal na desisyon sa scheme sa pagtatapos ng 2011.",Ang mga plano ng Lincoln sa Eastern Bypass ay sumulong matapos bawasan ng konseho ng county ang gastos ng scheme.
"Ang pagtatanong ay dumating matapos sabihin ng bidder na Live Nation na ito ang naging majority shareholder ng kaganapan noong Marso. Ang Competition and Markets Authority (CMA) ay nag-iimbestiga kung ang pagkuha ay hahantong sa isang ""makabuluhang pagbawas ng kumpetisyon"". Sinabi nito na hiniling nito sa Live Nation at sa festival na gumana nang hiwalay hanggang sa sumang-ayon ito sa anumang pagsasanib. Ang Live Nation, na tumangging magkomento, ay lumipat upang kumuha ng isang kinokontrol na taya ng festival sa pamamagitan ng LN-Gaiety - ang joint venture nito sa UK kasama ang Gaiety Investments ng music mogul na si Denis Desmond. Sa pag-anunsyo ng plano noong nakaraang buwan, sinabi ni Mr. Desmond na ""hindi kapani-paniwala"" na idagdag ito sa portfolio nito ng higit sa 85 mga festival ng musika sa buong mundo, kabilang ang Reading, Leeds, Wireless at T in the Park. Sinabi ng tagapagtatag ng Isle of Wight Festival na si John Giddings na ang pakikipagsosyo ay ""magbibigay sa amin ng kakayahang ma-access ang scale at talent pool ng kumpanya, na nagdadala ng mas maraming mga kilos at isang mas mahusay na karanasan sa UK"". Ang Live Nation ay nasa isang pagbili kamakailan, na gumawa ng walong pangunahing acquisition sa buong mundo noong 2016, habang ang deal sa Isle of Wight Festival ay minarkahan ang ikaanim na deal sa taong ito. Sinabi ng CMA na wala pa itong itinakdang petsa para sa mga pagsusumite ng konsultasyon o desisyon nito. Noong Oktubre, nagbanta ang mga organizer na kanselahin ang kaganapan ngayong Hunyo maliban kung ang mga pagbabago sa bayad ay napagkasunduan sa Solo Promoters Ltd. Ngunit nang sumunod na buwan, si Sir Rod Stewart ay inihayag bilang headliner. Inaasahang makakaakit ito ng mga 42,000 tagahanga, kasama ang iba pang mga kilos kabilang sina DJ David Guetta, indie-pop group na Bastille at singer-songwriter na si George Ezra na inihayag. Muling binuhay ni Giddings ang festival noong 2002 matapos ang 32 taong hiatus. Una itong nagsimula noong 1968, kasama ang gitarista na si Jimi Hendrix na gumawa ng isang headline na pagganap noong 1970.",Ang isang takeover bid para sa Isle of Wight Festival ay iniimbestigahan ng isang watchdog sa gitna ng mga alalahanin sa deal.
"Sa linggong ito sina Alderney at Sark ay parehong nagdaos ng isang Vin D'honneur upang magpaalam sa Kanyang Kamahalan bago siya umalis sa opisina sa 23 Pebrero. Sinabi ni Vice-Admiral Sir Fabian Malbon, na kinatawan ng kanyang kamahalan sa isla, na sinusundan niya nang mabuti ang mga kaganapan sa Bailiwick. Sinabi niya: ""Kadalasan kapag pumunta ka sa brief sa kanya siya ay alam niya ang higit pa kaysa sa iyo."" Sinabi ni Sir Fabian: ""Siya ay lubos na interesado sa mga dependencies. "" Sa Sark ito ay naging isang abalang limang taon para sa kanila, nagkaroon sila ng ilang mga malalaking desisyon na gagawin, mayroon na silang isang ganap na demokratikong pamahalaan na nagpapatakbo ng lugar. Alam niya iyon at pinagmamasdan niya ang mga bagay-bagay."" Ang Reyna ay opisyal na pinamagatang Duke ng Normandy sa mga isla.",Sinabi ng Tenyente Gobernador ng Guernsey na ang Reyna ay madalas na mas nakakaalam tungkol sa Bailiwick kaysa sa kanya.
"Ang kampanya sa Yanbian Korean Autonomous Prefecture sa lalawigan ng Jilin ay pangunahing nakatuon sa mga North Koreans na tumatakas sa kahirapan at pag-uusig sa kanilang tahanan. Kilala ang China na regular na nagpapauwi sa mga North Koreans na madalas na tumawid sa hangganan nang hindi natuklasan. Ayon sa mga grupo ng karapatang pantao, marami ang nahaharap sa parusa kapag bumalik sila. ""Ang mga dayuhan na iligal na pumasok, nagtatrabaho at nag-overstay ay mga nakatagong problema, at maaari silang magdulot ng mga potensyal na banta sa katatagan ng lipunan,"" sabi ni Li Yongxue, isang opisyal ng pulisya mula sa Yanbian. Sinabi ng pulisya na nais nilang sugpuin ang mga kriminal na aktibidad upang mapanatili ang kaayusan. Idinagdag pa nila na ang mga walang wastong dokumento ay ipapadala pabalik. Marami sa mga iligal na imigranteng ito ay may mga kamag-anak sa Tsina, ang ilan ay dumating upang magtrabaho, habang ang iba ay gumagamit ng Tsina bilang isang staging post bago lumipat sa ibang mga bansa, ayon kay Michael Bristow ng BBC. Sinabi ng isang opisyal ng pulisya mula sa lalawigan sa BBC na ito ay isang sensitibong taon sa Tsina, at binibigyang-diin ng mga opisyal ang pangangailangan para sa katatagan bago ang pagbabago ng pamumuno sa taong ito.",Inilunsad ng Tsina ang pagsisikap laban sa iligal na imigrasyon sa hilagang-silangang rehiyon na hangganan ng Hilagang Korea.
"Sinabi ng mga opisyal sa timog-silangang estado ng Minas Gerais na isang tao ang kumpirmadong namatay. Ayon sa mga ulat, aabot sa 16 ang namatay at ang iba pa ay nawawala. Ang mga ilog ng makapal na pulang putik ay umaagos sa mga lambak ng maburol na lugar sa labas ng lumang kolonyal na lungsod ng Mariana. Binalot nito ang mga kotse at trak, at sinira ang mga bahay. Sinabi ng mga awtoridad sa Mariana na naputol ang dam noong Huwebes ng hapon at nagpadala ng mga agos ng putik at kalat sa maliit na bayan ng Bento Rodrigues, mga 7km (apat na milya) ang layo. Sinabi ni Julia Dias Carneiro ng BBC sa Rio de Janeiro na ang lugar na apektado ay tahanan ng humigit-kumulang 500 katao. Ang operasyon ng pagsagip ay nahadlangan ng takot sa pagguho ng lupa ngunit ang mga helikopter ay nagdala ng ilang mga stranded na tao sa ligtas na lugar, dagdag niya. Nagbabala ang mga awtoridad na ang tubig na may halong nalalabi mula sa mga operasyon ng pagmimina ay maaaring nakakalason. Sinabi ng isang tagapagsalita ng kumpanya ng pagmimina ng Samarco, na nagmamay-ari ng dam, na hindi pa alam ang sanhi ng paglabag.","Mahigit isang dosenang katao ang pinangangambahan na patay matapos pumutok ang isang dam na pumipigil sa basura mula sa isang minahan ng iron ore sa Brazil, na binaha ang mga kalapit na bahay."
"Narinig ng mga konsehal ang mga alalahanin na mas maraming trabaho ang kailangang gawin upang matulungan ang mga residente na nahihirapan sa kasalukuyang tatlong lingguhang sistema. Sa kasalukuyan, 10,000 sambahayan ang nasa apat na lingguhang koleksyon ng itim na basurahan, na ipinakilala bilang isang pagsubok noong 2016. Wala pang petsa kung kailan muling tatalakayin ang isyu.",Bumoto ang gabinete ng konseho ng Conwy na ipagpaliban ang pagpapakilala ng apat na lingguhang serbisyo sa pagkolekta ng basurahan para sa buong county.
"Ang mga pagsabog na limang minuto ang pagitan ay pumatay ng 21 katao sa dalawang pub noong Nobyembre 21, 1974. Ang code na ibinigay na may mga babala sa bomba sa telepono ay nakikilala ang mga ito mula sa mga panloloko, noong unang bahagi ng 1970s. Sinabi ng dating tiktik na si John Plimmer na wala itong praktikal na pagkakaiba sa mga tugon ng mga indibidwal na opisyal. Pinaniniwalaang isinagawa ng Irish Republican Army ang mga pambobomba, ngunit walang umamin sa responsibilidad. Sa gabi ng Mulberry Bush at Tavern sa mga pub ng Town ay binomba, ginamit ng tumatawag ang pariralang ""Double X"", ayon sa pagdinig ng pagsisiyasat. Sinabi ng mga frontline officer na ipinadala sa dalawang eksena sa hurado na hindi sila sinabihan na ang mga paunang babala ng bomba, na tinawag nang alas-8:11 ng gabi, ay sinamahan ng code. Sinabi ni Mr. Plimmer, na ngayon ay nasa pitumpu na taon, ""Ito ay napakabihirang ito ay [ipinasa pababa]. "" Karaniwan naming nalaman na ito ay isang naka-code na babala pagkatapos ng kaganapan."" Idinagdag pa niya na sa palagay niya ay wala itong pagkakaiba, maliban sa pagtaas ng antas ng ""adrenaline."" Bagaman, tinanggap niya na ""maaaring magkaroon ng isang mas matigas na sistema"" ng pagpasa sa katotohanan ng mga naka-code na babala, nang tanungin ni Lesley Thomas QC, na kumakatawan sa siyam sa mga naulilang pamilya. Sinabi ng dating constable na si Rod Hazlewood, na narekober ang anim na bangkay mula sa Mulberry Bush, na ""inaasahan niya"" na masabihan siya tungkol sa mga naka-code na babala mula sa kanyang station controller. Idinagdag niya na kung sinabi sa kanya ang tungkol sa mga naka-code na babala ay ""mas naaangkop na idirekta ka nito"". Narinig din ng hurado, ang kanyang sub-dibisyon ay nasa ""kalahating lakas"" nang gabing iyon. Inaasahan ang problema bago ang mga bomba ng mga awtoridad, na nag-utos sa mahigit 1,600 pulis na i-secure ang funeral cortege ng IRA bomber na si James McDade sa Birmingham Airport. Patuloy ang mga pagsisiyasat. Sundin ang BBC West Midlands sa Facebook, sa Twitter, at mag-sign up para sa mga lokal na update ng balita nang direkta sa iyong telepono.",Sinabi ng mga pulis na tumutugon sa mga pambobomba sa pub sa Birmingham sa mga pagsisiyasat na hindi nila alam na ang mga babala ng bomba ay nai-back up ng mga salitang code ng IRA.
"Ang mga mag-aaral ng Year Six mula sa Kewaigue Primary School ay dinala sa aksidente at emergency matapos ang kaganapan sa mga laro sa tubig noong Miyerkules. Pinaniniwalaang isang detergent na ginamit sa isang water slide ang sanhi ng isyu. Mula noon ay nakalabas na ang mga bata. Sinabi ng isang tagapagsalita ng departamento na ang isang ""buong pagsusuri"" ay magaganap. Sinabi ni Kerry Pledger, na ang anak na lalaki ay nakatanggap ng paggamot, na mayroon siyang ""ilang mga sugat"", ngunit ""gumagaling nang maayos"". Sinabi niya na ang reaksyon ng paaralan ay ""ganap na kamangha-manghang"". Idinagdag niya na ang punong guro ay ""lubhang humihingi ng paumanhin"" at ""palaging nakikipag-ugnayan"" sa mga magulang. ""Ito ay isang kakila-kilabot na aksidente kapag ang lahat ng paaralan ay sinusubukan na gawin ay magkaroon ng ilang kasiyahan para sa mga bata,"" sabi niya. Sinabi ng tagapagsalita ng Department of Education, Sport and Culture na ang mga bata ay nakatanggap ng ""paggamot at katiyakan"" sa Noble's Hospital. ""Ang gobyerno ay nakatuon sa pagtiyak na ang kalusugan at kaligtasan ay isang priyoridad sa loob ng mga paaralan at isang buong pagsusuri sa insidente ay isasagawa sa lalong madaling panahon,"" dagdag niya.","Limang bata ang dinala sa ospital dahil sa ""pangangati ng balat"" kasunod ng isang ""splash day"" sa isang paaralan, kinumpirma ng kagawaran ng edukasyon."
"Nakatakdang maglaro si Sheeran sa mga opening party sa Hunyo 5 at 6. Ang Two Door Cinema Club ay magsasara ng kaganapan sa pamamagitan ng mga gig sa Setyembre 18 at 19. Ang Arctic Monkeys, The Prodigy, Plan B at Kasabian ay nauna nang naglaro sa festival. Sinabi ni Alex Trimble mula sa Two Door Cinema Club na ang banda ay ""nasasabik"" na gumanap. Ang Ibiza Rocks ay inilunsad noong 2005 at ngayon ay nagaganap tuwing tag-init, na nagho-host ng dalawang live na gig bawat linggo - isa sa Ibiza at isa sa Mallorca. Sa kabuuan, 32 live na gig ang nagaganap sa loob ng 16-linggong festival. ""Hindi pa kami naglaro sa Ibiza o Mallorca dati, kaya medyo kapana-panabik para sa amin na magawa ito,"" sabi ni Trimble sa Newsbeat. Nang tanungin tungkol sa kung ano ang maaaring asahan ng mga tagahanga mula sa kanilang palabas, sinabi niya: ""Pinagsama-sama namin ang aming pangalawang album kaya malamang na maraming bagong materyal. "" Malinaw na maglalaro kami ng mga bagay mula sa unang album, ngunit marahil susubukan naming makakuha ng isang bagay na espesyal na magkasama, mga paputok o kung ano pa man. "" Inilabas ng Two Door Cinema Club ang kanilang debut album na Tourist History noong 2010. Mas maaga sa taong ito, ang trio ay naglaro nang live sa isang bilang ng mga festival ng musika kabilang ang Isle Of Wight, Lollapalooza at sa pangunahing entablado sa Reading at Leeds. Nanguna si Ed Sheeran sa UK album chart nang mas maaga sa taong ito sa kanyang debut album. Ang 20-taong-gulang ay nakapuntos din ng nangungunang 20 hits sa mga single na The A Team, Lego House at You Need Me, I Don't Need You.",Si Ed Sheeran at Two Door Cinema Club ang unang mga kilos na inihayag para sa Ibiza at Mallorca Rocks 2012.
"Ang Cumbria Police Authority ay nagtakda ng pangwakas na badyet nito, na nagsasangkot ng pagtitipid ng £ 18.7m sa susunod na apat na taon, na inilalarawan ito bilang ""walang uliran"" na oras. Bilang karagdagan sa pagbawas ng bilang ng mga opisyal, na makakamit sa pamamagitan ng natural na pag-aaksaya, 235 mga posisyon ng kawani ang pupunta. Sinabi ng chairman ng awtoridad na si Ray Cole na sinusuportahan nito ang programa ng puwersa ng pagbawas at hiniling na hindi maapektuhan ang frontline policing hangga't maaari. Sinabi niya: ""Ang badyet na napagkasunduan namin ngayon ay ang una sa isang apat na taong panahon ng paglipat at tinatayang 66% ng mga pagbawas sa badyet na kinakailangan ay sa unang dalawang taon. "" Ang mga pulis ay nahaharap sa ilang mga mahirap na hamon dahil sa laki ng mga pagbawas sa badyet sa loob ng apat na taon. "" 'Mga oras ng pagtugon' Sinabi ni Cumbria Chief Constable Craig Mackey na ito ay isang mahirap na oras para sa puwersa. Sinabi niya: ""Ito ay isang medyo maliit na bilang ng mga opisyal ngunit hindi ko minamaliit ang epekto na ang mga pagbawas na ito ay magkakaroon ng pinagsama-sama sa mga tuntunin ng kakayahang makita ng mga opisyal. "" Ang pinagtatrabahuhan namin ay mayroon kaming mga tao na magagamit at nagagawa pa rin naming matugunan ang mga kahilingan na dumarating mula sa publiko. "" Ngunit sinabi ni Andy Wilson, tagapangulo ng Cumbria Police Federation, na nag-aalala siya tungkol sa epekto. ""Magkakaroon ng mas kaunting mga opisyal ng pulisya na sumasaklaw sa mas malalaking lugar,"" sabi niya. ""Sa kaso ng Cumbria mayroon kaming maraming mga nayon at bayan sa kanayunan kaya ang mga oras ng pagtugon ay mababawasan . "" Dahil ito ay isang alamat na maaari naming matugunan ang mga tugon na may 20% na pagbawas na sinasabi nila sa amin na dapat naming gawin. ""","Magkakaroon ng 100 mas kaunting mga opisyal ng pulisya sa Cumbria, nakumpirma."
