text,summary
"Ang Defense Estates, na nagpapatakbo ng humigit-kumulang 2,400 ektarya para sa MoD, ay pinalitan ng bagong Defense Infrastructure Organization. Sinabi ng MoD na ang mga pagbabago ay makakatipid ng £ 1.2bn sa unang apat na taon. Sinabi ng unyon ng Unite na ang desisyon ay ""ganap na kabaliwan,"" at hinimok ang gobyerno na baguhin ang isip nito. Ang mga plano na alisin ang 25,000 trabaho sa sibilyan ng MoD ay nakabalangkas sa strategic defense review noong nakaraang taon. Sinabi ng departamento na kumonsulta ito sa mga unyon ng manggagawa tungkol sa mga pagbabago, na sinasabi nito na ""pinagsasama-sama ang mga nagtatrabaho sa aktibidad ng estate at imprastraktura sa buong Ministry of Defense"". Sinabi nito na magsasama-sama ito ng 7,000 kawani - karamihan ay mga sibilyan - na nagtatrabaho sa konstruksiyon, pagpapanatili at pagtatapon ng lupa at mga gusali na pag-aari ng MoD. Karamihan sa kanila ay kasalukuyang nagtatrabaho para sa Defense Estates, bagaman ang ilan ay nagtatrabaho sa mga trabaho sa imprastraktura sa RAF, Army at Royal Navy o mas maliliit na organisasyon. 'Mapaminsalang balita' Sinabi ni Defense Secretary Liam Fox na ang pagkakaroon ng isang organisasyon na nagpapatakbo ng estate ay magbibigay ng ""mas mahusay na estratehikong pamamahala"" at makatipid ng pera sa mga gastos sa pagpapatakbo. ""Sa pamamagitan ng paggawa ng mga pagbabagong ito inaasahan naming makatipid ng tungkol sa 2,500 mga post sa pamamagitan ng 2014 at ilang £ 1.2 bilyon sa unang apat na taon lamang, nang hindi binabawasan ang pagiging epektibo o pagiging maaasahan ng serbisyong inihahatid namin. "" Ang panukalang ito ay magbibigay ng malaking kontribusyon sa pagbawas ng mga kawani ng sibilyan at mga hakbang sa kahusayan na itinakda noong nakaraang Oktubre sa Strategic Defense and Security Review."" Sinabi niya na ito ang unang pagbabago na nagmula sa gawain ng yunit ng reporma sa depensa na naglalayong baguhin ang istraktura ng MoD. Sinabi ng pambansang opisyal ng Unite na si Kevin Coyne: ""Ito ay nagwawasak para sa aming mga miyembro. Ito ay ganap na kabaliwan, ginugol ng mga Tories ang 80s sa desentralisasyon ng MoD at ngayon ay sentralisado nila ito nang may Stalinistang sigasig. ""Sa 2,500 na mas kaunting kawani, ang pagpapanatili at pagpapatakbo ng mga ari-arian at lupa ng MoD ay tatakbo sa isang shoestring na ginagawang masama ang aming mga pwersa at kanilang mga pamilya. Hinihikayat namin ang gobyerno na umatras sa desisyong ito.""","Humigit-kumulang 2,500 trabaho sa Ministry of Defense ang mapupunta sa loob ng tatlong taon, habang binabago ng departamento ang paraan ng pamamahala nito sa lupa at mga gusali nito."
"Ni Danny ShawHome affairs correspondent na si Joseph McCann, 34, ay umano'y dinukot at ginahasa ang tatlong babae sa hilagang London at Watford noong nakaraang linggo. Hindi siya - ngunit dapat sana - ay isinangguni sa Parole Board bago siya pinalaya mula sa bilangguan noong Pebrero, habang nasa kalagitnaan ng paghahatid ng sentensya para sa pagnanakaw. Sinabi ng Ministry of Justice na isinasagawa ang ""kagyat na pagsusuri"" sa kaso. Si McCann ay nabilanggo noong 2008 dahil sa aggravated burglary matapos aminin na pumasok siya sa bahay ng isang 85-taong-gulang na lalaki. Binigyan siya ng Indeterminate Sentence for Public Protection (IPP) na may minimum na termino, o taripa, na dalawa't kalahating taon. Nangangahulugan ito na kailangang magpasya ang Parole Board kung ligtas siyang palayain kapag nag-expire na ang kanyang taripa noong 2010. Noong 2017 siya ay pinalaya sa lisensya, na nangangahulugang maaari siyang ibalik sa bilangguan kung siya ay muling nagkasala o lumabag sa kanyang mga kondisyon sa parole. Kalaunan sa taong iyon, habang nasa lisensya, si McCann ay naaresto at inakusahan ng isa pang pagnanakaw. Binigyan siya ng tatlong taong pagkabilanggo. Ang kaso ni McCann ay dapat na isinangguni sa board bago siya pinalaya ngunit noong Pebrero ng taong ito siya ay tinatrato bilang isang ""determinate sentence"" na bilanggo. Nangangahulugan ito na awtomatikong pinalaya siya sa loob ng 18 buwan sa kanyang sentensya. Ang isang £ 20,000 na gantimpala ay inaalok ng Metropolitan Police para sa impormasyon tungkol sa kinaroroonan ni McCann na humahantong sa kanyang pag-aresto at pag-uusig. Inilarawan ng mga tiktik si McCann bilang ""lubhang mapanganib"" at sinabing dapat tumawag ang mga tao sa 999 kung nakita nila siya. Inilarawan siya bilang puti, may maskulado na pangangatawan, kalbo ang ulo o ahit na blond na buhok, maikling balbas, at ang pangalang ""Bobbie"" ay may tattoo sa kanyang tiyan. Mga Kaugnay na Link sa Internet Ang Met Hertfordshire Constabulary","Ang isang pinaghihinalaang triple rapist na hinahabol ng pulisya ay maaaring nagkamali na pinalaya mula sa bilangguan, lumilitaw."
"Gustung-gusto niya ang paglipad at mga aktibidad sa tubig. Naghahanap ng mas batang lalaki na may katulad na interes - dapat tangkilikin ang paglangoy, paglipad at panlabas na buhay. Sa merkado para sa isang mahusay na gaggle - walang feather pruners mangyaring. Ito ay maaaring mukhang tulad ng isang hindi pangkaraniwang personal na ad, ngunit ang isang malungkot na gansa sa Moira ay tila nalulungkot matapos ang kanyang kasamahan ay namatay nang malungkot. Ngayon ay nag-apela na siya para makahanap ng bagong lalaki - o gander para maging eksakto. Si Barbara Mladek ay ang tagapagtatag ng Northern Ireland Battery Hen Rescue at sinusubukan na makahanap ng isang ""mas mature"" na gander. ""Ang isang kaibigan ko ay nagkaroon ng isang pares ng mga gansa sa loob ng mahabang bilang ng mga taon. "" Sa kasamaang palad ang gander ay namatay noong Huwebes ng gabi at ang 21-taong-gulang na gansa ay talagang nababagabag sa pagnanais para sa kanyang asawa,"" sabi niya. Ipinaliwanag ni Ms. Mladek na ang mga gansa ay nag-aasawa habang buhay, ngunit kung ang isa ay mamatay, maaari silang tumugma muli kung ang isa pang gansa ay dumating nang mabilis. ""Sa sandaling ipakilala mo ang mga ito nang isa-isa, agad na pinoprotektahan ng gansa ang gansa, nagbabahagi sila ng isang balde ng tubig, at gumawa ng isang ritwal ng paglubog ng ulo na nagsasabing 'oo, akin ka na ngayon.' ""Ito ay isang magandang bagay na panoorin."" Itinatag niya ang Northern Ireland Battery Hen Rescue anim na taon na ang nakararaan at optimistiko na makakahanap siya ng tugma para sa gansa. ""Natagpuan ko na ang isang gander bago para sa isang tao na naghahanap ng kapareha para sa kanyang gansa. "" Maraming tao sa Northern Ireland ang may kawan ng mga gansa; Siguro napakarami nilang ganders, o baka nawalan ng kapareha ang isang mas matandang gander."" Kung mayroon kang isang gander na maaaring magkasya sa bill maaari kang makipag-ugnay kay Barbara sa pamamagitan ng pahina ng Facebook ng Northern Ireland Hen Rescue.",Ang 21-taong-gulang na ibon ay naghahanap ng bagong tao para sa kasamahan at marahil higit pa.
"Ang Everton Nurseries malapit sa Lymington, Hampshire ay nagpakita ng isang karatula na humihimok sa mga customer na ""mangyaring mag-stock"" sa mga metaldehyde pellets. Sinabi ng Friends of the Earth na ""iresponsable"" na hikayatin ang paggamit ng kemikal na ipagbabawal dahil sa mga alalahanin tungkol sa mga epekto nito sa wildlife. Kalaunan ay humingi ng paumanhin ang tindahan, na sinasabing ito ay ""ganap na mali"". Noong nakaraang taon inihayag ng gobyerno ang pagbebenta ng Metaldehyde, isang pestisidyo na ginagamit upang kontrolin ang mga slug sa iba't ibang mga pananim at sa mga hardin, ay ipagbabawal sa Hunyo. Sinabi ng Department of Environment, Food and Rural Affairs na nagdulot ito ng ""hindi katanggap-tanggap na panganib sa mga ibon at mammal"". Ang sentro ng hardin ay naglagay ng isang karatula sa tabi ng stock nito ng metaldehyde slug pellets na nagsasabing: ""Nakalulungkot, ang pinaka-epektibong slug killer, metaldehyde, ay hindi na magagamit para sa pagbebenta"", bago hikayatin ang mga customer na mag-stock up at gamitin ang produkto sa panahon ng 12 buwan kapag ang paggamit nito ay nananatiling legal. Ang New Forest Friends of the Earth ay nag-tweet ng larawan ng karatula na inilarawan nito bilang ""kasuklam-suklam"". Sinabi nito na ang kemikal ay ""responsable para sa mga pagkamatay sa kadena ng pagkain - mga hedgehog at ibon halimbawa"". Ang Flower Power Lymo community allotment group sa Lymington ay nag-tweet: ""Mangyaring tulungan itong itigil. Ang paghikayat sa paggamit ng metaldehyde slug pellets ay mali. Pinagbawalan sila sa isang kadahilanan."" Sa isang pahayag, sinabi ng direktor ng Everton Nurseries na si Simon Collyer na ito ay isang ""masamang pagtatangka na itaguyod ang mga benta"" ng isang junior na miyembro ng kawani. ""Sumasang-ayon kami na ito ay ganap na mali upang itaguyod ang pagbebenta ng produkto sa lalong madaling panahon upang gawing ilegal. "" Ang lahat ng mga yunit ng produkto at nauugnay na signage ay inalis mula sa mga istante at ang Everton Nurseries ay hindi na mag-aalok nito para sa pagbebenta, ""dagdag niya.",Isang garden center ang pinuna dahil sa pagtataguyod ng mga slug pellets na malapit nang ipagbawal.
"Ang mga bisita ay nagreklamo tungkol sa isang oras na paghihintay sa labas sa Leicester Royal Infirmary na humahantong sa mga hindi natanggap na appointment. Inamin ng mga opisyal na may malubhang problema sa mga oras ng peak. Iginiit ng ospital at konseho ng lungsod na naghahanap sila ng mga solusyon kabilang ang mga bagong paradahan ng kotse ngunit nananatili pa rin ang mga isyu sa pagpopondo. Inamin ng mga opisyal na ang 400-space na paradahan ng kotse sa Havelock Street ay hindi makayanan ang demand, lalo na't pansamantalang nagsara ang isang kalapit na pribadong paradahan. Sinabi ni Nigel Bond, pinuno ng mga pasilidad sa University Hospitals of Leicester NHS Trust, na ang lupa malapit sa istadyum ng Leicester Tigers ay may pahintulot sa pagpaplano para sa isang multi-storey car park. ""Kami ay interesado pa rin sa iyon ngunit ang hamon sa paligid nito ay ang pagpopondo at ito ay dapat na tamang pakikitungo para sa lahat ng mga partido na kasangkot at dapat itong matugunan ang mga pangangailangan ng lahat. "" Kumunsulta rin kami sa mga pribadong tagapagbigay ng paradahan ng kotse at binubuo namin ang diskarte sa gusali para sa royal infirmary site at lubos kaming may kamalayan para sa pangangailangan para sa pampublikong paradahan sa site. "" Inamin ni Patrick Kitterick, chairman ng planning committee sa Leicester City Council, na hanggang sa maitayo ang isang bagong paradahan ng kotse, sila ay ""tinkering sa mga gilid"". ""Mayroong maraming salungatan kapag ang Jarrom Street ay nakakatugon sa Havelock Street. Kaya tinitingnan namin ang paglalaro sa isang one-way system doon. ""Ngunit hindi nito malulutas ang malaking problema na ang paradahan ng kotse ay mabigat na ginagamit sa mga tiyak na oras at ang pag-access at paglabas dito ay napakahirap.""",Sinabi ng mga boss sa isang ospital sa Leicester na naghahanap sila ng mga solusyon sa mahabang pila sa paradahan.
"Ang lider ng dulong kanan, na maupo sa puwesto sa Enero 1, ay nagduda sa mga kwalipikasyon ng mga doktor. Inakusahan din niya ang komunistang gobyerno ng Cuba na itinatago ang 75% ng kanilang suweldo, at tumangging pahintulutan ang kanilang mga pamilya na sumali sa kanila. Ang pag-alis ay maaaring makagambala sa pangangalagang pangkalusugan para sa milyun-milyong mga taga-Brazil. Bakit napakaraming mga doktor ng Cuba sa Brazil? Ang pangangalagang pangkalusugan ay ang pinaka-kapaki-pakinabang na pag-export ng Cuba. Ang programa ng tulong na ""More Doctors"" ay nagpapatakbo sa 67 bansa, at gumagawa ng isla ng $ 11bn sa isang taon. Humigit-kumulang 8,000 mga doktor ng Cuba ang nagtatrabaho sa pinakamahihirap at pinakamalayong lugar sa Brazil sa ilalim ng scheme. Sinabi ng Cuba na lahat sila ay ipatawag sa bahay sa katapusan ng Disyembre. Gayunman, sinabi ng isang Brazilian diplomatic source sa AFP na 2,000 ang malamang na mananatili dahil sa personal na relasyon. Nagbabala ang mga alkalde ng Brazil na umaabot sa 30 milyong katao ang nahaharap sa krisis sa pangangalaga - marami sa mga lugar kung saan ayaw pumunta ang mga lokal na doktor. Ang unang 196 na doktor na umalis ay sinalubong na sa Havana ng deputy health minister ng Cuba. Sinabi ng ahensya ng balita ng Cuba na ACN na ang mga medikal ay ""masaya na natupad ang kanilang misyon,"" ngunit ""nag-aalala tungkol sa kung ano ang naghihintay sa mga mamamayan [ng Brazil] sa bagong halal na pangulo"". Sinabi ng ministeryo ng kalusugan ng Brazil noong Biyernes na sisimulan nito ang pagpili ng mga lokal na doktor upang palitan ang mga umaalis na Cubans sa huling bahagi ng buwang ito.","Hinihila ng Cuba ang libu-libong mga doktor palabas ng Brazil, matapos ang tinawag nitong ""mapang-akit at nagbabanta"" na pananalita ni president-elect Jair Bolsonaro."
"Sinabi ng mga residente ng Moseley Green, malapit sa Parkend, na regular na sinisira ng mga hayop ang mga gilid ng damo sa pamamagitan ng paghahanap ng pagkain. Kinilala ng Forestry Commission na maaaring magkaroon ng higit pa sa mga hayop kaysa sa iminungkahi ng isang kamakailang survey. Ang isang cull ng komisyon ay nagsimula noong nakaraang buwan sa pagtatangka na panatilihin ang mga numero sa 400 bilang bahagi ng isang tatlong-taong plano sa pamamahala. Inaangkin ng mga lokal na ang mga pagtatantya ng 535 para sa populasyon ng baboy ay hindi tumpak at higit pa sa target na 135 hayop ang kailangang patayin upang maabot ang bilang na iyon. Sinabi ni Martin Roach, may-ari ng The Rising Sun pub, na gumastos siya ng libu-libong pounds para gawing ""kaakit-akit na lugar"" ang pub ngunit ang mga ligaw na baboy ay nagdudulot ng pinsala. ""Napinsala ako sa buong driveway,"" sabi niya. ""Lahat tayo ay gusto ang kanayunan, lahat tayo ay gusto ang kagubatan, lahat tayo ay gusto ang baboy, ngunit sa kanilang lugar. "" Napakarami nito. Napakarami namin sa kanila."" 'Mabubuhay na populasyon' Sinabi ng residente na si Clive Skinner: ""Ilang buwan na ang nakalilipas nagawa kong ayusin ang pinsala araw-araw. "" Nasa yugto na kami ngayon na ito ay malaki, pangunahing gawain upang gawin ang mga pagkukumpuni."" Mas maaga sa taong ito sinabi ng Forestry Commission na napagkasunduan ang isang buhay na populasyon ng 400 ligaw na baboy sa lugar. Sinabi nito na mayroong tinatayang populasyon ng 535 hayop, nangangahulugang 135 ang kailangang patayin bago ang susunod na Pebrero. Sinabi ni Kevin Stannard mula sa komisyon: ""Ang figure na iyon ay minimum. Naniniwala pa rin kami na mayroong higit sa 700 o 800 mga hayop sa kagubatan. ""Kung maaari naming dalhin ang antas na iyon pabalik sa 400 na dapat na maging isang mahusay na kompromiso para sa mga grupo ng kapakanan ng hayop upang makita na mayroon kaming isang tunog, mabubuhay na populasyon. "" Ngunit din para sa mga bumibisita at gumagamit ng kagubatan upang ipakita na pinamamahalaan namin ang populasyon at pinapanatili ito sa ilalim ng kontrol sa isang antas na maaaring mabuhay ang lahat. """,Ang mga taong nakatira sa isang nayon sa Forest of Dean ay nag-angkin na hindi sapat ang mga ligaw na baboy na pinapatay.
"Si Sergio Cabral ay nagsilbi ng dalawang termino bilang gobernador ng estado ng Rio mula 2007 hanggang 2014. Inakusahan siya ng pagtanggap ng kickbacks mula sa mga construction firm kapalit ng pagbibigay sa kanila ng kapaki-pakinabang na kontrata, tulad ng isang planta ng petrochemical sa Rio. Sinabi ni Judge Sergio Moro na walang sapat na ebidensya para hatulan ang asawa ni Cabral na si Adriana Ancelmo. Si Cabral ay ikinulong noong Nobyembre bilang bahagi ng Operation Car Wash, isang malaking imbestigasyon sa katiwalian na nagresulta sa pag-aresto sa isang mahabang listahan ng mga matataas na pulitiko at maimpluwensyang negosyante sa Brazil. Si Cabral ay miyembro ng Brazilian Democratic Movement Party ni Pangulong Michel Temer, na iniimbestigahan din dahil sa umano'y katiwalian. Sinabi ni Judge Moro na ang dating gobernador ay tumanggap ng 2.7 milyong reais ($ 813,000; £ 638,000) sa suhol. Sinabi ng hukom na hindi pa natagpuan ang pera at pinaghihinalaan niya na inilipat ito ni Cabral bago pa man na-block ang kanyang mga account. Ang dating ministro ng panloob para sa estado ng Rio na si Wilson Carlos Carvalho ay nahatulan din ng katiwalian at hinatulan ng 10 taong pagkabilanggo. Siya ang kanang kamay ni Cabral noong siya ay nasa puwesto.",Ang dating gobernador ng estado ng Rio de Janeiro sa Brazil ay hinatulan ng 14 na taon at dalawang buwang pagkabilanggo para sa katiwalian at money laundering.
"Ni John CampbellBBC News NI Economics & Business Editor Sinusukat ng data ang porsyento ng mga nasa hustong gulang na nagtatrabaho na nagtatrabaho. Sa panahon ng Marso hanggang Mayo 2019, ang rate ay tumaas ng 1.7 porsyento na puntos kumpara sa parehong panahon noong 2018. Sa panahon ng pag-urong, ang rate ng trabaho ay umabot sa pinakamababang 64%. Sa kabila ng pinakahuling pagtaas, ang rate ng trabaho ng Northern Ireland ay mas mababa pa rin sa average na rate ng UK na 76%. Ang kawalan ng aktibidad ng ekonomiya sa Northern Ireland ay bumaba rin sa quarter at taon sa isa sa pinakamababang rate na naitala - 25.9%. Ito ay isang sukatan ng mga taong walang trabaho at hindi naghahanap ng trabaho, kabilang dito ang mga mag-aaral, retiradong tao at mga taong may sakit o may kapansanan. Sinabi ng Northern Ireland Statistics and Research Agency (Nisra) na ang bumabagsak na rate ng kawalan ng aktibidad mula noong 2017 ay nagpapahiwatig na ang ilang mga tao ay muling pumapasok sa merkado ng paggawa. ""Ang mga pagbaba sa kawalan ng aktibidad sa ekonomiya mula noong huling bahagi ng 2017 ay nagpapahiwatig na ang mga pagbabago sa katayuan sa merkado ng paggawa ay hindi limitado sa mga nagtatrabaho o naghahanap ng trabaho, kundi pati na rin para sa mga dati nang nasa labas ng lakas ng paggawa,"" sabi ng pahayag nito. Samantala, ang paglago ng sahod sa UK ay tumaas sa 3.6% sa taon hanggang Mayo 2019, ang pinakamataas na rate ng paglago mula noong 2008, ayon sa mga numero ng Office for National Statistics. Gayunpaman, sa pag-aayos para sa inflation, ang sahod ay nanatiling matatag kumpara sa nakaraang buwan. Walang tiyak na buwanang data tungkol sa sahod para sa Northern Ireland.",Ang rate ng trabaho sa Northern Ireland ay tumaas sa isang record high na 71.7%.
"Sinabi ng Wiltshire Police na tinawag sila sa Crapper and Sons Landfill Ltd malapit sa Royal Wootton Bassett bandang 02:00 GMT noong Huwebes. Ang lalaki, na nasa edad 60 mula sa Chippenham, ay namatay sa pinangyarihan. Ang pangalawang empleyado ay hindi nasugatan. Sinabi ng kumpanya na pinamamahalaan ng pamilya na mayroong ""malaking kalungkutan"" sa mga kawani sa nangyari. Iniimbestigahan na ng pulisya at Health and Safety Executive. Sinabi ng Crapper and Sons na isinaaktibo ng mga kawani ang mga emergency protocol sa sandaling mangyari ang insidente, at makikipagtulungan sa ""lahat ng nauugnay na awtoridad"" upang siyasatin ang nangyari. Sinabi ng managing director na si Richard Crapper: ""Ito ay isang napakalungkot na araw at lahat ng aking mga saloobin ay kasama ang pamilya."" Kaugnay na Mga Link sa Internet Wiltshire Police",Isang empleyado ang namatay sa isang insidente sa isang landfill site.
"Sa ilalim ng mga panukala upang makatipid ng £ 250,000 sa isang taon, ang museo ay magsasara din ng dalawang araw sa isang linggo sa panahon ng taglamig. Sinabi ni Chief Executive Andrew Lovett na ang bilang ng mga bisita ay bumaba ng halos 40,000 kumpara sa inaasahan niya ngayong taon. ""Ang pagiging higit sa lahat sa pagpopondo sa sarili kailangan naming kumita ng halos lahat ng kailangan namin upang tumakbo, kaya ang anumang pagbagsak sa mga taong bumibisita ay may malaking epekto,"" sabi niya. ""Alam namin na ang mga tao ay gumagastos ng mas kaunti sa aming site, ang pagtaas ng mga gastos sa gasolina ay may epekto at pagkatapos ay nagkaroon kami ng isang kakila-kilabot na tag-init. "" Napakalaki ng ating mga pagkalugi at hindi na natin ito maaaring balewalain."" 'Imposibleng sitwasyon' Mula sa susunod na taon ang museo ay mawawalan din ng £ 70,000 sa isang taon na grant mula sa Dudley Council. Nagpasya ang konseho na bawiin ang pondo noong Marso dahil kailangan nitong makatipid ng £ 13m mula sa sarili nitong badyet. Sinabi ni Mr. Lovett: ""Hindi ko sinisisi ang lokal na awtoridad sa lahat. "" Hindi ako magkakaroon ng masamang salita laban sa kanila dahil tulad ng maraming mga lokal na awtoridad sa itaas at pababa sa bansa sila ay nasa imposibleng sitwasyon at kailangang gumawa ng mahirap na mga pagpipilian. "" Ang museo, na nagkakahalaga ng humigit-kumulang na £ 3.3m sa isang taon upang patakbuhin, ay kasalukuyang nagtatrabaho ng 239 katao. Sinabi nito na ang parehong kaswal at kontratang kawani ay maaapektuhan ng pagbawas ng trabaho. Sa ilalim ng mga plano, sarado ito tuwing Lunes at Martes mula Nobyembre 1 hanggang Abril. Sinabi ng museo na kasalukuyang kumunsulta ito sa mga manggagawa tungkol sa mga plano.",Sinabi ng Black Country Living Museum na plano nitong i-cut ang hanggang 70 trabaho dahil sa pagbagsak ng bilang ng mga bisita.
"Isang kumpanya ng interes ng komunidad na hinirang ng konseho ng lungsod noong Marso ang nagpapatakbo ng parada at ticketed festival. Ang parada ay nagsimula sa 11:00 BST mula sa Madeira Drive at tumatagal sa King's Road, West Street at North Street bago maglakbay sa A23 patungong Preston Park. Sinabi ng Sussex Police na 28,000 tiket ang naibenta na may pagkaantala ng hanggang dalawang oras para makapasok sa parke. Si Jason Simons, 42, mula sa London, na nakasuot ng isang pares ng mataas na takong at skimpy shorts, ay nagsabi: ""Ang pagmamataas sa Brighton ay palaging naglalagay ng isang magandang palabas. "" Lahat ay nakukuha sa diwa nito, at mayroon itong isang bagay para sa lahat. Gustung-gusto ko ito."" Alexandra Burke, ang Freemasons at Fatboy Slim ay headline ng festival sa parke. Ang kaganapan ay libre hanggang 2010, ngunit ang mga kaganapan sa Pride ay puno ng mga problema sa pera at mga reklamo tungkol sa sobrang dami ng tao at basura. Inilarawan ni Trevor Edwards, ang direktor ng Pride Brighton and Hove, ang kaganapan bilang ""highlight sa kalendaryo ng kultura ng lungsod para sa mga residente ng LGBT, kaibigan at bisita"". Isang lalaki ang dinala sa ospital ""matapos sumayaw sa labas ng bintana"", sabi ng Sussex Police. 'Rebuild bridges' Sinabi ng drag entertainer na si Stephen Richards, na gumaganap bilang Lola Lasagne, na ang Brighton and Hove Pride ngayong taon ay babalik sa mga ugat nito. ""Ang pagmamataas ay isang pagdiriwang ng lahat ng mayroon kami dito,"" sabi niya. Ang festival ay karaniwang gaganapin sa Agosto ngunit naantala sa taong ito upang maiwasan ang isang sagupaan sa London Olympics. ""Ang Pride ay isang mahusay na showcase para sa lungsod at isa sa pinakamalaking kaganapan sa kalendaryo,"" sabi ni Sussex Police Chief Supt Graham Bartlett. ""Ito ay magiging negosyo tulad ng dati sa sentro ng lungsod, bagaman inaasahan namin ang ilang pansamantalang pagkagambala sa trapiko."" Nagbabala ang pulisya na ang sinumang magdaraos ng mga hindi lisensyadong kaganapan, kabilang ang sa dalampasigan, ay maaaring maharap sa pag-uusig.",Libu-libong bisita ang nagtipon sa Brighton and Hove para sa ika-20 Pride festival ng lungsod.
"May, co-presenter ni Clarkson sa BBC motoring show, iminungkahi ang mga nagpadala ng online na pang-aabuso ""gawin ang mundo ng isang mas malaking pabor sa pamamagitan ng pagpapakamatay"". ""Malinaw na hindi ko talaga nais na magpakamatay ang mga tao ngunit, talagang, ayaw namin silang maging mga tagahanga,"" dagdag ni May. Umalis si Perkins sa Twitter nang mas maaga sa linggong ito, kasunod ng mga mapang-abusong tweet. ""Ako ay off Twitter para sa isang bit,"" siya tweeted sa Martes, pag-sign off: ""Pag-ibig at kapayapaan."" Ang nagtatanghal, na nagho-host ng The Great British Bake Off ng BBC One, ay nag-tweet na ang ilan sa mga banta na natanggap niya ay may kasamang isang tao na ""iminungkahi na gusto nilang makita akong masunog hanggang sa mamatay"", habang ang kanyang timeline ""ay puno ng mga lalaki na nagnanais na mamatay ako"". Inilarawan niya ang mungkahi na kinukuha niya ang trabaho sa Top Gear bilang isang ""lubos na gawa-gawa na kuwento"". Si Clarkson ay ibinaba ng BBC noong Marso matapos ang isang ""fracas"" kung saan sinuntok niya ang producer na si Oisin Tymon. Si Perkins ay kabilang sa ilang mga pangalan na pinag-iisipan bilang posibleng kapalit ni Clarkson. Noong nakaraang linggo ay inihayag siya bilang paborito ng mga bookmaker na palitan si Clarkson. Sinabi ng mga bookmaker na si Coral na siya ang nangunguna para sa trabaho, na sinundan ni Dermot O'Leary at pagkatapos ay si Jodie Kidd. Si Perkins ay nangunguna sa ilang iba pang mga palabas sa TV, kabilang ang mga programa sa paglalakbay at ang Edinburgh Festival sa BBC Two at isang Sky Atlantic Game of Thrones live na talakayan spin-off na tinatawag na Thronecast. Si May ay kasalukuyang naghahanda na maglibot sa isang Top Gear spin-off sa paligid ng UK kasama si Clarkson at kapwa co-host na si Richard Hammond. Wala pang karagdagang anunsyo kung siya at si Hammond ay magpapatuloy sa harap ng palabas sa BBC kasunod ng pag-alis ni Clarkson.",Kinondena ng presenter na si James May ang mga nagpadala ng mga banta ng kamatayan kay Sue Perkins dahil sa mga ulat na pinapalitan niya si Jeremy Clarkson sa Top Gear.
