id,sentence1,sentence2,label,sentence1_translated,sentence2_translated
267,He began his career in the Football League with Scunthorpe United before joining Sheffield United in the fourth division in June 1961 .,"He began his career in the Football League with Sheffield United , joining Scunthorpe United of the Fourth Division in June 1961 .",0,Sinimulan niya ang kanyang karera sa Football League kasama ang Scunthorpe United bago sumali sa Sheffield United sa ikaapat na dibisyon noong Hunyo 1961.,"Sinimulan niya ang kanyang karera sa Football League kasama ang Sheffield United, sumali sa Scunthorpe United ng Fourth Division noong Hunyo 1961."
172,"A UK tour started in May 1983 , featuring additional guitarist Robin George for live performances .","In May 1983 , a UK tour with the live guitarist Robin George started for additional performances .",0,"Nagsimula ang isang paglilibot sa UK noong Mayo 1983, tampok ang karagdagang gitaristang si Robin George para sa mga live na pagtatanghal.","Noong Mayo 1983, nagsimula ang isang paglilibot sa UK kasama ang live na gitaristang si Robin George para sa karagdagang mga pagtatanghal."
5291,"In the south end , Cook Pond , also formerly known as South Watuppa Pond , is located east of the Laurel Lake and west of the Taunton River .","Cook Pond , also formerly known as Laurel Lake , is located south east of the Taunton River and west of the South Watuppa Pond .",0,"Sa dulong timog, ang Cook Pond, na dating kilala rin bilang South Watuppa Pond, ay matatagpuan sa silangan ng Lawa ng Laurel at kanluran ng Ilog Taunton.","Ang Cook Pond, dating kilala rin bilang Laurel Lake, ay matatagpuan sa timog-silangan ng Taunton River at kanluran ng South Watuppa Pond."
2677,"The town is situated at the western end of the `` Horta de València '' , on the right bank of the river Turia .","The town is located at the right bank of the `` Horta de València '' , on the western shore of the River Turia .",0,"Ang bayan ay matatagpuan sa kanlurang dulo ng ""Horta de València"", sa kanang pampang ng ilog Turia.","Ang bayan ay matatagpuan sa kanang pampang ng ""Horta de València"", sa kanlurang baybayin ng Ilog Turia."
43531,"Salmons Brook is mentioned thus on Rocque 's map of 1754 , probably named from the family of `` John Salemon '' of Edmonton marked in 1274 .","Thus is mentioned on the map of Rocque of 1754 , probably from the family of John `` Salemon '' of Edmonton in 1274 , marked Salmons Brook .",0,"Ang Salmons Brook ay nabanggit nang ganito sa mapa ni Rocque noong 1754, na malamang ay ipinangalan mula sa pamilya ni ""John Salemon"" ng Edmonton na minarkahan noong 1274.","Kaya nabanggit sa mapa ni Rocque noong 1754, malamang mula sa pamilya ni John ""Salemon"" ng Edmonton noong 1274, na minarkahan bilang Salmons Brook."
33227,His father returned as a finished violinist of the Russian School to Bombay .,His father returned to Bombay as a Russian violinist of the finished school .,0,Bumalik ang kanyang ama sa Bombay bilang isang tapos na biyolinista ng Paaralan ng Russia.,Bumalik ang kanyang ama sa Bombay bilang isang Rusong biyolinista ng natapos na paaralan.
42929,"He was promoted to New Mexico Territory in 1860 , and was ordered to the rank of captain in the 4th Infantry on December 20 .",He was ordered to New Mexico Territory in 1860 and transported to the rank of captain on December 20 in the 4th Infantry .,0,"Siya ay na-promote sa Teritoryo ng New Mexico noong 1860, at inutusan sa ranggong kapitan sa ika-4 na Infantry noong Disyembre 20.",Siya ay inutusan sa Teritoryo ng New Mexico noong 1860 at inilipat sa ranggo ng kapitan noong Disyembre 20 sa ika-4 na Infantry.
32980,"For example , the National Municipal League ( originally the National Civic League ) encourages effective management of local government .","For example , the National Civic League ( originally the National Municipal League ) promotes an effective management of the local government .",0,"Halimbawa, ang National Municipal League (orihinal na National Civic League) ay naghihikayat ng epektibong pamamahala ng lokal na pamahalaan.","Halimbawa, ang National Civic League (na dating tinatawag na National Municipal League) ay nagtataguyod ng epektibong pamamahala ng lokal na pamahalaan."
46978,The response of the dependent formula 5 to a time-observable field formula 10 is,The observable Formula 5 response to a time-dependent field formula 10 is :,0,Ang tugon ng dependent formula 5 sa isang time-observable field formula 10 ay,Ang naoobserbahang tugon ng Formula 5 sa isang time-dependent field formula 10 ay:
5269,"It is centered on a stretch of the main road , roughly between Depot Street and Brook Road .","It is centered on a route of Brook Road , roughly between Depot Street and Main Street .",0,"Ito ay nakasentro sa isang bahagi ng pangunahing kalsada, humigit-kumulang sa pagitan ng Depot Street at Brook Road.","Ito ay nakasentro sa ruta ng Brook Road, humigit-kumulang sa pagitan ng Depot Street at Main Street."
6217,"The Expected Exposure ( EE ) is used similarly to the PFE , except that the average is defined instead of a specific quantile .","The anticipated exposure ( Expected Exposure , EE ) is defined similarly to the PFE , except that the average is used instead of a certain quantile .",0,"Ang Inaasahang Pagkalantad (Expected Exposure o EE) ay ginagamit nang katulad ng PFE, maliban sa ang average ay tinukoy sa halip na isang partikular na quantile.","Ang inaasahang pagkakalantad (Expected Exposure, EE) ay binibigyang kahulugan nang katulad ng PFE, maliban sa ang average ang ginagamit sa halip na isang tiyak na quantile."
23110,"In `` The Guardian '' in 2006 , Stanage argued in contrast to George Monbiot , who had written that the Iraqi insurgency was comparable to the IRA :","In `` The Guardian '' in 2006 , George Monbiot argued in contrast to Stanage , who had written that the Iraqi insurgency is comparable to the IRA .",0,"Sa ""The Guardian"" noong 2006, nakipagtalo si Stanage laban kay George Monbiot, na sumulat na ang paghihimagsik ng Iraq ay maihahambing sa IRA:","Sa ""The Guardian"" noong 2006, nakipagtalo si George Monbiot laban kay Stanage, na sumulat na ang paghihimagsik ng Iraq ay maihahambing sa IRA."
38961,"Born in 1783 in Sheffield , the second son of Isabella and Thomas Beilby , the family went to Birmingham in 1783 .","Born in 1783 in Birmingham , the second son of Isabella and Thomas Beilby . In 1783 the family moved to Sheffield .",0,"Ipinanganak noong 1783 sa Sheffield, ang pangalawang anak nina Isabella at Thomas Beilby, ang pamilya ay nagtungo sa Birmingham noong 1783.","Ipinanganak noong 1783 sa Birmingham, ang pangalawang anak nina Isabella at Thomas Beilby. Noong 1783, lumipat ang pamilya sa Sheffield."
35892,Eckhoff represented Britain against New Zealand in 1928 and Australia in 1930 .,"Eckhoff represented New Zealand against Great Britain in 1928 , against Australia in 1930 .",0,Kinatawan ni Eckhoff ang Britanya laban sa New Zealand noong 1928 at Australia noong 1930.,"Kinatawan ni Eckhoff ang New Zealand laban sa Great Britain noong 1928, at laban sa Australia noong 1930."
49029,Vreeland interpreted this phenomenon to Rowlands in an interview for the book : `` It 's because Avedon lasted '' .,"In an interview for the book , Avedon interpreted this phenomenon for Rowlands : `` It 's because Vreeland lasted .",0,"Ipinaliwanag ni Vreeland ang penomenong ito kay Rowlands sa isang panayam para sa libro: ""Ito ay dahil tumagal si Avedon"".","Sa isang panayam para sa libro, binigyang-kahulugan ni Avedon ang penomenong ito para kay Rowlands: ""Ito ay dahil tumagal si Vreeland."""
47969,said Reid : `` Warren Buffett said all .,"Warren Buffett said , `` Reid said it all '' .",0,sabi ni Reid: `` Sinabi ni Warren Buffett ang lahat.,"Sabi ni Warren Buffett, ""Nasabi na ni Reid ang lahat""."
8407,"Posen is a composer , born in Poland ( Zdzisław Wysocki ) in 1944 .","Zdzisław Wysocki is a composer , born in 1944 in Poznań ( Posen ) Poland .",0,"Si Posen ay isang kompositor, ipinanganak sa Poland (Zdzisław Wysocki) noong 1944.","Si Zdzisław Wysocki ay isang kompositor, ipinanganak noong 1944 sa Poznań (Posen) Poland."
1483,"Finale is a city in South Africa in the province of Mopani District Municipality , Limpopo .",Finale is a town in Mopani District Municipality in the Limpopo province of South Africa .,0,"Ang Finale ay isang lungsod sa Timog Aprika sa lalawigan ng Mopani District Municipality, Limpopo.",Ang Finale ay isang bayan sa Mopani District Municipality sa lalawigan ng Limpopo sa Timog Aprika.
420,Kakuda is in southeastern Japan in the Tōhoku region of northern Miyagi Prefecture .,Kakuda is located in the southeastern prefecture of Miyagi in the Tōhoku region of northern Japan .,0,Ang Kakuda ay nasa timog-silangang Hapon sa rehiyon ng Tōhoku sa hilagang Prepektura ng Miyagi.,Ang Kakuda ay matatagpuan sa timog-silangang prefecture ng Miyagi sa rehiyon ng Tōhoku sa hilagang Japan.
2709,"Meanwhile , the Vichy regime has promoted a highly traditional model of female roles .","Meanwhile , the Vichy regime promoted a highly female model of traditional roles .",0,"Samantala, itinaguyod ng rehimeng Vichy ang isang lubos na tradisyonal na modelo ng mga papel ng kababaihan.","Samantala, itinaguyod ng rehimeng Vichy ang isang modelo ng mga tradisyonal na tungkulin na lubos na pinahahalagahan ng kababaihan."
2693,The area was once served by Edinburgh Waverley railway station which provided direct railway access to Corstorphine .,"The area was once served by Corstorphine railway station , which provided direct access to the railway to Edinburgh Waverley .",0,Ang lugar ay dating pinaglilingkuran ng istasyon ng tren ng Edinburgh Waverley na nagbigay ng direktang daanan ng tren papuntang Corstorphine.,"Ang lugar ay dating pinaglilingkuran ng istasyon ng tren ng Corstorphine, na nagbigay ng direktang daanan papuntang Edinburgh Waverley."
10297,"It was obtained from parts of Assiniboia , Humboldt - Lake Centre and Moose Jaw Ridings in 1987 .","It was re-created in 1987 from parts of Lake Centre , Humboldt -- Assiniboia and Moose Jaw ridings .",0,"Nakuha ito mula sa mga bahagi ng Assiniboia, Humboldt-Lake Centre at Moose Jaw Ridings noong 1987.","Ito ay muling nilikha noong 1987 mula sa mga bahagi ng Lake Centre, Humboldt -- Assiniboia at mga pastulan ng Moose Jaw."
25391,In September 2014 Peter Sculthorpe published the album `` Tamara Anna Cislowska -- Complete works for solo - piano '' .,In September 2014 Tamara Anna Cislowska published the album `` Peter Sculthorpe -- Complete works for solo - piano '' .,0,"Noong Setyembre 2014, inilathala ni Peter Sculthorpe ang album na ""Tamara Anna Cislowska -- Complete works for solo-piano"".","Noong Setyembre 2014, inilathala ni Tamara Anna Cislowska ang album na ""Peter Sculthorpe -- Complete works for solo-piano""."
7514,"The chief editor is Herbert Wessels ( since 2009 ) , second editor is Markus Ermert ( since 2002 ) .","The second editor is Herbert Wessels ( since 2009 ) , editor in chief is Markus Ermert ( since 2002 ) .",0,"Ang punong patnugot ay si Herbert Wessels (mula noong 2009), ang pangalawang patnugot ay si Markus Ermert (mula noong 2002).","Ang pangalawang editor ay si Herbert Wessels (mula noong 2009), ang punong editor ay si Markus Ermert (mula noong 2002)."
40349,"After the War the College returned to Hellenikon , where it remained until it moved to its new campus in Athens , a suburb of Aghia Paraskevi .","After the war , the college returned to Hellenikon , where it remained until it moved to the new campus in Aghia Paraskevi , a suburb of Athens .",0,"Pagkatapos ng Digmaan, bumalik ang Kolehiyo sa Hellenikon, kung saan ito nanatili hanggang sa lumipat ito sa bagong kampus nito sa Athens, isang suburb ng Aghia Paraskevi.","Pagkatapos ng digmaan, ang kolehiyo ay bumalik sa Hellenikon, kung saan ito nanatili hanggang sa lumipat ito sa bagong kampus sa Aghia Paraskevi, isang suburb ng Athens."
39051,"The Hunters film is a French crime - horror - thriller - film from 2011 by Chris Briant , produced by Antoine Huet ,","The film The Hunters is a French crime - horror - thriller - film from 2011 by Antoine Huet , produced by Chris Briant .",0,"Ang pelikulang The Hunters ay isang pelikulang Pranses tungkol sa krimen, katatakutan, at thriller mula 2011 ni Chris Briant, at prinodyus ni Antoine Huet.","Ang pelikulang The Hunters ay isang Pranses na pelikulang krimen-katatakutan-thriller mula 2011 ni Antoine Huet, at prinodyus ni Chris Briant."
29586,Year 6 inferior Venus - Sets on Arahsamnu 28 and after 3 days rises on Kislimu 1 1 .,Year 6 inferior Venus rises on Arahsamnu 28 and after 3 days sets on Kislimu 1 .,0,Taon 6 na inferior Venus - Lulubog sa Arahsamnu 28 at pagkatapos ng 3 araw ay sisikat sa Kislimu 1 1 .,Ang inferior Venus sa ika-6 na taon ay sisikat sa Arahsamnu 28 at pagkatapos ng 3 araw ay lulubog sa Kislimu 1.
27933,"Born in Athens , Greece , he grew up in New York City and then in North Grafton , Massachusetts .","He was born in New York City , and grew up in Athens , Greece , and then North Grafton , Massachusetts .",0,"Ipinanganak sa Athens, Greece, lumaki siya sa New York City at pagkatapos ay sa North Grafton, Massachusetts.","Siya ay ipinanganak sa Lungsod ng New York, at lumaki sa Athens, Gresya, at pagkatapos ay sa North Grafton, Massachusetts."
43607,"In his own autobiography `` Long Walk to Freedom '' , Nelson Mandela mentions James Gregory in two cases : the first one during his imprisonment in Pollsmoor :","In his own autobiography , `` Long Walk to Freedom '' , James Gregory mentions Nelson Mandela in two occasions . The first was during his imprisonment in Pollsmoor :",0,"Sa sarili niyang autobiography na ""Long Walk to Freedom"", binanggit ni Nelson Mandela si James Gregory sa dalawang kaso: ang una noong siya ay nakakulong sa Pollsmoor:","Sa kaniyang sariling autobiography, ang ""Long Walk to Freedom"", binanggit ni James Gregory si Nelson Mandela sa dalawang pagkakataon. Ang una ay noong siya ay nakakulong sa Pollsmoor:"
4615,"When Edward II , on July 7 , 1307 , succeeded his father , Edward I , the attitude of his subjects was generally one of goodwill towards her new king .","When Edward I succeeded his father Edward II on 7 July 1307 , the attitude of his subjects was generally one of goodwill toward their new king .",0,"Nang si Edward II, noong Hulyo 7, 1307, ay humalili sa kanyang amang si Edward I, ang saloobin ng kanyang mga nasasakupan ay karaniwang isa sa mabuting kalooban para sa bagong hari nito.","Nang humalili si Edward I sa kanyang amang si Edward II noong Hulyo 7, 1307, ang saloobin ng kanyang mga nasasakupan ay karaniwang isa ng mabuting kalooban patungo sa kanilang bagong hari."
7692,Falconbridge Ltd. was taken over by Swiss mining company Xstrata in 2006 .,"In 2006 , Xstrata was taken over by the Swiss mining company Falconbridge Ltd..",0,Ang Falconbridge Ltd. ay kinuha ng kompanya ng pagmiminang Swiss na Xstrata noong 2006.,"Noong 2006, ang Xstrata ay kinuha ng kompanya ng pagmiminang Swiss na Falconbridge Ltd.."
175,"To create the map for Hoth , the designers received as much source material as possible from `` The Empire beats back '' to develop an authentic reproduction .","To develop the map for Hoth , the designers obtained as much source material from `` The Empire Strikes Back '' as possible so to create an authentic reproduction .",0,"Upang malikha ang mapa para sa Hoth, ang mga taga-disenyo ay nakatanggap ng pinakamaraming mapagkukunan ng materyal hangga't maaari mula sa ""The Empire beats back"" upang makabuo ng isang tunay na reproduksyon.","Upang mabuo ang mapa para sa Hoth, kumuha ang mga taga-disenyo ng pinakamaraming mapagkukunan ng materyal hangga't maaari mula sa ""The Empire Strikes Back"" upang makalikha ng isang tunay na reproduksyon."
48947,The results of a clinical trial in people with untreatable metastases from various solid tumors were published in `` Science '' in 2017 .,Results of a clinical trial in people with various solid metastases arising from untreatable tumors were published in `` Science '' in 2017 .,0,"Ang mga resulta ng isang klinikal na pagsubok sa mga taong may hindi magagamot na metastases mula sa iba't ibang solidong tumor ay inilathala sa ""Science"" noong 2017.","Ang mga resulta ng isang klinikal na pagsubok sa mga taong may iba't ibang solidong metastases na nagmumula sa mga tumor na hindi na magagamot ay inilathala sa ""Science"" noong 2017."
3211,This time the vocals were mastered by Matti Auerkallio and the EP by Pirkka Rännäli was performed .,This time the vocals were presented by Matti Auerkallio and the EP by Pirkka Rännäli was mastered .,0,Sa pagkakataong ito ang mga vocal ay pinagkadalubhasaan ni Matti Auerkallio at ang EP ay ginanap ni Pirkka Rannäli,Ang EP ay na-master ni Matti Auerkallio at ang EP ay na-master ni Pirkka Rannäli.
30839,Scott and Short then traveled overland to the Kentucky River to investigate the land they would later claim .,Then Scott and Short traveled overland to the Kentucky River to claim the land that they would investigate later .,0,Pagkatapos ay naglakbay sina Scott at Short patungong Kentucky River sa pamamagitan ng kalupaan upang siyasatin ang lupang kanilang aangkinin kalaunan.,"Pagkatapos, naglakbay sina Scott at Short sa lupa patungong Ilog Kentucky upang angkinin ang lupang kanilang susuriin mamaya."
14383,One night Rick contacts Maddy and informs her about Jill 's sudden death .,"One night , Rick contacts Jill and informs her about Maddy 's sudden death .",0,"Isang gabi, kinontak ni Rick si Maddy at ipinaalam dito ang biglaang pagkamatay ni Jill.","Isang gabi, kinontak ni Rick si Jill at ipinaalam dito ang biglaang pagkamatay ni Maddy."
37201,"In 1516 , the Mundy family owned the manor house of Allestree until Francis Noel Clarke Mundy sold it to Thomas Evans in 1781 .","In 1516 , the Mundy family owned the manor house of Allestree until Thomas Evans sold it to Francis Noel Clarke Mundy in 1781 .",0,"Noong 1516, pagmamay-ari ng pamilyang Mundy ang manor house ng Allestree hanggang sa ibenta ito ni Francis Noel Clarke Mundy kay Thomas Evans noong 1781.","Noong 1516, pagmamay-ari ng pamilyang Mundy ang manor house ng Allestree hanggang sa ibenta ito ni Thomas Evans kay Francis Noel Clarke Mundy noong 1781."
22925,"In March 1977 , Hannah retired and died the following year .",Hannah died in March 1977 and went retired the following year .,0,"Noong Marso 1977, nagretiro si Hannah at namatay nang sumunod na taon.",Namatay si Hannah noong Marso 1977 at nagretiro nang sumunod na taon.
3927,"Helena Suková won 7 -- 6 , 7 -- 6 against Brenda Schultz in the final .","Brenda Schultz won 7 -- 6 , 7 -- 6 against Helena Suková in the final .",0,"Nanalo si Helena Suková ng 7-6, 7-6 laban kay Brenda Schultz sa finals.","Nanalo si Brenda Schultz ng 7-6, 7-6 laban kay Helena Suková sa finals."
9609,Only the Sara of the south was governed effectively ; French presence in the Islamic north and east was nominal .,"Only the sara of the south was governed effectively , the nominal presence in the French north and east was Islamic .",0,Tanging ang mga Sara ng timog ang epektibong pinamahalaan; ang presensya ng mga Pranses sa Islamikong hilaga at silangan ay nominal lamang.,"Tanging ang sara ng timog ang epektibong pinamahalaan, ang nominal na presensya sa hilaga at silangang Pranses ay Islamiko."
26897,"On 20 November 1852 , he married Frederik Due . He was the brother-in-law of Maria Soane .","On November 20 , 1852 , he married Frederik Due , he was the brother of Maria Soane .",0,"Noong ika-20 ng Nobyembre 1852, pinakasalan niya si Frederik Due. Siya ang bayaw ni Maria Soane.","Noong Nobyembre 20, 1852, pinakasalan niya si Frederik Due, kapatid siya ni Maria Soane."
29279,"Babbar Khalsa is listed as a terrorist organisation by the United States , the EU , Canada , India , and the United Kingdom .","Babbar Khalsa is performed by the United States , the EU , Canada , India and the United Kingdom as a terrorist organisation .",0,"Ang Babbar Khalsa ay nakalista bilang isang organisasyong terorista ng Estados Unidos, EU, Canada, India, at United Kingdom.","Ang Babbar Khalsa ay itinatanghal ng Estados Unidos, EU, Canada, India at United Kingdom bilang isang organisasyong terorista."
3730,The Quechua variety spoken in Arequipa is Cusco -- Collao Quechua .,"Quechua 's variety , spoken in Cusco , is Arequipa -- Collao Quechua .",0,Ang Quechua variety na sinasalita sa Arequipa ay Cusco -- Collao Quechua,"Maraming iba't ibang uri ng Quechua, na sinasalita sa Cusco"
9923,Seleucus was a wealthy Christian Roman Senator of Greek descent who lived in the first half of the 4th century and second half of the 5th century .,"Seleucus was a wealthy Christian Roman senator of Greek descent , who lived in the second half of the 4th century and the first half of the 5th century .",0,Si Seleucus ay isang mayamang Kristiyanong Romanong Senador na may lahing Griyego na nabuhay noong unang kalahati ng ika-4 na siglo at ikalawang kalahati ng ika-5 siglo.,"Si Seleucus ay isang mayamang Kristiyanong Romanong senador na may lahing Griyego, na nabuhay noong ikalawang kalahati ng ika-4 na siglo at unang kalahati ng ika-5 siglo."
39412,"He was born in Bukan , Iran , but came to Kristiansand in 1997 , Norway .","He was born in Kristiansand , Norway , but arrived in 1997 to Bukan , Iran .",0,"Siya ay ipinanganak sa Bukan, Iran, ngunit dumating sa Kristiansand noong 1997, Norway.","Siya ay ipinanganak sa Kristiansand, Norway, ngunit dumating noong 1997 sa Bukan, Iran."
37478,She was the first professional female painter and the first feminist writer in Korea .,She was the first feminist painter and the first female professional writer in Korea .,0,Siya ang unang propesyonal na babaeng pintor at ang unang peministang manunulat sa Korea.,Siya ang unang peministang pintor at ang unang babaeng propesyonal na manunulat sa Korea.
45891,"The town typically has mild winters , cold and snowy summers .","The town has typically cold , snowy winters and mild summers .",0,"Ang bayan ay karaniwang may banayad na taglamig, malamig at maniyebeng tag-araw.","Ang bayan ay karaniwang may malamig, maniyebeng taglamig at banayad na tag-araw."
3897,Probably the best-known version of the song was produced by Dick Rowe and recorded in the UK by The Stargazers in 1953 .,The best-known version of the song was recorded by Dick Rowe and produced in 1953 in England by The Stargazers .,0,Marahil ang pinakakilalang bersyon ng kanta ay prinodyus ni Dick Rowe at nairekord sa UK ng The Stargazers noong 1953.,Ang pinakakilalang bersyon ng kanta ay naitala ni Dick Rowe at prinodyus noong 1953 sa Inglatera ng The Stargazers.
48198,"Due to the results in the last round , Gianni Morbidelli received + 30 kg , Andrea Belicchi + 20 kg and Jordi Gené + 10 kg .","Due to the results obtained in the previous round , Gianni Morbidelli received + 30 kg , Jordi Gené + 20 kg and Andrea Belicchi + 10 kg .",0,"Dahil sa mga resulta sa huling round, nakatanggap si Gianni Morbidelli ng + 30 kg, Andrea Belicchi ng + 20 kg at Jordi Gené ng + 10 kg.","Dahil sa mga resultang nakuha sa nakaraang round, si Gianni Morbidelli ay nakatanggap ng + 30 kg, Jordi Gené + 20 kg at Andrea Belicchi + 10 kg."
17264,`` Son of Coma Guy '' is the third episode of the seventh season of `` House '' and the fifty-third episode in total .,`` Son of Coma Guy '' is the seventh episode of the third season of `` House '' and the fifty-third episode overall .,0,"Ang ""Son of Coma Guy"" ay ang ikatlong episode ng ikapitong season ng ""House"" at ang ika-limampu't tatlong episode sa kabuuan.","Ang ""Son of Coma Guy"" ay ang ikapitong episode ng ikatlong season ng ""House"" at ang ika-limampu't tatlong episode sa kabuuan."
14680,"He followed in 1995 -- 2003 Jenny McGhee Edwards , from 2003 -- 2007 Larry Kearney and from 2007 -- 2015 Elic Senter .",He was followed by Larry Kearney from 1995 -- 2003 by Jenny McGhee Edwards in 2003 -- 2007 and by Elic Senter from 2007 -- 2015 .,0,"Sinundan niya noong 1995 -- 2003 si Jenny McGhee Edwards, mula 2003 -- 2007 si Larry Kearney at mula 2007 -- 2015 si Elic Senter.",Sinundan siya ni Larry Kearney mula 1995 -- 2003 ni Jenny McGhee Edwards noong 2003 -- 2007 at ni Elic Senter mula 2007 -- 2015.
18364,The politician and entrepreneur Kuno Pajula ( 1885 -- 1942 ) and former Archbishop Juhan Kukk ( 1924 -- 2012 ) were born in Käru .,Politician and entrepreneur Juhan Kukk ( 1885 - 1942 ) and former Archbishop Kuno Pajula ( 1924 -- 2012 ) were born in Käru .,0,Ang politiko at negosyante na si Kuno Pajula (1885 - 1942) at dating Arsobispo Juhan Kukk (1924 - 2012) ay isinilang sa Käru.,Ang politiko at negosyante na si Juhan Kukk (1885-1942) at dating Arsobispo Kuno Pajula (1924-2012) ay isinilang sa Käru.
30066,"However , the Georgian language is the singular form when the quantity is specified , so , in practice the plural of `` tetri '' uses just `` tetri '' .","The Georgian language , however , uses the singular form when the number is specified , so in practice the plural of `` tetri '' is only `` tetri '' .",0,"Gayunpaman, ang wikang Georgian ay ang anyong isahan kapag tinukoy ang dami, kaya, sa pagsasagawa, ang pangmaramihan ng ""tetri"" ay gumagamit lamang ng ""tetri"".","Gayunpaman, ang wikang Georgian ay gumagamit ng anyong isahan kapag tinukoy ang bilang, kaya sa pagsasagawa ang pangmaramihan ng ""tetri"" ay ""tetri"" lamang."
13006,"When synthetic pins are hit by the ball , they usually sound different from wooden pins .","When hit by the ball , wooden pins usually sound different from synthetic pins .",0,"Kapag tinamaan ng bola ang mga sintetikong pin, kadalasan ay iba ang tunog ng mga ito kumpara sa mga kahoy na pin.","Kapag tinamaan ng bola, karaniwang iba ang tunog ng mga pin na gawa sa kahoy kumpara sa mga sintetikong pin."
