id,sentence1,sentence2,label,sentence1_translated,sentence2_translated
44365,"Panthro is renamed `` Pantro '' in the Spanish version , `` Pantor '' in the German version , and `` Pantéro '' in the French version .","Panthro is renamed in the Spanish version in `` Pantro '' , in the English version `` Pantor '' and in the French version `` Pantéro '' .",0,"Ang Panthro ay pinalitan ng pangalan na ""Pantro"" sa bersiyong Espanyol, ""Pantor"" sa bersiyong Aleman, at ""Pantéro"" sa bersiyong Pranses.","Ang Panthro ay pinalitan ng pangalan sa bersiyong Espanyol sa `` Pantro '', sa bersiyong Ingles ay `` Pantor '' at sa bersiyong Pranses ay `` Pantéro ''."
36705,Different reactions take place on the surface of a catalyst of a heterogeneous phase .,Reactions that take place on the surface of a catalyst of a different phase are also heterogeneous .,0,Iba't ibang reaksyon ang nagaganap sa ibabaw ng isang katalista ng isang heterogenous na yugto.,Ang mga reaksyong nagaganap sa ibabaw ng isang katalista na may ibang yugto ay magkakaiba rin.
7474,"It is situated 3 km northwest of the river Alfeios , 8 km southwest of Dimitsana , 10 km northeast of Andritsaina and 12 km northeast of Karytaina .","It is 3 km northeast of the river Alfeios , 8 km southwest of Dimitsana , 10 km northeast of Andritsaina and 12 km northwest of Karytaina .",0,"Ito ay matatagpuan 3 km hilagang-kanluran ng ilog Alfeios, 8 km timog-kanluran ng Dimitsana, 10 km hilagang-silangan ng Andritsaina at 12 km hilagang-silangan ng Karytaina.","Ito ay 3 km hilagang-silangan ng ilog Alfeios, 8 km timog-kanluran ng Dimitsana, 10 km hilagang-silangan ng Andritsaina at 12 km hilagang-kanluran ng Karytaina."
43424,The episode was written by Bill Wrubel and was directed by Lev L. Spiro .,The episode was written by Lev L. Spiro and directed by Bill Wrubel .,0,Ang episode ay isinulat ni Bill Wrubel at idinirek ni Lev L. Spiro.,Ang episode ay isinulat ni Lev L. Spiro at idinirek ni Bill Wrubel.
48531,"The team 's statistical leaders included Kyle Boller , with 1,741 passing yards , Charon Arnold with 688 Rushing Yards , and Terrell Williams with 606 reception - Yards .","The team 's statistical leaders included Kyle Boller with 1,741 passing yards , Terrell Williams with 688 rushing yards , and Charon Arnold with 606 receiving yards .",0,"Kabilang sa mga nangunguna sa istatistika ng koponan sina Kyle Boller, na may 1,741 passing yards, Charon Arnold na may 688 Rushing Yards, at Terrell Williams na may 606 reception-yards.","Kabilang sa mga nangungunang istatistikal ng koponan sina Kyle Boller na may 1,741 passing yards, Terrell Williams na may 688 rushing yards, at Charon Arnold na may 606 receiving yards."
14251,"Helmut Groß was the mayor of Tengen from 1973 to 2015 , and his successor was Marian Schreier .","From 1973 to 2015 , Marian Schreier was Mayor of Tengen , his successor is Helmut Groß .",0,"Si Helmut Groß ay ang alkalde ng Tengen mula 1973 hanggang 2015, at ang kanyang kahalili ay si Marian Schreier.","Mula 1973 hanggang 2015, si Marian Schreier ay Alkalde ng Tengen, ang kanyang kahalili ay si Helmut Groß."
23854,Nora Navarro was born as the second of six children of the physician Winifredo Santos and María Rosario Santos y Navarro .,"María Rosario Santos y Navarro was born the second of six children of Winifredo Santos , a physician , and Nora Navarro .",0,Si Nora Navarro ay isinilang bilang pangalawa sa anim na anak ng manggagamot na si Winifredo Santos at María Rosario Santos y Navarro.,"Si María Rosario Santos y Navarro ay isinilang na pangalawa sa anim na anak nina Winifredo Santos, isang manggagamot, at Nora Navarro."
10463,"On August 20 , 2012 , the video hosting service was automatically shut down and the remaining Google Video content was ultimately moved to YouTube .","On August 20 , 2012 , the video hosting service was finished and the remaining Google Video content was automatically moved to YouTube .",0,"Noong Agosto 20, 2012, awtomatikong isinara ang serbisyo ng pagho-host ng video at ang natitirang nilalaman ng Google Video ay tuluyang inilipat sa YouTube.","Noong Agosto 20, 2012, natapos ang serbisyo ng pagho-host ng video at ang natitirang nilalaman ng Google Video ay awtomatikong inilipat sa YouTube."
3244,They typically consist of small units -- each with two large heavy chains and two basic structural light chains .,They are typically made of basic structural units -- each with two large heavy chains and two small light chains .,0,Karaniwan silang binubuo ng maliliit na yunit -- bawat isa ay may dalawang malalaki at mabibigat na kadena at dalawang pangunahing istruktural na magaan na kadena.,Karaniwang gawa ang mga ito sa mga pangunahing yunit ng istruktura -- bawat isa ay may dalawang malalaki at mabibigat na kadena at dalawang maliliit na magaan na kadena.
39939,"He has introduced a new form of Expressionism , based on Persian motives and its Oriental moods .",He has introduced a new form of expressionism based on oriental motives and its Persian moods .,0,"Nagpakilala siya ng isang bagong anyo ng Ekspresyonismo, batay sa mga motibong Persiano at mga mood nito sa Silangan.",Nagpakilala siya ng isang bagong anyo ng ekspresyonismo batay sa mga motibong oriental at mga mood nito na Persian.
23338,"Eoacmaea chamorrorum is a species of sea snail , a true limpet , a marine gastropod mollusk in the Eoacmaeidae family , one of the families of the true limpets .","Eoacmaea chamorrorum is a species of sea snail , a true limpet , a true gastropod mollusk in the Eoacmaeidae family , one of the families of the Marine limpets .",0,"Ang Eoacmaea chamorrorum ay isang uri ng kuhol sa dagat, isang tunay na limpet, isang marine gastropod mollusk sa pamilyang Eoacmaeidae, isa sa mga pamilya ng mga tunay na limpet.","Ang Eoacmaea chamorrorum ay isang uri ng kuhol sa dagat, isang tunay na limpet, isang tunay na gastropod mollusk sa pamilyang Eoacmaeidae, isa sa mga pamilya ng Marine limpets."
1892,Vivek Ranadive brought together a group led by Kevin Johnson to hold the team in Sacramento .,Kevin Johnson brought together a group led by Vivek Ranadive to retain the team in Sacramento .,0,Tinipon ni Vivek Ranadive ang isang grupo na pinamumunuan ni Kevin Johnson upang idaos ang koponan sa Sacramento.,Tinipon ni Kevin Johnson ang isang grupo na pinamumunuan ni Vivek Ranadive upang mapanatili ang koponan sa Sacramento.
1270,Dotty was born in 1923 in Gloucester and died in Boston in 2014 .,Dotty was born in Boston in 1923 and died in Gloucester in 2014 .,0,Si Dotty ay ipinanganak noong 1923 sa Gloucester at namatay sa Boston noong 2014.,Si Dotty ay ipinanganak sa Boston noong 1923 at namatay sa Gloucester noong 2014.
7497,Exact numbers up to The cold growth rate of cold numbers remains unknown .,Cold numbers up to The exact growth rate of the cold numbers remains unknown .,0,Ang eksaktong mga numero hanggang sa Ang bilis ng paglaki ng mga numero ng lamig ay nananatiling hindi alam.,Mga malamig na numero hanggang sa Ang eksaktong antas ng paglago ng mga malamig na numero ay nananatiling hindi alam.
1660,The JieT is a tributary of the River Mija Mică in Romania .,The Mija Mică River is a tributary of the River Jieţ in Romania .,0,Ang JieT ay isang sanga ng Ilog Mija Mică sa Romania.,Ang Ilog Mija Mică ay isang sanga ng Ilog Jieţ sa Romania.
39781,"Major competitors of Tata Steel include ArcelorMittal , Essar Steel , Jindal Steel and Power , JSW Steel , SAIL and VISA Steel .","Major competitors of VISA Steel include ArcelorMittal , Essar Steel , Jindal Steel and Power , Tata Steel , SAIL and JSW Steel .",0,"Kabilang sa mga pangunahing kakumpitensya ng Tata Steel ang ArcelorMittal, Essar Steel, Jindal Steel and Power, JSW Steel, SAIL at VISA Steel.","Kabilang sa mga pangunahing kakumpitensya ng VISA Steel ang ArcelorMittal, Essar Steel, Jindal Steel and Power, Tata Steel, SAIL at JSW Steel."
4428,"Born Chloe Wang in Chicago , Illinois , Chloe Bennet is the daughter of Bennet Wang , an investment banker , and Stephanie Crane , an internist .","Chloe Wang was born in Chicago , Illinois , Chloe Bennet , the daughter of Bennet Wang , an investment banker , and Stephanie Crane , an internal .",0,"Ipinanganak bilang Chloe Wang sa Chicago, Illinois, si Chloe Bennet ay anak nina Bennet Wang, isang investment banker, at Stephanie Crane, isang internist.","Si Chloe Wang ay ipinanganak sa Chicago, Illinois, sina Chloe Bennet, anak nina Bennet Wang, isang investment banker, at Stephanie Crane, isang internal manager."
14914,"Pennypacker , born in Pennsylvania , moved shortly after the turn of the twentieth century to New York City before moving to Southampton , New York , on Long Island .","Pennypacker , born in Southampton , New York , moved shortly after the turn of the twentieth century to Pennsylvania before moving to New York City on Long Island .",0,"Si Pennypacker, na ipinanganak sa Pennsylvania, ay lumipat ilang sandali pagkatapos ng pagpasok ng ikadalawampung siglo sa New York City bago lumipat sa Southampton, New York, sa Long Island.","Si Pennypacker, na ipinanganak sa Southampton, New York, ay lumipat ilang sandali pagkatapos ng pagpasok ng ikadalawampung siglo sa Pennsylvania bago lumipat sa New York City sa Long Island."
31392,"Lusaghbyur ( formerly known as Lusakhpyur , also romanized Agbulakh and Agbulag ) is a city in the Lori province of Armenia .","Lusaghbyur ( also romanized as Lusakhpyur ; formerly , Agbulakh and Agbulag ) is a town in the Lori Province of Armenia .",0,"Ang Lusaghbyur (dating kilala bilang Lusakhpyur, na romanisado ring Agbulakh at Agbulag) ay isang lungsod sa lalawigan ng Lori ng Armenia.","Ang Lusaghbyur (na-romanize din bilang Lusakhpyur; dating, Agbulakh at Agbulag) ay isang bayan sa Lalawigan ng Lori ng Armenia."
1575,It was reported in June that Burke had signed a record deal with Syco and the album is handled jointly by RCA Records and RCA Records .,It was reported in June that Burke has signed a record contract with RCA Records and the album will be handled jointly by Syco and RCA Records .,0,Naiulat noong Hunyo na pumirma si Burke ng kontrata sa pagrerekord sa Syco at ang album ay magkasamang pinangangasiwaan ng RCA Records at RCA Records.,Naiulat noong Hunyo na pumirma si Burke ng kontrata sa pagrerekord sa RCA Records at ang album ay magkasamang hahawakan ng Syco at RCA Records.
6471,A third radio version was broadcast by the BBC in May 2008 with Wilton again as Duff and the author playing Beth .,A third radio version was played by the BBC with Wilton as Beth and the author Duff in May 2008 .,0,"Isang ikatlong bersyon sa radyo ang ipinalabas ng BBC noong Mayo 2008, kung saan muling ipinalabas si Wilton bilang si Duff at ang awtor naman ang gumanap bilang si Beth.",Isang ikatlong bersiyon sa radyo ang ipinalabas ng BBC kasama si Wilton bilang si Beth at ang awtor na si Duff noong Mayo 2008.
34771,"In 1406 he had the Juliana Anicia Codex of Dioscurides restored , rebound , and a table of contents and extensive scholia added in Byzantine Greek minuscule .","In 1406 he had added the Juliana Anicia Codex of Dioscurides , rebound and a table of contents and minuscule scholia in Byzantine Greek comprehensively restored .",0,"Noong 1406, ipinanumbalik niya ang Juliana Anicia Codex ni Dioscurides, muling pinagbuti, at idinagdag ang talaan ng mga nilalaman at malawak na iskolarship sa maliit na bahagi ng Griyegong Byzantine.","Noong 1406, idinagdag niya ang Juliana Anicia Codex ni Dioscurides, isang rebound at isang talaan ng mga nilalaman, at ang minuscule scholia sa Byzantine Greek ay komprehensibong naibalik."
22638,"He was the father of historian Peyton C. March and General Francis Andrew March , the chief of staff of the United States Army during World War I .","He was the father of historian Francis Andrew March and General Peyton C. March , the chief of staff of the United States Army during World War I .",0,"Siya ang ama ng historyador na si Peyton C. March at ni Heneral Francis Andrew March, ang pinuno ng kawani ng Hukbong Sandatahan ng Estados Unidos noong Unang Digmaang Pandaigdig.","Siya ang ama ng historyador na si Francis Andrew March at ni Heneral Peyton C. March, ang pinuno ng kawani ng Hukbong Sandatahan ng Estados Unidos noong Unang Digmaang Pandaigdig."
23352,The music of Kalia is penned by Wajahat Attre with lyrics composed by Waris Ludhianvi and Khawaja Pervez and singers are Noor Jehan and Naheed Akhtar .,The music from Kalia is composed by Wajahat Attre with texts by Waris Ludhianvi and Khawaja Pervez and singers are Noor Jehan and Naheed Akhtar .,0,"Ang musika ng Kalia ay isinulat ni Wajahat Attre, ang mga liriko ay nilikha nina Waris Ludhianvi at Khawaja Pervez, at ang mga mang-aawit ay sina Noor Jehan at Naheed Akhtar.","Ang musika mula sa Kalia ay nilikha ni Wajahat Attre, ang mga teksto ay isinulat nina Waris Ludhianvi at Khawaja Pervez, at ang mga mang-aawit ay sina Noor Jehan at Naheed Akhtar."
23687,"Võhma is a village in Lääneranna Parish , Pärnu County , in western Estonia .","Võhma is a village in the Lääneranna parish , Estonia , in western Pärnu County .",0,"Ang Võhma ay isang nayon sa Lääneranna Parish, Pärnu County, sa kanlurang Estonia.","Ang Võhma ay isang nayon sa parokya ng Lääneranna, Estonia, sa kanlurang Pärnu County."
26167,"Incumbent Democrat Chuck Robb ran for a third term , but lost to Republican George Allen .","The established Republican George Allen ran for a third term , but lost to Democrat Chuck Robb .",0,"Tumakbo para sa ikatlong termino ang kasalukuyang Demokratang si Chuck Robb, ngunit natalo kay Republikanong George Allen.","Ang itinatag na Republikanong si George Allen ay tumakbo para sa ikatlong termino, ngunit natalo kay Demokratang Chuck Robb."
27176,Seon is a municipality in the district of Lenzburg in the canton of Aargau in Switzerland .,"Seon is a municipality in the Aargau district of the canton of Lenzburg , Switzerland .",0,Ang Seon ay isang munisipalidad sa distrito ng Lenzburg sa kanton ng Aargau sa Switzerland.,"Ang Seon ay isang munisipalidad sa distrito ng Aargau sa kanton ng Lenzburg, Switzerland."
32026,He was displaced soon after by Colin Hudson and later Johnny Watkins on the Cardiff side .,"However , he was driven out in the Cardiff side , soon after by Johnny Watkins and later Colin Hudson .",0,Di-nagtagal ay pinalayas siya ni Colin Hudson at kalaunan ni Johnny Watkins sa panig ng Cardiff.,"Gayunpaman, napatalsik siya sa panig ng Cardiff, di-nagtagal pagkatapos nina Johnny Watkins at kalaunan ni Colin Hudson."
29137,"The canonical choice for ( `` m '' , `` n '' ) is chosen so that `` n '' is positive and that is .","The positive choice for ( ( `` m '' , `` n '' ) ) is chosen so that `` n '' is canonical and , i.e .",0,"Ang kanonikal na pagpipilian para sa (`` m '' , `` n '' ) ay pinili upang ang `` n '' ay positibo at iyon ay .","Ang positibong pagpili para sa ((``m'',``n'')) ay pinili upang ang ``n'' ay kanonikal at , i.e."
21762,"Its current chairman is Henry Butler , and its district manager is Richard Flateau .","Its current chairman is Richard Flateau , and its district manager is Henry Butler .",0,"Ang kasalukuyang tagapangulo nito ay si Henry Butler, at ang tagapamahala ng distrito nito ay si Richard Flateau.","Ang kasalukuyang tagapangulo nito ay si Richard Flateau, at ang tagapamahala ng distrito nito ay si Henry Butler."
151,For a few years Daniel went to the same school as Björn Dixgård ; at the age of fifteen he founded a band called Butler together with Björn .,For a few years Björn went to the same school with Daniel and founded a band called Butler with Björn Dixgård at the age of fifteen .,0,"Sa loob ng ilang taon, nag-aral si Daniel sa parehong paaralan kasama si Björn Dixgård; sa edad na labinlima, itinatag niya ang isang banda na tinatawag na Butler kasama si Björn.","Sa loob ng ilang taon, nag-aral si Björn sa iisang paaralan kasama si Daniel at nagtatag ng isang banda na tinatawag na Butler kasama si Björn Dixgård sa edad na labinlima."
20899,"Ogle County , Illinois is located in Mount Morris Township .","Mount Morris Township is located in the Ogle County , Illinois .",0,"Ang Ogle County, Illinois ay matatagpuan sa Mount Morris Township.","Ang Mount Morris Township ay matatagpuan sa Ogle County, Illinois."
7635,"Evariste Baizeau ( June 3 , 1821 - Nantes , February 6 , 1910 ) was a French military physician .","Anacharsis Evariste Baizeau ( 3 June 1821 , Nantes -- 6 February 1910 , Paris ) was a French military physician .",0,"Si Evariste Baizeau (Hunyo 3, 1821 - Nantes, Pebrero 6, 1910) ay isang Pranses na manggagamot sa militar.","Si Anacharsis Evariste Baizeau (3 Hunyo 1821, Nantes -- 6 Pebrero 1910, Paris) ay isang Pranses na manggagamot sa militar."
2255,It then crosses over the Washita River arm of Lake Texoma .,It crosses then the Lake Texoma arm of the Washita River .,0,Pagkatapos ay tumatawid ito sa sangay ng Ilog Washita ng Lawa ng Texoma.,Tumatawid ito sa sangay ng Lawa ng Texoma ng Ilog Washita.
33811,Lytton was Emma Watson 's double in the film `` Harry Potter and the Chamber of Secrets '' .,Emma Watson was Lytton 's doppelgänger in the film `` Harry Potter and the Chamber of Secrets '' .,0,"Si Lytton ang kambal ni Emma Watson sa pelikulang ""Harry Potter and the Chamber of Secrets"".","Si Emma Watson ang katapat ni Lytton sa pelikulang ""Harry Potter and the Chamber of Secrets""."
6677,In 1963 Kjeld Deichmann died suddenly and Erica closed the studio and gave up the pottery art .,"In 1963 , Erica died suddenly and Kjeld Deichmann closed the studio and gave up the pottery art .",0,"Noong 1963, biglang namatay si Kjeld Deichmann at isinara ni Erica ang studio at iniwan ang sining ng pagpapalayok.","Noong 1963, biglang namatay si Erica at isinara ni Kjeld Deichmann ang studio at iniwan ang sining ng pagpapalayok."
17332,"Following the independence of Tavush Province in 1991 , Ijevan became the administrative centre of the newly founded Armenia as per the provincial reforms of 1995 .","Following the independence of Armenia in 1991 , Ijevan became the provincial centre of the newly founded Tavush province after the administrative reforms of 1995 .",0,"Kasunod ng kalayaan ng Lalawigan ng Tavush noong 1991, ang Ijevan ay naging sentro ng administrasyon ng bagong tatag na Armenia alinsunod sa mga repormang panlalawigan noong 1995.","Kasunod ng kalayaan ng Armenia noong 1991, ang Ijevan ay naging sentro ng probinsya ng bagong tatag na lalawigan ng Tavush pagkatapos ng mga repormang administratibo noong 1995."
28129,"In the miniseries '' Hemingway `` from 1988 with Stacy Keach , Duff Twysden was played by Fiona Fullerton .","In the 1988 miniseries `` Hemingway '' , starring Fiona Fullerton , Duff Twysden was played by Stacy Keach .",0,"Sa miniseries na ""Hemingway"" mula 1988 kasama si Stacy Keach, ginampanan ni Fiona Fullerton si Duff Twysden.","Sa miniserye noong 1988 na ""Hemingway"", na pinagbibidahan ni Fiona Fullerton, si Duff Twysden ay ginampanan ni Stacy Keach."
46418,The screenplay by Robert Carrington and Jane - Howard Carrington is based on the 1966 play by Frederick Knott .,The screenplay by Frederick Knott and Jane-Howard Carrington is based on the 1966 play by Robert Carrington .,0,Ang iskrip nina Robert Carrington at Jane-Howard Carrington ay batay sa dulang isinulat ni Frederick Knott noong 1966.,Ang iskrip nina Frederick Knott at Jane-Howard Carrington ay batay sa dulang isinulat ni Robert Carrington noong 1966.
7346,"However he criticised the Conservative campaign , `` some of the misrepresentations by the other candidate had not been cricket . ''","However , he criticized the other campaign , `` some of the misrepresentations by the conservative candidate had not been cricket .",0,"Gayunpaman, binatikos niya ang kampanya ng mga Konserbatibo, ""ang ilan sa mga maling representasyon ng kabilang kandidato ay hindi cricket.""","Gayunpaman, binatikos niya ang kabilang kampanya, ""ang ilan sa mga maling representasyon ng konserbatibong kandidato ay hindi tungkol sa cricket."""
3046,"In April 2011 , Aa left Akari Saho .",Aa Akari Saho left in April 2011 .,0,"Noong Abril 2011, iniwan ni Aa si Akari Saho.",Umalis si Aa Akari Saho noong Abril 2011.
43168,"My Brother Is a Dog is a 2004 film directed by Peter Timm and starring Maria Ehrich , Martin Lindow and Christine Newbauer .","My brother is a dog is a film directed by Peter Timm and Christine Newbauer , Martin Lindow and Maria Ehrich from 2004 .",0,"Ang My Brother Is a Dog ay isang pelikulang ipinunta noong 2004 sa direksyon ni Peter Timm at pinagbibidahan nina Maria Ehrich, Martin Lindow at Christine Newbauer.","Ang ""My brother is a dog"" ay isang pelikulang idinirek nina Peter Timm at Christine Newbauer, Martin Lindow at Maria Ehrich mula noong 2004."
9239,The word nanosecond is formed by the prefix `` nano '' and the base is a second second time unit or a sixtieth of a second .,The word nanosecond is formed by the prefix `` nano '' and the second one is second a basic unit of time or a sixtieth of a second .,0,"Ang salitang nanosecond ay nabuo sa pamamagitan ng unlaping ""nano"" at ang base ay isang pangalawang yunit ng oras o ikaanimnapung bahagi ng isang segundo.","Ang salitang nanosecond ay nabuo sa pamamagitan ng unlaping ""nano"" at ang pangalawa ay ang pangalawa, isang pangunahing yunit ng oras o ikaanimnapung bahagi ng isang segundo."
14808,The flood pulse concept is a theory that the annual flood pulse is the most important aspect and the most biologically productive feature of a river 's ecosystem .,The concept of flood pulse is a theory that the annual flood pulse is the most productive aspect and the biologically most important feature of the ecosystem of a river .,0,Ang konsepto ng flood pulse ay isang teorya na nagsasabing ang taunang flood pulse ang pinakamahalagang aspeto at ang pinaka-biyolohikal na produktibong katangian ng ekosistema ng isang ilog.,Ang konsepto ng flood pulse ay isang teorya na nagsasabing ang taunang flood pulse ang pinakaproduktibong aspeto at ang pinakamahalagang katangian ng ecosystem ng isang ilog sa biyolohikal na aspeto.
26194,The boat has an average PHRF racing handicap of 183 with a depth of 198 and a high of 180 .,The boat has a PHRF racing average handicap of 183 with a high of 198 and low of 180 .,0,Ang bangka ay may average na PHRF racing handicap na 183 na may lalim na 198 at taas na 180.,Ang bangka ay may PHRF racing average handicap na 183 na may pinakamataas na iskor na 198 at pinakamababa na 180.
26169,It is located about five miles southeast of Jerseyville and about seven miles northwest of Godfrey along US Highway 67 .,It is located about five miles northwest of Jerseyville and about seven miles southeast of Godfrey along the US Highway 67 .,0,Ito ay matatagpuan mga limang milya timog-silangan ng Jerseyville at mga pitong milya hilagang-kanluran ng Godfrey sa kahabaan ng US Highway 67.,Ito ay matatagpuan mga limang milya sa hilagang-kanluran ng Jerseyville at mga pitong milya sa timog-silangan ng Godfrey sa kahabaan ng US Highway 67.
1467,"Born in Albury , she grew up in Melbourne and went to Sydney in the 1930s to study nursing .","Born in Sydney , she grew up in Albury and in the 1930s went to Melbourne to study nursing .",0,"Ipinanganak sa Albury, lumaki siya sa Melbourne at nagtungo sa Sydney noong dekada 1930 upang mag-aral ng narsing.","Ipinanganak sa Sydney, lumaki siya sa Albury at noong dekada 1930 ay nagtungo sa Melbourne upang mag-aral ng narsing."
5311,The unit was armed and equipped by the Imperial Remount department and used by the Natal - volunteer department .,The unit was armed and equipped by the Imperial Remount Department and horsed by the Natal Volunteer Department .,0,Ang yunit ay armado at sinangkapan ng departamento ng Imperial Remount at ginamit ng departamento ng mga boluntaryong Natal.,Ang yunit ay armado at sinangkapan ng Imperial Remount Department at pinangungunahan ng Natal Volunteer Department.
12568,During religious persecutions he came to Serbian Šajkaši in Komárom as a renowned speaker ( `` slavni propovednik '' ) in 1739 .,"In 1739 , during renowned persecutions , he came as a religious speaker ( `` slavni propovednik '' ) to live among the Serbian Šajkaši in Komárom .",0,"Noong panahon ng mga pag-uusig sa relihiyon, napunta siya sa Serbian na si Šajkaši sa Komárom bilang isang kilalang tagapagsalita (""slavni propovednik"") noong 1739.","Noong 1739, sa panahon ng mga kilalang pag-uusig, dumating siya bilang isang relihiyosong tagapagsalita (""slavni propovednik"") upang manirahan kasama ng mga Serbian na Šajkaši sa Komárom."
9368,Ayalathe Adheham is a 1992 suspense Malayalam film directed by Sasidharan Arattuvazhi and written by Rajasenan .,Ayalathe Adheham is a Suspense Malayalam film staged by Rajasenan in 1992 and written by Sasidharan Arattuvazhi .,0,Ang Ayalathe Adheham ay isang 1992 Malayalam suspense film na idinirek ni Sasidharan Arattuvazhi at isinulat ni Rajasenan.,Ang Ayalathe Adheham ay isang 1992 Malayalam suspense film na idinirek ni Rajasenan at isinulat ni Sasidharan Arattuvazhi.
28546,These predictive functions are referred to as pedo-transfer functions in a non-spatial context .,These pedo-transfer functions are referred to as predictive functions in a non-spatial context .,0,Ang mga predictive function na ito ay tinutukoy bilang pedo-transfer function sa isang kontekstong hindi spatial.,Ang mga pedo-transfer function na ito ay tinutukoy bilang mga predictive function sa isang kontekstong hindi spatial.
