id,sentence1,sentence2,label,sentence1_translated,sentence2_translated
29568,"The estuary of the Batten Kill is in East Dorset , Vermont , and the source of the river is in Easton , New York .","The mouth of the Batten Kill is in East Dorset , Vermont , and the source of the river is in Easton , New York .",1,"Ang bunganga ng Batten Kill ay nasa East Dorset, Vermont, at ang pinagmumulan ng ilog ay nasa Easton, New York.","Ang bunganga ng Batten Kill ay nasa East Dorset, Vermont, at ang pinagmumulan ng ilog ay nasa Easton, New York."
45829,"La tempestad ( International translation : The Tempest , dubbed The Storm by Univision ) is a 2013 Mexican telenovela produced by Salvador Mejía Alejandre for Televisa .","La Tempestad ( International Translation : The Storm , called by Univision the Storm ) is a 2013 Mexican telenovela produced by Salvador Mejía Alejandre for Televisa .",1,"Ang La tempestad (Internasyonal na salin: The Tempest, na binansagang The Storm ng Univision) ay isang telenovela sa Mexico noong 2013 na prinodyus ni Salvador Mejía Alejandre para sa Televisa.","Ang La Tempestad (Internasyonal na Salin: The Storm, na tinatawag ng Univision na the Storm) ay isang telenovela sa Mexico noong 2013 na prinodyus ni Salvador Mejía Alejandre para sa Televisa."
46990,"Since 2006 , when Josephine Alhanko placed himself in the Top 20 , Cerljen was the first delegate from Sweden to the international final .",Cerljen was also the first delegate from Sweden at the international final since 2006 when Josephine Alhanko placed in the Top 20 .,1,"Mula noong 2006, nang mapasama si Josephine Alhanko sa Top 20, si Cerljen ang unang delegado mula sa Sweden sa internasyonal na final.",Si Cerljen din ang unang delegado mula sa Sweden sa international final simula noong 2006 nang makapasok si Josephine Alhanko sa Top 20.
13893,"He married Lady Florence Jane Taylour , daughter of Amelia Thompson , 3rd Marquess of Headfort and Thomas Taylour , on 5 August 1875 .","He married Lady Florence Jane Taylour , the daughter of Amelia Thompson , 3rd Marquess of Headfort and Thomas Taylour , on 5 August 1875 .",1,"Pinakasalan niya si Lady Florence Jane Taylour, anak nina Amelia Thompson, Ika-3 Marquess ng Headfort at Thomas Taylour, noong 5 Agosto 1875.","Pinakasalan niya si Lady Florence Jane Taylour, ang anak nina Amelia Thompson, Ika-3 Marquess ng Headfort at Thomas Taylour, noong 5 Agosto 1875."
41986,Elati is a village in the Kozani Regional Unit in Greece .,"Elati is a village in the Kozani regional unit , Greece .",1,Ang Elati ay isang nayon sa Kozani Regional Unit sa Gresya.,"Ang Elati ay isang nayon sa rehiyonal na yunit ng Kozani, Gresya."
1690,He had four siblings : twins Hope Gimbel and Caral Gimbel and the twins Peter Gimbel and David Gimbel .,He had four siblings : twins Peter Gimbel and David Gimbel ; and twins Hope Gimbel and Caral Gimbel .,1,Mayroon siyang apat na kapatid: ang kambal na sina Hope Gimbel at Caral Gimbel at ang kambal na sina Peter Gimbel at David Gimbel.,Siya ay may apat na kapatid: kambal na sina Peter Gimbel at David Gimbel; at kambal na sina Hope Gimbel at Caral Gimbel.
3098,"In addition , they are physically active , free to learn and eager to explore .","In addition , they are actively physically active , free to learn and eager to explore .",1,"Bukod pa rito, sila ay pisikal na aktibo, malayang matuto at sabik na maggalugad.","Bukod pa rito, sila ay aktibong pisikal na aktibo, malayang matuto at sabik na maggalugad."
26108,"Solomons was born in Orsett , Essex and brought up with his four siblings in Thorpe Bay by his mother and father .","Solomons was born in Orsett , Essex and with his four siblings in Thorpe Bay brought up by his mother and his father .",1,"Si Solomons ay ipinanganak sa Orsett, Essex at lumaki kasama ang kanyang apat na kapatid sa Thorpe Bay ng kanyang ina at ama.","Si Solomons ay ipinanganak sa Orsett, Essex at kasama ang kanyang apat na kapatid sa Thorpe Bay na pinalaki ng kanyang ina at ama."
26641,"Regardless of quick sorrow , he was known for his spiritual understanding and discipline .","He was known for his spiritual understanding and discipline , regardless of quick suffering .",1,"Sa kabila ng mabilis na kalungkutan, kilala siya sa kanyang espirituwal na pag-unawa at disiplina.","Kilala siya sa kanyang espirituwal na pag-unawa at disiplina, sa kabila ng mabilis na pagdurusa."
23768,"Other invitations followed and more sisters arrived for a hospital in Iloilo , schools in Vigan , Tuguegarao and Manila and a leprosary in Culion .","Other invitations followed and more Sisters arrived for a hospital in Iloilo , schools in Vigan , Tuguegarao , and Manila , and a Leprosarium in Culion .",1,"Sumunod ang iba pang mga imbitasyon at dumating ang iba pang mga madre para sa isang ospital sa Iloilo, mga paaralan sa Vigan, Tuguegarao at Maynila at isang ketongin sa Culion.","Sumunod ang iba pang mga imbitasyon at dumating ang mas maraming madre para sa isang ospital sa Iloilo, mga paaralan sa Vigan, Tuguegarao, at Maynila, at isang Leprosarium sa Culion."
39715,"In 1975 a group of five young photographers ( including Bronson Fellow Christopher Rauschenberg , son of Robert Rauschenberg ) pooled their resources to start a small gallery .","In 1975 , a group of five young photographers ( including Bronson Fellow Christopher Rauschenberg , son of Robert Rauschenberg ) collected their resources to start a small gallery .",1,"Noong 1975, isang grupo ng limang batang litratista (kabilang ang Bronson Fellow na si Christopher Rauschenberg, anak ni Robert Rauschenberg) ang nagsama-sama ng kanilang mga mapagkukunan upang magsimula ng isang maliit na galeriya.","Noong 1975, isang grupo ng limang batang litratista (kabilang ang Bronson Fellow na si Christopher Rauschenberg, anak ni Robert Rauschenberg) ang nagtipon ng kanilang mga mapagkukunan upang magsimula ng isang maliit na galeriya."
23,"In mathematical astronomy , his fame is due to the introduction of the astronomical globe , and his early contributions to understanding the movement of the planets .",His fame is due in mathematical astronomy to the introduction of the astronomical globe and to his early contributions to the understanding of the movement of the planets .,1,"Sa astronomiyang matematikal, ang kanyang katanyagan ay dahil sa pagpapakilala ng globong astronomikal, at sa kanyang mga unang kontribusyon sa pag-unawa sa paggalaw ng mga planeta.",Ang kanyang katanyagan sa matematikal na astronomiya ay dahil sa pagpapakilala ng astronomikal na globo at sa kanyang mga unang kontribusyon sa pag-unawa sa paggalaw ng mga planeta.
24797,"From 1898 to 1902 , about 1,300 birds were imported from America and released from Southland to Northland in many parts of the North and South Islands .","From 1898 to 1902 , some 1300 birds were imported from America and released in many parts of the North and South Islands , from Southland to Northland .",1,"Mula 1898 hanggang 1902, humigit-kumulang 1,300 ibon ang inangkat mula sa Amerika at pinakawalan mula Southland patungong Northland sa maraming bahagi ng North at South Islands.","Mula 1898 hanggang 1902, humigit-kumulang 1300 ibon ang inangkat mula sa Amerika at pinakawalan sa maraming bahagi ng North at South Islands, mula Southland hanggang Northland."
34886,"The five elected candidates were Bahrain , Brazil , Gabon , Gambia and Slovenia .","The five candidates elected were Bahrain , Brazil , Gabon , Gambia , and Slovenia .",1,"Ang limang nahalal na kandidato ay ang Bahrain, Brazil, Gabon, Gambia at Slovenia.","Ang limang kandidatong nahalal ay ang Bahrain, Brazil, Gabon, Gambia, at Slovenia."
4410,The next two functions are analogous to the above two functions and are used for base clusters .,The next two functions are analogous to the above two and are used for base clusters .,1,Ang susunod na dalawang punsiyon ay kahalintulad ng dalawang punsiyon sa itaas at ginagamit para sa mga base cluster.,Ang susunod na dalawang tungkulin ay kahalintulad ng dalawang nabanggit at ginagamit para sa mga base cluster.
9941,The Squadron RAF was a unit of the Royal Air Force in Egypt during the Second World War and then in Italy and North Africa .,651 Squadron RAF was a unit of the Royal Air Force in Egypt during the Second World War and afterwards in Italy and North Africa .,1,Ang Squadron RAF ay isang yunit ng Royal Air Force sa Ehipto noong Ikalawang Digmaang Pandaigdig at pagkatapos ay sa Italya at Hilagang Aprika.,Ang 651 Squadron RAF ay isang yunit ng Royal Air Force sa Ehipto noong Ikalawang Digmaang Pandaigdig at pagkatapos ay sa Italya at Hilagang Aprika.
4704,The 1983 TV movie `` Sam Elliott : The Empty Copper Sea '' starred Travis McGee .,The TV movie 1983 `` Sam Elliott : The Empty Copper Sea '' played Travis McGee .,1,"Ang pelikulang pantelebisyon noong 1983 na ""Sam Elliott: The Empty Copper Sea"" ay pinagbidahan ni Travis McGee.","Ang pelikulang pantelebisyon noong 1983 na ""Sam Elliott: The Empty Copper Sea"" ay gumanap bilang Travis McGee."
43116,"Bentley and carvings by Hugh Stannus , while the meeting room contains a decorative ceiling by Thomas Earp .",Bentley and carvings by Hugh Stannus while the board room contains a decorative ceiling by Thomas Earp .,1,"Bentley at mga inukit ni Hugh Stannus, habang ang silid-pulungan ay naglalaman ng isang pandekorasyon na kisame ni Thomas Earp.",Bentley at mga inukit ni Hugh Stannus habang ang silid-pulungan ay naglalaman ng pandekorasyon na kisame ni Thomas Earp.
39241,"In bioinformatics , inverted indexes are very important in the sequence assembly of short fragments of sequenced DNA .","In bioinformatics , inverted indices in the sequence assembly of short fragments of sequenced DNA are very important .",1,"Sa bioinformatics, ang mga inverted index ay napakahalaga sa sequence assembly ng maiikling fragment ng sequenced DNA.","Sa bioinformatics, napakahalaga ng mga inverted indices sa sequence assembly ng maiikling fragment ng sequenced DNA."
39290,"It is endemic to Hawaii , where it is known only from the northern Koolau Mountains of Oahu .","It is endemic to Hawaii , where it is only known from the northern Koolau Mountains of Oahu .",1,"Ito ay endemik sa Hawaii, kung saan ito ay kilala lamang mula sa hilagang Kabundukan ng Koolau ng Oahu.","Ito ay endemik sa Hawaii, kung saan ito ay kilala lamang mula sa hilagang Kabundukan ng Koolau ng Oahu."
1923,"The album contains 16 tracks recorded during two May 2002 performances , one in Memphis , Tennessee , and the other in Chicago , Illinois .","The album contains 16 tracks recorded during two appearances in May 2002 , one in Memphis , Tennessee , and the other in Chicago , Illinois .",1,"Ang album ay naglalaman ng 16 na track na naitala sa dalawang pagtatanghal noong Mayo 2002, isa sa Memphis, Tennessee, at ang isa pa sa Chicago, Illinois.","Ang album ay naglalaman ng 16 na track na naitala sa dalawang paglabas noong Mayo 2002, isa sa Memphis, Tennessee, at ang isa pa sa Chicago, Illinois."
104,Ruffell was employed as an engineer in Southampton Docks and died on 3 October 1940 in Southampton on his 73rd birthday .,"Ruffell was employed as an engineer in Southampton Docks . He died in Southampton on his 73rd birthday , 3 October 1940 .",1,Si Ruffell ay nagtrabaho bilang isang inhinyero sa Southampton Docks at namatay noong ika-3 ng Oktubre 1940 sa Southampton sa kanyang ika-73 kaarawan.,"Si Ruffell ay nagtrabaho bilang isang inhinyero sa Southampton Docks. Namatay siya sa Southampton noong kanyang ika-73 kaarawan, noong ika-3 ng Oktubre 1940."
22637,The tendered speed limit is generally reduced as low as within the two cities .,"The posted speed limit is generally , reduced as low as within the two cities .",1,Ang itinakdang speed limit ay karaniwang ibinababa nang kasingbaba ng sa loob ng dalawang lungsod.,Ang naka-post na speed limit ay karaniwang binabawasan nang kasingbaba ng sa loob ng dalawang lungsod.
4131,"Adam Ludwik Czartoryski was married to Prince Maria , married on August 31 , 1901 in Warsaw .","Adam Adam Ludwik Czartoryski was married to Prince Maria , who married in Warsaw on 31 August 1901 .",1,"Si Adam Ludwik Czartoryski ay ikinasal kay Prinsipe Maria, na ikinasal noong Agosto 31, 1901 sa Warsaw.","Si Adam Adam Ludwik Czartoryski ay ikinasal kay Prinsipe Maria, na ikinasal sa Warsaw noong 31 Agosto 1901."
38621,"In 1955 , Johannes Herman Johannes married Annie Marie Gilbertine Amalo .",Annie Marie Gilbertine Amalo married Herman Johannes in 1955 .,1,"Noong 1955, pinakasalan ni Johannes Herman Johannes si Annie Marie Gilbertine Amalo.",Pinakasalan ni Annie Marie Gilbertine Amalo si Herman Johannes noong 1955.
4221,"C2c uses Class 357 and Class 387 units on the London , Tilbury and Southend Railway from Shoeburyness and Southend to London Fenchurch Street .","C2c uses Class 357 and Class 387 units on services down the London , Tilbury and Southend Railway line from Shoeburyness and Southend to London Fenchurch Street .",1,"Gumagamit ang C2c ng mga yunit ng Class 357 at Class 387 sa London, Tilbury at Southend Railway mula Shoeburyness at Southend hanggang London Fenchurch Street.","Gumagamit ang C2c ng mga yunit ng Class 357 at Class 387 sa mga serbisyo sa linya ng London, Tilbury at Southend Railway mula Shoeburyness at Southend hanggang London Fenchurch Street."
45606,"In 1958 he spoke throughout East Asia and in Western Europe , and in 1961 in Northern Ghana .",In 1958 he spoke throughout East Asia and Western Europe and in 1961 in Northern Ghana .,1,"Noong 1958, nagsalita siya sa buong Silangang Asya at sa Kanlurang Europa, at noong 1961 sa Hilagang Ghana.","Noong 1958, nagsalita siya sa buong Silangang Asya at Kanlurang Europa at noong 1961 sa Hilagang Ghana."
36703,"In addition , the song `` Calling All Angels '' is included in the film by Jane Siberry and is played on the audio track .","In addition , the song `` Calling All Angels '' by Jane Siberry is included in the film and is played on the soundtrack .",1,"Bukod pa rito, ang kantang ""Calling All Angels"" ay kasama sa pelikula ni Jane Siberry at pinapatugtog sa audio track.","Bukod pa rito, ang kantang ""Calling All Angels"" ni Jane Siberry ay kasama sa pelikula at pinapatugtog sa soundtrack."
5914,"The area was once served by Edinburgh Waverley Railway Station , which provided direct access to the railway to Corstorphine .",The area was once served by Edinburgh Waverley railway station which provided direct railway access to Corstorphine .,1,"Ang lugar ay dating pinaglilingkuran ng Estasyon ng Tren ng Edinburgh Waverley, na nagbigay ng direktang daanan papuntang Corstorphine.",Ang lugar ay dating pinaglilingkuran ng istasyon ng tren ng Edinburgh Waverley na nagbigay ng direktang daanan ng tren papuntang Corstorphine.
18516,Morris Township is located in the 25th Congressional District and is part of the 11th State Legislative District of New Jersey .,Morris Township is located in the 25th Congressional District and is part of New Jersey 's 11th state legislative district .,1,Ang Morris Township ay matatagpuan sa ika-25 Distrito ng Kongreso at bahagi ng ika-11 Distrito ng Lehislatura ng Estado ng New Jersey.,Ang Morris Township ay matatagpuan sa ika-25 Distrito ng Kongreso at bahagi ng ika-11 distrito ng lehislatura ng estado ng New Jersey.
23134,"He died on 24 August 1878 in Wyandotte ( now part of Kansas City ) , Kansas .","He died in Wyandotte ( now a part of Kansas ) , Kansas City , August 24 , 1878 .",1,"Namatay siya noong ika-24 ng Agosto 1878 sa Wyandotte (na ngayon ay bahagi na ng Kansas City), Kansas.","Namatay siya sa Wyandotte (na ngayon ay bahagi na ng Kansas), Kansas City, noong Agosto 24, 1878."
16734,"In the , Daniel Dewey ( F ) resigned February 24 , 1814 and was replaced in a special election by John W. Hulbert ( F )","In Daniel Dewey ( F ) resigned February 24 , 1814 , and was replaced by a special election of John W. Hulbert ( F ) .",1,"Noong , si Daniel Dewey (B) ay nagbitiw noong Pebrero 24, 1814 at pinalitan sa isang espesyal na halalan ni John W. Hulbert (B).","Noong Pebrero 24, 1814, nagbitiw si Daniel Dewey (B). Pinalitan siya ng isang espesyal na halalan ni John W. Hulbert (B)."
5512,ObjecTime Developer ( or ObjecTime or OTD ) is a software automation tool designed to meet the development needs of short-term software development teams .,"ObjecTime Developer ( or ObjecTime or OTD , for real ) is a software automation tool designed to meet the development needs of short-time software development teams .",1,Ang ObjecTime Developer (o ObjecTime o OTD) ay isang software automation tool na idinisenyo upang matugunan ang mga pangangailangan sa pag-develop ng mga panandaliang software development team.,"Ang ObjecTime Developer (o ObjecTime o OTD, sa totoo lang) ay isang software automation tool na idinisenyo upang matugunan ang mga pangangailangan sa pag-develop ng mga panandaliang software development team."
1512,Manipur is also a tourist hotspot in the state of Ukhrul .,Manipur is also a tourist hotspot of Ukhrul state .,1,Ang Manipur ay isa ring lugar na dinadayo ng mga turista sa estado ng Ukhrul.,Ang Manipur ay isa ring lugar na dinarayo ng mga turista sa estado ng Ukhrul.
40859,"Music is in his blood because he inherited this art from his grandfather , Ustad Banne Khan , who is himself a singer .",Music runs in his blood as he has inherited this art from his grandfather Ustad Banne Khan who is a singer himself .,1,"Nasa dugo niya ang musika dahil minana niya ang sining na ito mula sa kanyang lolo, si Ustad Banne Khan, na isa ring mang-aawit.",Nananalaytay sa kanyang dugo ang musika dahil namana niya ang sining na ito mula sa kanyang lolo na si Ustad Banne Khan na isang mang-aawit din.
17094,"Balıklı is a village in the District of Gümüşhacıköy , Amasya Province , Turkey .","Balıklı is a village in the district Gümüşhacıköy , Turkey , province of Amasya .",1,"Ang Balıklı ay isang nayon sa distrito ng Gümüşhacıköy, lalawigan ng Amasya, Turkey.","Ang Balıklı ay isang nayon sa distrito ng Gümüşhacıköy, Turkey, sa lalawigan ng Amasya."
4885,"He was created a doctor of the Sorbonne , and afterwards elected prior of St. Edmund 's in 1689 .","He was created a doctor of the Sorbonne , and later elected Prior of St. Edmund in 1689 .",1,"Siya ay hinirang na isang doktor ng Sorbonne, at pagkatapos ay nahalal na prior ng St. Edmund's noong 1689.","Siya ay ginawang doktor ng Sorbonne, at kalaunan ay nahalal na Prior ng San Edmund noong 1689."
6317,"The new year , the spring , the wine and the joyful are also loved .","Also , The new year , the spring , the wine and the joyful are beloved .",1,"Minamahal din ang bagong taon, ang tagsibol, ang alak at ang masasaya.","Gayundin, ang bagong taon, ang tagsibol, ang alak at ang masasaya ay minamahal."
38138,In the 1970s Suzuki was one of the first buyers of Woolrich fashion in Japan . In 2006 he became a designer for Woolrich Woolen Mills in America .,In the 1970s Suzuki was one of the first buyers of Woolrich Mode in Japan and became Designer for Woolrich Woolen Mills in America in 2006 .,1,"Noong dekada 1970, isa si Suzuki sa mga unang mamimili ng Woolrich fashion sa Japan. Noong 2006, naging taga-disenyo siya para sa Woolrich Woolen Mills sa Amerika.","Noong dekada 1970, isa si Suzuki sa mga unang bumili ng Woolrich Mode sa Japan at naging Disenyador para sa Woolrich Woolen Mills sa Amerika noong 2006."
15523,"An alternative extension to compact groups is the Peter -- Weyl theorem , which proves results about representations of compact groups analogous to those about finite groups .","An alternative extension to compact groups is the Peter -- Weyl -- Theorem , which shows results about representations of compact groups analogous to those about finite groups .",1,"Ang alternatibong pagpapalawig sa mga compact group ay ang Peter -- Weyl theorem, na nagpapatunay ng mga resulta tungkol sa mga representasyon ng mga compact group na kahalintulad ng mga resulta tungkol sa mga finite group.","Ang isang alternatibong ekstensyon sa mga compact group ay ang Peter -- Weyl -- Theorem, na nagpapakita ng mga resulta tungkol sa mga representasyon ng mga compact group na kahalintulad ng mga resulta tungkol sa mga finite group."
48700,"In order to obtain a biomarker for diagnostics , the sample material must be as easy to use as possible .","In order to obtain a biomarker for diagnostics , the sample material must be as simple as possible to use .",1,"Upang makakuha ng biomarker para sa mga diagnostic, ang materyal ng sample ay dapat na madaling gamitin hangga't maaari.","Upang makakuha ng biomarker para sa mga diagnostic, ang materyal na sample ay dapat na kasing simple hangga't maaari gamitin."
8725,Protein FAM40A is a protein that is located on chromosome 1 in humans and is encoded by the `` FAM40A '' gene .,FAM40A is a protein that is chromosome 1 in humans and is encoded by the `` FAM40A '' gene .,1,"Ang protina na FAM40A ay isang protina na matatagpuan sa chromosome 1 sa mga tao at naka-encode ng gene na ""FAM40A"".","Ang FAM40A ay isang protina na nasa chromosome 1 sa mga tao at naka-encode ng gene na ""FAM40A""."
23582,The screenplay by Robert Carrington and Jane-Howard Carrington is based on the 1966 play by Frederick Knott .,The screenplay by Robert Carrington and Jane - Howard Carrington is based on the 1966 play by Frederick Knott .,1,Ang iskrip nina Robert Carrington at Jane-Howard Carrington ay batay sa dulang isinulat ni Frederick Knott noong 1966.,Ang iskrip nina Robert Carrington at Jane-Howard Carrington ay batay sa dulang isinulat ni Frederick Knott noong 1966.
29849,"For scalar spectral fluctuations , formula _ 9 is referred to as the scalar index , with formula _ 10 corresponding to scale invariant fluctuations .","For scalar spectral fluctuations , Formula 9 is referred to as the scalar index , with the formula 10 corresponding to scalar invariant fluctuations .",1,"Para sa mga scalar spectral fluctuations, ang formula _9 ay tinutukoy bilang scalar index, na may formula _10 na tumutugma sa scale invariant fluctuations.","Para sa mga scalar spectral fluctuations, ang Formula 9 ay tinutukoy bilang scalar index, kung saan ang formula 10 ay tumutugma sa mga scalar invariant fluctuations."
21573,"Kerwin Moore would see action in 24 games for the Athletics that fall , and was traded to the Florida Marlins after the season in exchange for Abbott .","Kerwin Moore saw action in 24 games for the athletics that fall , and was traded to the Florida - Marlins after the season in exchange for Abbott .",1,"Si Kerwin Moore ay makakalaro sa 24 na laro para sa Athletics sa mga huling araw ng taglagas, at ipinagpalit sa Florida Marlins pagkatapos ng season kapalit ni Abbott.","Si Kerwin Moore ay naglaro sa 24 na laro para sa athletics noong taglagas, at ipinagpalit sa Florida-Marlins pagkatapos ng season kapalit ni Abbott."
36465,"Dorchester is sometimes associated with Avenue D , since Ditmas and Ditmas Avenue and Dorchester Road start with the letter `` D '' .","Dorchester are sometimes associated with Avenue D , since Ditmas and Ditmas Avenue and Dorchester Road start with the letter `` D '' .",1,"Ang Dorchester ay minsang iniuugnay sa Avenue D, dahil ang Ditmas at Ditmas Avenue at Dorchester Road ay nagsisimula sa letrang ""D"".","Ang Dorchester ay minsang iniuugnay sa Avenue D, dahil ang Ditmas at Ditmas Avenue at Dorchester Road ay nagsisimula sa letrang ""D""."
27861,"The Russian villain is , however , an original and sometimes interesting danger .","The Russian villain , however , is an original and sometimes interesting menace. ``",1,"Gayunpaman, ang kontrabidang Ruso ay isang orihinal at kung minsan ay kawili-wiling panganib.","Gayunpaman, ang kontrabida na Ruso ay isang orihinal at kung minsan ay kawili-wiling banta."
19223,It was believed that true philosophy could be separated from popular wisdom by this method .,It was believed by this method true philosophy could be separated from popular wisdom .,1,Pinaniniwalaan na ang tunay na pilosopiya ay maaaring ihiwalay mula sa karunungang popular sa pamamagitan ng pamamaraang ito.,Pinaniniwalaang sa pamamagitan ng pamamaraang ito ay maaaring ihiwalay ang tunay na pilosopiya mula sa karunungang popular.
46127,"He sang with success also at La Fenice in Naples , at the Maggio Musicale Fiorentino in Florence and at the Teatro San Carlo in Venice .","He also sang with success at La Fenice in Naples , the Maggio Musicale Fiorentino in Florence , and the Teatro San Carlo in Venice .",1,"Matagumpay din siyang umawit sa La Fenice sa Naples, sa Maggio Musicale Fiorentino sa Florence at sa Teatro San Carlo sa Venice.","Matagumpay din siyang umawit sa La Fenice sa Naples, sa Maggio Musicale Fiorentino sa Florence, at sa Teatro San Carlo sa Venice."
3785,He is a professor of adult education at Åbo Akademi University in Finland ( Vaasa ) .,"He is a Professor of Adult Education at Åbo Akademi University in Vaasa , Finland .",1,Siya ay isang propesor ng edukasyon para sa mga nasa hustong gulang sa Åbo Akademi University sa Finland (Vaasa).,"Siya ay isang Propesor ng Edukasyon para sa mga Nasa Hustong Gulang sa Åbo Akademi University sa Vaasa, Finland."
6714,It was created with the redistribution in 1972 and replaced the abolished Toowoomba East .,"It was created with the 1972 redistribution , and replaced the abolished Toowoomba East .",1,Ito ay nilikha kasabay ng muling pamamahagi noong 1972 at pinalitan ang inalis na Toowoomba East.,"Ito ay nilikha kasabay ng muling pamamahagi noong 1972, at pinalitan ang inalis na Toowoomba East."
