text,summary
"Wightlink, Red Funnel and Hovertravel jointly agreed new limited timetables between Portsmouth and Southampton and the Isle of Wight. The companies said there had been an ""almost total drop"" in passenger demand as well as reduced freight volumes. They said the new timetables would maintain ""lifeline"" services. Wightlink suspended its Lymington-Yarmouth car ferry route last week and is set to reduce its Portsmouth to Fishbourne service. It is also suspending its Portsmouth to Ryde Fast Cat service. Red Funnel is reducing Red Jet catamaran sailings between Southampton and West Cowes at non-peak times and coordinating its timetable with NHS workers' shift patterns. Hovertravel has stepped up its ""on demand"" service to allow approved organisations to order a hovercraft to move staff and medical supplies across the Solent at any time. All tickets will be valid on rival companies' crossings. The changes were agreed at a meeting of the Isle of Wight Transport Infrastructure Board earlier. Chairman Christopher Garnett said they would maintain ""full resilience"" for the island. ""These are lifeline services for the island, bringing in all our supplies and freight - including food and fuel - and providing key connectivity in areas such as mainland travel for hospital appointments, whether on foot or by ambulance,"" he said. Isle of Wight MP Bob Seeley said the companies were ""behaving very responsibly"". ""We do however need a skeleton ferry service to ensure food and medical supplies can get to the island,"" he said. ""We also need to make sure that key workers can come here to support the NHS and other vital services that keep people alive and safe."" Travellers on cross-Solent services have already been allowed to remain in vehicles to maintain social distancing with special dispensation announced on 19 March.","Ferry sailings across the Solent are being reduced to a ""skeleton service"" amid the coronavirus crisis, operators have announced."
"She was the only candidate to succeed Ms de Brun, who is stepping down as an MEP for personal reasons. Ms Anderson said: ""Bairbre is a friend and leader and has left big shoes for me to fill. ""She is a household name, she made a valuable contribution to our struggle and will do so again - and she will be a hard act to follow."" The move means Sinn Fein will have to replace Ms Anderson in the assembly and find a new junior minister for the Office of the First and Deputy First Minister.","Martina Anderson is to replace Bairbre de Brun in the European Parliament, Sinn Fein has confirmed."
"It follows a burglary in Galleywood, near Chelmsford, in which jewellery and a games console were taken. The suspected burglar was given a caution - a move which Chief Constable Jim Barker-McCardle said had left him ""staggered"". Essex Police and Crime Commissioner Nick Alston said he wanted to know how often cautions were used. ""I need to know whether this is an isolated incident or whether this is happening a lot,"" he said. ""One of the things which is happening now is there is a review. ""I want to know whether there are more cautions happening for burglaries or fewer. 'Most alarmed' ""The indication we've got is that over recent years it has been going down, that's a good thing, but I want to make sure that trend hasn't changed."" Monique Carson, the victim of the burglary, said she was ""furious"" when she learned the suspected burglar had been given a caution. She told how other victims of burglary had voiced their support for her. Mr Barker-McCardle said he had referred three of his officers to the professional standards department. He said he first became aware of the case when Ms Carson recently spoke to the Essex Chronicle about the break-in, which happened in November. The chief constable wrote to the chairman of the Essex branch of the Magistrates' Association, saying how ""startled"" and ""most alarmed"" he was, and also had case files sent to the Crown Prosecution Service.",The issuing of cautions to suspected burglars by police in Essex is to be reviewed.
"Chwarae Teg said attitudes towards gender significantly affect young woman. Helen Antoniazzi, of the charity, said its own research on career aspirations suggested young women felt pressured into gender-stereotype roles. Cafe owner Bethan Roberts said she had experienced her ""fair share of sexism"", even when she was her own boss. Ms Roberts, 22, has been running The Haystack in Swansea for the last six months with her boyfriend. She said she had to sack someone because he would ""not take her seriously"". ""We had a chef but we had to get rid of him because he just wouldn't listen to me. He listened to whatever Liam said because he was a man, but me? No, nothing."" Ms Antoniazzi said: ""We've all got a responsibility as a wider society to tackle it. ""I think that a lot of people think that we're worrying about something that doesn't matter, but actually the effect on young women can be quite serious. ""I think that we need to stop thinking about this as something that the woman facing it should tackle alone."" She added: ""The main thing that people can do is just challenge these things when they see them happening, and also challenge ourselves as well and think of what we're saying and the effect that might have on someone."" Ms Roberts said: ""I think it's definitely an issue, especially being young as well. Suppliers and even people in general just don't take you as seriously just because you are a young woman in business. ""When we first opened we'd have suppliers come in and try and sell us products and stuff, and they would often come in and ask to speak to someone who was in charge and they just wouldn't believe that it was me.""","Women should not have to tackle casual sexism in the workplace on their own, a leading equality charity has said."
"PC Darren Bond is due to be sentenced on 21 September at Gloucester Crown Court after admitting eight offences relating to indecent images. A misconduct hearing for gross misconduct will be held in public at force headquarters on Tuesday. Bond, 46, was stationed at Kenneth Steele House in Bristol. The misconduct hearing will hear evidence that two phones were seized when his home was searched in November 2017. 'Wholly abhorrent' They contained 579 indecent images - some of the highest level of severity - and six movie files of children. On 10 August, Bond admitted distributing the images through online chat forums. Speaking after this court appearance, head of investigations Ch Supt Carolyn Belafonte said: ""This officer has pleaded guilty to wholly abhorrent offences and we utterly condemn his behaviour. ""Downloading or sharing indecent images of children perpetuates this vile industry and encourages offenders to commit acts of abuse. ""A full safeguarding review has been carried out to identify and address the risks posed by his offending.""",An Avon and Somerset police officer who made and shared images of child abuse on internet forums is set to be sacked from the force.
"The star, who played Mr Sulu, is now a high-profile campaigner for LGBTI rights. After buying a new jumper, he toured some of the archipelago's historic sites and attended a storytelling event. One fan commented on social media that the 81-year-old looked as though he was living long, and prospering. However, that catchphrase belongs to the character Mr Spock, played by the late Leonard Nimoy. Fran Flett Hollinrake, custodian of Kirkwall's St Magnus Cathedral, who led the storytelling show, said that Takei, who played the helmsman of the USS Enterprise Mr Sulu, had ""laughed in all the right places"".",Former Star Trek actor George Takei caused a flurry of excitement when he arrived in Orkney on a cruise liner.
"Ford chief executive Mark Fields said it was ""going forward"" with its plan to shift production of small cars from its Michigan plant. However, he repeated assurances that no jobs would be lost due to the move. Mr Trump threatened during the election campaign to impose a tariff on car imports from firms like Ford. He said companies which moved jobs abroad would be charged ""a 35% tax when they want to ship their products back into the United States"". The president-elect also said he would build a wall with Mexico and renegotiate the terms of the North American Free Trade Agreement (Nafta), which includes Mexico. But the Ford boss said a levy on car imports would hurt the US economy. ""A tariff like that would be imposed on the entire auto sector that could have a major impact on the US economy,"" Mr Fields told reporters at the Los Angeles auto show. ""I continue to think that the right policies will prevail because we continue to share the same objective which is a healthy and vibrant US economy,"" he said. Ford has previously said it would shift production of its US-produced Focus and C-Max models to a new facility in Mexico by 2018. Mr Fields said on Tuesday it was moving the Focus to make room for two new products in Michigan. He also expressed support for free trade deals like Nafta, echoing comments from BMW chief executive Harald Krueger last week.",US carmaker Ford is pushing ahead with plans to move some production to Mexico despite a threat by President-elect Donald Trump to impose hefty tariffs.
"Foreign minister Maria Fernanda Espinosa said the UK was unwilling to take part in talks about his release. A UK Foreign Office spokesman said Mr Assange should ""leave the embassy to face justice"". Mr Assange, 46, has been staying at the country's London embassy since 2012 where he was granted political asylum. Last week, the arrest warrant against him was upheld meaning as soon as he leaves the embassy he will be detained. Ecuador's foreign minister said: ""On the issue of mediation, I have to say very honestly that it has not been successful because two parties are needed to mediate. Ecuador is willing, but not necessarily the other party"". She said her country would ""continue looking for mechanisms"" to end the stalemate. But a spokesman from the UK Foreign Office said: ""Ecuador knows that the way to resolve this issue is for Julian Assange to leave the embassy to face justice"" Last December, Mr Assange was granted Ecuadorean citizenship in a move which the country hoped could give him immunity in the UK. But the UK does not recognise Mr Assange as a diplomatic agent and continues to insist he should ""face justice"". There is no extradition treaty between the UK and Ecuador so he cannot be arrested inside the embassy. Mr Assange breached bail conditions when he sought refuge at the Ecuadorean embassy six years ago. He faced questioning over sexual assault allegations in Sweden, which have since been dropped. Previously, Mr Assange has justified his decision to break bail conditions arguing if he faced the Swedish authorities he would be extradited to the US over the publication of classified documents.",Ecuador says the country's latest efforts to negotiate the departure of WikiLeaks founder Julian Assange from its London embassy have failed.
"Walsh said viewers should ""expect a lot of poignancy"" from the episode. The pair have been at Jodie Whittaker's side since 2018. Cole said it had been ""an honour"" to play Ryan opposite Walsh's Graham and Whittaker's Doctor. Titled Revolution of the Daleks, the special will also see John Barrowman return as Captain Jack Harkness. Barrowman said it was ""great being back"" and that returning to the show had been ""like going home"". Walsh and Cole made their Doctor Who debuts at the start of Whittaker's first full series as the time-travelling Time Lord. They went on to appear in two series as well as the 2019 special Resolution, which also featured the villainous Daleks. Walsh said it was ""amazing"" to be ""only one of a few people on the planet"" to have battled the Doctor's long-time robotic nemeses. The comedian and host of game show The Chase said he had ""absolutely loved"" being on the long-running sci-fi programme and would miss ""everyone and everything"" involved. Meanwhile, Cole said filming his last scene had been ""emotional"". Barrowman, who has played Captain Jack in both Doctor Who and its spin-off Torchwood, said the Daleks were the show's ""quintessential"" villains. ""They are never to be underestimated as they will always find a way to survive, which is exactly why they have survived over centuries,"" he added. Cole said: ""Working with the Daleks is sort of like working with Doctor Who royalty. You have to respect them because they are so iconic."" The Christmas special will see Mandip Gill resume her role as companion Yasmin, while Chris Noth returns as business tycoon Jack Robertson. It will also see Dame Harriet Walter make her Doctor Who debut alongside Nathan Stewart-Jarrett, of Utopia and Misfits fame. ""We've crammed this year's Doctor Who festive special with an explosion of extraordinary acting talent,"" executive producer Chris Chibnall said. Follow us on Facebook, or on Twitter @BBCNewsEnts. If you have a story suggestion email entertainment.news@bbc.co.uk.","Bradley Walsh and Tosin Cole will make their final appearances as the Doctor's companions in the Doctor Who special on New Year's Day, the BBC has revealed."
The device was spotted by a man sorting through a relative's belongings at a house on Kingsway in Waterloo at about 10:50 GMT. Specialist officers from the bomb disposal team were called to the scene and made the device safe. Kingsway was closed between Crosby Road North and Stuart Road as a precaution but later reopened.,An area of Merseyside was cordoned off after what is believed to be a World War II grenade was found.
"A total of four men have now been charged with murdering Jack Donoghue, who died in hospital after the attack near Popworld in Solihull on Saturday. Tyrall Blake, 21, of no fixed address, and Nile Bennett, 22, from Erdington, Birmingham, appeared before the city's magistrates on Thursday. Connor Moore, 20, and Regan Watters, 21, appeared at crown court earlier. The pair, from Lichfield and Birmingham, were remanded in custody and will appear at the city's crown court on 6 January. Mr Blake and Mr Bennett were remanded in custody by magistrates to appear at the same court on Friday. All four defendants are also charged with violent disorder and Mr Blake faces charges of assault with intent to commit robbery and having a knife in public. Police also arrested a fifth man, aged 23, on suspicion of murder who has been released on bail. A 39-year-old man arrested on suspicion of assisting an offender has been released under investigation. Follow BBC West Midlands on Facebook, on Twitter, and sign up for local news updates direct to your phone.",Two further men have been charged with murdering a 21-year-old who was stabbed near a nightclub.
"Lewis Daniel Thornton, Daniel Gerald Ferris and Rory Allen left HMP Sudbury, in Derbyshire, on Saturday and failed to return. They have connections to Birmingham, Wolverhampton and Walsall. Derbyshire Police have warned the public not to approach the men, and said anyone who sees them should get in touch with the force ""immediately"". Thornton, 29, was convicted of manslaughter at Wolverhampton Crown Court in 2016. He is white, 6ft 2in (1.9m) tall and has blue eyes, brown hair and is of thin build. He also has a ""RIP Cobra"" tattoo on his right wrist and ""Angel"" tattooed on his left arm. He has links to the Wolverhampton and Walsall areas. Ferris, 30, was convicted at Birmingham Crown Court of robbery in 2018. He is white, with blue eyes, brown hair and is of medium build and has links to the Birmingham area. Allen, 33, was convicted of being concerned in the supply of cocaine and heroin at Worcester Crown Court in 2018. He is black, 6ft 2in tall and has brown eyes, black hair, a black moustache and is of thin build. He also has ""Tug"" tattooed on his right arm and has links to the Birmingham, Walsall and Wolverhampton areas. A spokesperson for Derbyshire Police said: ""Anyone who sees, or knows where any of the trio is, is asked to contact [us] immediately quoting reference 906 of 5 December."" The force said members of the public could alert them via social media, e-mail or 101. HMP Sudbury is an open prison where inmates are typically moved towards the end of their sentences. Follow BBC East Midlands on Facebook, Twitter, or Instagram. Send your story ideas to eastmidsnews@bbc.co.uk.","Three criminals, including one convicted of manslaughter, have absconded from prison."
"Egyptian telecoms firm Orascom, which is a partner in Koryolink, estimates that more than 1 million North Koreans use mobile phones. They will not be able to use the new service, according to reports. Orascom launched a 3G phone network inside North Korea in 2008, but users can only use it to make phone calls. International calls, including calls to South Korea, are banned. In January 2013 the government began allowing foreign visitors to bring their own mobile devices into the country with them for the first time. Following a recent visit to the notoriously closed country, Google Executive Chairman Eric Schmidt wrote in a blog post that North Korea's decision to isolate itself ""is very much going to affect their physical world and their economic growth."" He added that it would be ""very easy"" for 3G internet access to be enabled on the existing service. Current internet access is extremely limited for locals, with most people only having access to a small number of state-run pages. North Korea expert Scott Thomas Bruce previously told the BBC this comprises mainly ""message boards, chat functions, and state sponsored media"". ""The system they've set up is one that they can control and tear down if necessary,"" he said.",North Korean mobile phone provider Koryolink is planning to launch a 3G data service for foreign visitors and residents from abroad.
"It predicted that prices would have to rise 1% between 2016 and 2020. That is on top of an increase of 5% it expects to have to make as a result of general wage inflation. The Living Wage means that the minimum wage will be set at £7.20 an hour for over-25s from April 2016, which is forecast to rise to £9.35 in 2020. The prediction came with Next's half year results - pre-tax profits came in at £347m, up 7% from the same period of 2014. Earlier in the year, the company's shares fell after it issued a cautious sales outlook, predicting they would grow between 1.5% and 5.5%. In the first half, total Next group sales were up 2.7% compared with the same period of 2014. Budget changes On Wednesday, the Institute for Fiscal Studies (IFS) published some research into how far the National Living Wage (NLW) would offset the cuts in benefits and tax credits announced in the 2015 Budget. It found that families with someone in paid employment that are eligible for benefits or tax credits would lose an average of £750 a year as a result of the changes. The IFS estimates that this group of 8.4 million working-age households will gain an average of £200 a year from the NLW. It says this is an optimistic estimate because it assumes that the NLW will have no effect on GDP, employment or the number of hours worked. Those averages also mask the differences in effects on different income groups. The IFS estimated that households in lower income groups would lose more as a result of the tax credit and benefit changes but gain less as a result of the NLW.",The retailer Next has set out the effect it thinks the government's National Living Wage will have on its prices.
"He will be succeeded by chairman Masashi Muromachi, with vice-chairman Norio Sasaki also stepping down. On Monday, an independent panel appointed by Toshiba said the firm had overstated its operating profit by a total of 151.8bn yen ($1.22bn, £780m). The overstatement was roughly triple an initial Toshiba estimate. The finance minister, Taro Aso, said the case could undermine confidence in corporate governance in Japan. The inquiry found that the misreporting of profits began after the financial crash seven years ago, when senior managers began imposing unrealistic performance targets. ""Within Toshiba, there was a corporate culture in which one could not go against the wishes of superiors,"" the report said. ""Therefore, when top management presented 'challenges', division presidents, line managers and employees below them continually carried out inappropriate accounting practices to meet targets in line with the wishes of their superiors.""",Toshiba's chief executive and president Hisao Tanaka is to resign after the company said it had overstated its profits for the past six years.
"Free parking will be reduced from one hour to 30 minutes from 15 August. Short stay parking will be charged at a tariff of £1 between 31 minutes and an hour, £1.50 for up to two hours and £2.50 for up to four hours. Disabled parking will continue to be free of charge for airport patrons. The initial proposal to charge for the entire first hour was met with opposition from the Isle of Man's passenger watchdog last month. Infrastructure minister David Cretney said: ""I believe that having a 30 minute free period takes note of the public comments and responds in a positive way. ""We will also re-instate a conveniently placed disc zone within the short stay car park, for genuine short-term users, so that meeters and greeters or those with mobility issues can park near the terminal and collect their passengers and luggage, and depart within the 30 minute period.""","A new system of parking charges will be introduced at Ronaldsway airport later this month, the Isle of Man government has confirmed."
"The 21-year-old was found seriously injured in Milan Road, Harehills, shortly after 19:00 GMT on Monday. She died a short time later in hospital. Karar Ali, 29, of Milan Road, is due to appear at Leeds Magistrates' Court later. A 34-year-old man who was arrested in connection with the incident has been released without charge, police say. Related Internet Links HM Courts Service",A man has been charged with murder following the death of a woman in Leeds.
"The viruses were found on office computers and in a system used to model the movement of nuclear fuel rods. Power firm RWE said the infection posed no threat to the plant because its control systems were not linked to the internet, so the viruses could not activate. German federal cyber investigators are now analysing how the Gundremmingen plant became infected. No damage The viruses were found on the fuel rod modelling system and on 18 USB sticks used as removable data stores on office computers. Staff found the viruses as they prepared to upgrade the computerised control systems for the plant's Block B, which is currently not producing power while it undergoes scheduled maintenance. More than 1,000 computers have now been checked for infection and cleaned up, an RWE spokesman told newspaper Die Zeit. The plant has also improved its security controls. No system directly involved with the control of the nuclear reactors was infected, RWE said, and there was no danger to the public as a result of the infection. ""All sensitive plant areas are decoupled and designed with redundancy and protected against manipulation,"" added RWE in a statement. Among the viruses were two well-known malicious programs - W32.Ramnit and Conficker. Ramnit debuted in 2010 and is a remote access tool that its creators use to steal data. Conficker dates from 2008 and aims to grab login names and financial data. Because the infected systems were isolated from the net, neither Ramnit nor Conficker were able to activate, update and steal data, said RWE. Mikko Hypponen, chief research officer at F-Secure, said power plants and other chunks of a nation's critical infrastructure were often infected by viruses but such compromises did little damage. ""The most common viruses spread without much awareness of where they are,"" he told Reuters. Gundremmingen is about 120km (75m) northwest of Munich and the plant is Gemany's highest output power station.",Computer viruses have infected PCs used at a German nuclear power plant.
"They hope the £680 sign, which is set in concrete, will deter thieves. Previous signs have frequently been stolen but had not been replaced since the last theft three years ago. Villager Ian Ventham said: ""Every two or three years somebody comes along and nicks our sign because, clearly, Shitterton is amusing."" He added: ""Purbeck District Council, not being over-endowed with money at the moment, would merely have replaced it with yet another sign. ""That would have been stolen so we have got together as residents for a whip-round and bought this wonderful piece of Purbeck stone which, at a tonne-and-a-half, is going to be slightly more difficult to take away."" The 62-year-old, who has lived in the hamlet near Bere Regis for 20 years, said it was his wife's idea and said: ""I think we have made our contribution to David Cameron's 'Big Society' now."" Shitterton is recorded in Norman French in the Domesday Book as Scatera or Scetra which, translated, means a little town that is on the stream of a midden or sewer.",Villagers in the Dorset hamlet of Shitterton have got so fed-up with their sign being stolen they have put up a stone version.
