text,summary
"Carr, who plays forensic examiner Clarissa Mullery, was with her personal assistant when the assault happened near London's Euston station. A man has been detained under the Mental Health Act, police said. ""Thanks to everyone who has sent their love and good wishes following last week's stabbing,"" Carr said. ""Just to reassure you that whilst it was very frightening at the time, I came out of it relatively unscathed and was even back home later that night. ""Looking forward to returning to filming on Silent Witness next week where thankfully all the violence is fake!"" The 45-year-old, who uses a wheelchair, suffered minor cuts. Both women were taken to hospital and later discharged. She also tweeted: ""I want to say an extra thank you to the amazing paramedics, ambulance crew & A&E staff #SaveTheNHS."" The incident happened on 10 August. A Scotland Yard spokesperson said: ""A man - aged in his 20s - was arrested at the scene on suspicion of GBH. ""He was taken into custody at a north London police station. He was subsequently detained under the Mental Health Act."" Carr, also a comedian whose recent work includes Assisted Suicide: The Musical, has been using a wheelchair since she was seven. Two days after the attack, her Silent Witness co-star Emilia Fox described Carr on Twitter as ""one of the most phenomenal women alive, thank goodness!"". Carr replied by thanking Fox for ""all the love today and always"". Follow us on Facebook, on Twitter @BBCNewsEnts, or on Instagram at bbcnewsents. If you have a story suggestion email entertainment.news@bbc.co.uk.","Silent Witness actress Liz Carr has said being attacked by a man with scissors was ""very frightening"" but that she was ""relatively unscathed""."
"He said additional staff, including a specialist trauma surgeon, have been recruited to deal with casualties. Every year about 40,000 visitors from all over the world visit the island during the festival fortnight. Mr Quayle added: ""We are expecting to spend between £200,000 and £300,000 to fund extra services during the period."" Every June Noble's Hospital in Braddan sees a peak in the number of people needing treatment for broken bones. ""Numbers vary from year to year but we have brought over a specialist trauma surgeon for two weeks,"" continued Mr Quayle. ""We have also recruited four experienced registered nurses for Accident and Emergency. Some years are relatively quiet and others extremely busy."" ""Huge fan"" In previous years, the TT is estimated by the government to have contributed £19m to the island's economy, with £3.5m heading to the exchequer. On any one day the number of tourists visiting the Isle of Man during festival fortnight can be 25,000. ""It is a great thing for the island and I'm a huge fan myself but we have to realise it does come at a cost,"" continued Mr Quayle. ""Having said that the hospital does an excellent job - I hear nothing but praise.""","The hospital bill for the TT festival is expected to run into ""hundreds of thousands of pounds"", the Manx Health Minister Howard Quayle has confirmed."
"Built in 1797, the Ditherington Flax Mill was the world's first iron-framed building and has been derelict for more than 20 years. Plans have been discussed to develop the English Heritage-owned site to provide employment, housing, social and leisure opportunities. The plans will be on show at the Flax Mill on Friday and Saturday. Planning and listed building applications were due to be submitted in July and it was hoped funding will be secured in time to allow work to start next year. Skyscraper design Various possible sources of funding were being explored for the development, including Heritage Lottery Funding. The Ditherington Flax Mill was used to process flax for 100 years before being converted into a maltings. The mill was built around an iron frame in a technique adapted in the rebuilding of Chicago in the late 19th Century and for skyscrapers such as New York's Empire State Building. English Heritage and architects Feilden Clegg Bradley Studios have been working together with support from Shropshire Council, English Heritage, Advantage West Midlands and the Homes and Communities Agency.",The latest designs for the future of a historic Shropshire mill site have been put on display to the public.
"David CornockParliamentary correspondent, Wales The number of Welsh MPs will fall from 40 to 29 at the next general election as part of a move to reduce the number of MPs across the UK from 650 to 600. The changes are being made as a result of rules that require broadly equal numbers of voters in each constituency. Welsh constituencies currently have, on average, fewer voters than English ones. Changes that would have cut the number of Welsh MPs from 40 to 30 were blocked by the Liberal Democrats during the coalition government after an outcry from Labour MPs. Stand by for a repeat of that row. Today's revised proposals are based on new figures on the electoral register. The average number of voters in each constituency, according to the Office for National Statistics, is 54,300 in Wales, 66,700 in Scotland, 68,200 in Northern Ireland and 70,100 in England. The Boundary Commission for Wales said it would publish ""initial proposals"" for Welsh constituencies later this year, to be followed by a period of consultation. The new map will be drawn with the goal of ensuring each seat has between 71,031 and 78,507 electors. The average size of the electorate per constituency across the UK is 74,769, with the electorate of each constituency having to be within 5% of that - meaning each must have between 71,031 and 78,507 voters. Under the proposals, England will lose 32 MPs, Northern Ireland one and Scotland six to create a smaller House of Commons.",Wales will lose more than a quarter of its MPs under a review of parliamentary constituencies.
"Ruth Taylor, 74, from Fleur-de-Lis, died after she was hit by a car on Pen-y-Bryn Terrace, Pontllanfraith, Caerphilly county, on 9 November. Her family described her as ""the most loving, loyal and generous mother, nanny, wife, sister and friend there was possible to have"". A tribute read: ""She will continue to be a part of us all for the rest of our days."" The crash at 08:25 GMT on Monday involved a blue Toyota Yaris. Gwent Police has appealed for dash-cam footage from motorists who were in the area.",Tributes have been paid to a woman killed in a car crash.
"By Caroline LowbridgeBBC News Naomi Watson had walked up Mam Tor to take photos on Christmas Eve, while Jake Albon had gone there to propose to his girlfriend Chantal Percival. Naomi quickly started snapping when she saw Jake get down on one knee. The couple, from Derby, only realised the photos existed when Naomi posted on Facebook in a bid to identify them. Jake, 28, said it was ""unreal"" to discover the photos, after one of his friends tagged him in the Facebook post to say congratulations. ""It's so nice that someone managed to capture it. It's a great way to end such a strange year,"" he said. ""We've spent more time than ever together this year, at work and at home, and it's been incredible having Chan with me along the way. I really don't know what I would have done without her."" The couple have been together for two and a half years. They met through work as they are both teachers at the same school. Chantal, 35, said the proposal was a ""complete surprise"". ""It was freezing cold and Jake took me to Mam Tor because I like walking,"" she said. ""Despite being with Jake the whole time throughout the lockdowns and difficult year we have had, I still said yes and I am very happy that I did."" Jake managed to capture the proposal on video by pretending he was taking a selfie with his mobile phone. ""He managed to trick me by saying it was a photo, then I realised he had done the video,"" said Chantal. The couple plan to get married in 2022, and hope that the coronavirus pandemic will be over by then. Follow BBC East Midlands on Facebook, Twitter, or Instagram. Send your story ideas to eastmidsnews@bbc.co.uk.",A marriage proposal at a Peak District beauty spot was captured by chance when a keen-eyed photographer spotted the special moment.
"The Technology and Logistics Centre will be the first major business to open at Oldlands Farm Business Park on the northern edge of Bognor Regis. Arun District Council wants to develop the area as part of its Enterprise Bognor Regis initiative. MP Nick Gibb said the centre would encourage other companies to move in. Transfer workers The new centre, due to open in 2016, will have three functions as an inbound warehouse for production parts, a distribution centre and a finished car store and workshop for car preparation. It will employ about 200 people but many of them will transfer from existing locations. Cars will continue to be built at the BMW-owned company's HQ at Goodwood, where about 1,500 people work. Rolls-Royce said the centre would take advantage of the Bognor Regis Northern Relief Road, due to open in 2015. ""This is a significant development and it reinforces our commitment to the area here,"" said chief executive Torsten Müller-Ötvös. ""Demand is growing and we needed to free some space. It gives us freedom to grow further."" Mr Gibb, Conservative MP for Bognor Regis and Littlehampton, said the centre was a major boost to the Bognor Regis enterprise zone bid. ""The very fact that Rolls-Royce is investing so much money in creating a facility three quarters of the size of the Goodwood facility in our town will in the near future encourage a lot of other companies,"" he said.","Luxury car maker Rolls-Royce is planning a new technology centre in West Sussex, eight miles from its main production plant at Goodwood."
"A total of £15m is needed to fully restore Delapre Abbey, in Northampton, which is Grade II* listed. Northampton Borough Council has put in a bid for £284,000 to the lottery fund for the first stage of funding to prepare an application. It will then apply for a £3.5m restoration grant in the second stage. Leader of Northampton Borough Council David Palethorpe said: ""We want Delapre Abbey to be an important landmark on the local and national heritage map and a major attraction that brings people to Northampton. ""Support from the heritage lottery fund would allow us to take an exciting step forward in preserving this really important and beautiful building and its wonderful grounds."" The council has recognised the abbey as its principle heritage priority and pledged to support it with a restoration fund of about £800,000 to encourage other organisations to invest.",A bid for nearly £4m to start work on restoring an 850-year-old abbey in Northamptonshire is being made to the Heritage Lottery Fund.
"Eight organisations have called for action following reports of elephant meat being sold openly in markets. Armed rebels seized power and ousted President Francois Bozize in March after a peace deal collapsed. Wildlife park staff say the security situation is preventing them from searching forests for animal carcasses. The World Wildlife Fund (WWF) said its offices in the protected Dzanga-Sangha area had been looted three times in the past month and it had pulled out workers. 'Fearing the worst' The UNESCO World Heritage Site has been home to an estimated 3,400 forest elephants, which are smaller than those on the African savannahs. But a recent study, lead by the Wildlife Conservation Society (WCS), showed forest elephant numbers had decreased by 62% across Central Africa over the last 10 years. The WCS met with seven other groups, including the WWF and the African Parks Network, on Friday to propose ways for governments to tackle the problem. They said penalties should be increased and better links built with consumer countries such as China and Thailand. It is not known how many elephants have died in the recent spate of killings, which are believed to be part of a wider surge in poaching fuelled by growing Asian demand for ivory. ""Elephant poaching is on the increase and given the fact that Central African Republic for the moment is also in dire straits we are fearing for the worst in terms of people trying to look seriously for ivory,"" said Bas Huijbregts, head of policy for WWF's campaign against poaching in Central Africa. ""Given the total absence of any type of law enforcement and rule of law in the area, there is elephant meat all over the place,"" he told the Associated Press. Representatives from the region's governments are understood to meeting next week to discuss the proposals.","Poachers are taking advantage of instability in the Central African Republic (CAR) to kill more endangered elephants, wildlife campaigners say."
"Gordon Green, from Llanwrtyd Wells, Powys, launched the events after the decline of pony-trekking in the area in the 1970s, hosting other events like last year's World Alternative Games. He received the accolade at the National Tourism Awards in Llandudno marking 40 years' work. ""It's an honour,"" said Mr Green. The World Bog Snorkelling Championship sees competitors swim up and down a muddy trench. But the first event hosted was the Man v Horse race in 1980, which is now an annual event. Gravy wrestling Mr Green stepped down as chairman of not-for-profit Green Events Ltd in 2009 but returned last year to help host the World Alternative Games. Events included worm charming, underwater hockey, gravy wrestling, Russian egg roulette and wheel barrow racing. Thursday night's awards were staged by Visit Wales, in partnership with the Wales Tourism Alliance, saw the Young Tourism Entrepreneur award go to Phil Scott and Tom Ashwell who run RibRide at Anglesey, leading adventure boat tours on Menai Strait. They started the business in 2005 with a single used boat and now have four along with two park-and-launch boat yards, five full time staff, two part time staff and 10 self employed workers.",The creator of bog snorkelling and wife-carrying events has been given an outstanding achievement award for putting mid Wales on the tourism map.
"Infrastructure Minister Phil Gawne applied for £1.7m to stabilise the Victorian structure. The move met with opposition from some Tynwald members who felt the money should be spent on front-line services in health and education instead. Mr Gawne said: ""The suggestion the money should be spent on doctors and nurses is a cheap line to trot out."" He added: ""If this safety work isn't done then ultimately somebody would have to be responsible and that somebody is probably me. ""Quite frankly, I don't fancy a six month imprisonment or £20,000 fine for failing to make this structure safe."" Despite this initial funding the future of the pier is still in doubt as no funds have been allocated to restore it. Friends of the Queen's Pier in Ramsey say restoration would encourage revival in the north of the Isle of Man. The Pier was originally built in 1886 at a cost of about £45,000.",A move to improve the safety of the Queen's Pier in Ramsey has been approved by Tynwald.
"Helen Bailey was found with her throat cut in August 1975. The eight-year-old disappeared while wearing blue clothes and was dubbed ""Little Girl Blue"". An inquest in 1976 heard she may have died as a result of an ""accident or practical joke gone wrong"" and jurors returned an open verdict. But judges quashed it, citing evidence from 2014 she had been strangled. Sitting with Mrs Justice Whipple in London, Lord Justice Hickinbottom said: ""In my view, the emergence of this new evidence may well lead to the conclusion that the truth of how Helen met her death was not revealed at the first inquest. ""I am persuaded that the interests of justice do make a further inquest desirable."" For news and updates from the West Midlands The court heard Helen left her home in the Perry Barr area of Birmingham to play at about 15:30 BST on 10 August. Her mother alerted police when she did not return home and her body was found in woodland the next day. A post-mortem examination at the time identified a cut to her throat as the cause of death. The pathologist found there were no signs of a struggle and the circumstances ""lacked the essential hallmarks of a homicidal attack"". However, the investigation into her death was reopened in 2014, with a pathologist concluding Helen had been strangled before her throat was cut in a ""clear case of homicide"". Lord Justice Hickinbottom said this was consistent with a ""confession"" by one suspect which was investigated by West Midlands Police, but the Crown Prosecution Service decided not to prosecute him. The force asked Birmingham and Solihull senior coroner Louise Hunt to seek permission to overturn the original inquest verdict. Helen's mother, Margaret Bailey, backed a police appeal for information last year. Follow BBC West Midlands on Facebook, on Twitter, and sign up for local news updates direct to your phone.",A new inquest into the unsolved murder of a girl found dead in a wood 43 years ago has been ordered by the high court.
"Joel Elphick, 21, of East Preston, hit a parked car at the junction of Wallace Avenue and West Parade, Worthing, West Sussex, at 04:30 BST on 13 September. German shepherd Vinnie was taken to the scene where he tracked Elphick along four streets to seafront beach huts. Elphick admitted drinking and driving when he appeared before Worthing magistrates last Friday and was banned from driving for 20 months. He was also fined £92 and ordered to pay costs.",A police dog has helped to track down a drink-driver who fled a crash scene.
"The Vauxhall car was involved in the accident on the southbound motorway, near to junction three at Corley, Warwickshire, at 17:00 GMT on Saturday. Formal identification of the driver, a man in his 40s, is yet to take place, Warwickshire Police said. The injuries of the others in the car are not life-threatening, it said. Sgt Shaun Bridle, from the force, has urged anyone who saw the car before the collision to come forward. Follow BBC West Midlands on Facebook, Twitter and Instagram. Send your story ideas to: newsonline.westmidlands@bbc.co.uk",A driver died and three people were injured when a car hit the central reservation on the M6.
"Officers forced their way in to Kasablanca in the Highgate area of Birmingham at 01:00 BST on 24 October. Video posted on YouTube shows officers forcing entry to the smokers' lounge on Moseley Street, with shrieks audible as they disperse the crowds. The venue had broken restrictions earlier this month, police said. Birmingham and the wider West Midlands combined authority area has been widely predicted to move to tier three ""very high alert"" measures as soon as the end of next week, as infection rates continue to rise. In a separate incident, the owner of a venue in Smethwick, West Midlands, has been fined £10,000, after hosting a wedding celebration for more than 70 people. Ch Supt Andy Beard said: ""It's unacceptable that these businesses continue to flout the law, putting lives at risk and increasing the risk of infections as this deadly virus continues to spread. ""This is a difficult time for everyone, but we won't be able to control this pandemic and return to a sense of normality if this continues to happen."" Closed-down venues have their orders reviewed every week by the local authority and owners must prove they are complying with the law before reopening, the force said. Follow BBC West Midlands on Facebook, Twitter and Instagram. Send your story ideas to: newsonline.westmidlands@bbc.co.uk","Police have closed a shisha cafe after finding about 150 people inside, days after the venue was hit with a £10,000 fine for Covid-19 breaches."
"The play, written by Doctor Foster writer Mike Bartlett, is being adapted into a one-off drama for BBC Two. The Olivier Award-winning play imagines Prince Charles's accession to the throne following the Queen's death. Tim Pigott-Smith, who played King Charles on stage, is reprising the role for TV. Charlotte Riley, who has also appeared in the mini-series Close to the Enemy and the film London Has Fallen, said she was ""really excited"" to take on the ""challenge"" of playing Kate Middleton. She said: ""It's such a unique project. To be both modern and rich in verse and to play someone who is real but yet totally re-imagined for this story is an exciting prospect for an actor. ""Kate Middleton is a really interesting woman, particularly within the context of this play, and it is a challenge I am really looking forward to."" Constitutional crisis In the play, King Charles refuses to sign a controversial bill into law, leading to political chaos, a constitutional crisis and rioting in the streets. Pigott-Smith said it was important that the play, which also transferred to Broadway, was filmed. ""It is a drama about us, now, who we are, and the relevance of our monarchy,"" he said. ""Television gives it an important democratic voice."" Other cast members from the stage version also starring in the adaptation are Oliver Chris as William, Richard Goulding as Harry and Margot Leicester as Camilla. Bartlett said the production was now fully cast and is about to begin shooting. ""We have an exceptional team, both in front of and behind the camera, and I'm looking forward to bringing this very contemporary royal tragedy to a national television audience,"" he said. Follow us on Twitter @BBCNewsEnts, on Instagram at bbcnewsents, or if you have a story suggestion email entertainment.news@bbc.co.uk.",Peaky Blinders actress Charlotte Riley has been cast as the Duchess of Cambridge in the TV adaptation of the award-winning play King Charles III.
"The 22 year-old producer and songwriter was the first non-X Factor affiliated signing to Cowell's Syco label in 2010. ""Simon is letting me develop one step at a time. You don't usually see that in X Factor artists, it's usually just one road,"" he said. ""[With X Factor] They squeeze them out quickly."" ""With me he's allowing me to grow because he believes I can do a lot and have longevity, stay around."" Speaking at last weekend's V Festival, he said: ""It's really cool that he's willing to nourish talent. ""I love The X Factor, but I don't need to be in it."" 'Nourishing' talent Labrinth has only released one solo single, Let The Sun Shine, which reached number two in the singles chart in September last year. He produced and co-wrote Tinie Tempah's number one single Pass Out. Labrinth says he's had a busy summer performing at festivals, writing and recording new material. ""I have to do more than all the artists out there,"" he said. ""I'm doing three jobs. They're doing one. ""All they have to do is look good and sing. It's not the easiest thing but I'm sure in the future it'll show the rewards. ""I've done a record with Chase & Status recently. I've been getting mad calls from America. Every artist you can think of in America is on my case."" He also revealed he's recently had dinner with Tinie Tempah and Adele at the restaurant he part-owns in north London. ""I did a record with Tinie and she just came over down to my restaurant to have a meal with us,"" he revealed. ""Adele had the trout. I had the sea bass and a bottle of Châteauneuf-du-Pape.""",Labrinth has said Simon Cowell is giving him more time to develop as an artist than the X Factor graduates on his record label.
"The maiden, the young man and the mother and baby salamander join 10 others all designed by the cathedral's master mason and inspired by psalm 148. ""Carving gargoyles is a rare opportunity for us to express ourselves creatively,"" said Pascal Mychalysin. ""I am sure our medieval counterparts didn't go to art school, so we are carrying on that tradition."" Gargoyles are used to discharge water from the roof and away from the side of a building. 'Target practice' The combination of cold and wet conditions can cause severe damage to the building fabric as has happened in the past to the north transept of Gloucester Cathedral, where the whole facade had to be replaced. Gloucester Cathedral still has some Gothic gargoyles carved at the end of the 12th Century. Sandie Conway from the cathedral said most of the existing gargoyles were headless, due to intentional damage during the English Civil War. She said: ""There is evidence that the gargoyles were used for target practice by the Puritan soldiers and the stonework on the south aisle shows impact holes from musket balls.""",Three new gargoyles have been lifted into position in the south aisle of Gloucester Cathedral.
